,episode,speaker,lines
632,28,Clint," I try it on the other arm this time, the other shoulder. [rolls] And it’s a 19!"
633,28,Justin, It is!
634,28,Griffin, A 19. Fuck yeah. Nothing but net.
635,28,Travis, And we’ve just determined that you are left-handed.
636,28,Griffin," Yeah, Uh you drop it in, and uh, roll that die."
637,28,Clint, Alright. [rolls] 6!
638,28,Griffin," 6, ok. You get the throwing shield--"
639,28,Travis, Augh!
640,28,Griffin," --No. You get a really small capsule, pops out--"
641,28,Clint, Of course.
642,28,Griffin," --that you can hold in your hand. And when you pop it open, there is a pendant, and the icon on this pendant is a little red cross. Almost like a first aid kit symbol. And as you look in the book, under “pendants”, you find a picture of this item with the description, it is the “Physician's Pendant” after causing-- after casting a spell that causes a creature to restore hit points, roll a d20. On a roll of 16 plus, that spell did not cost you a spell slot."
643,28,Travis, Ooh!
644,28,Justin, Oh sweet.
645,28,Clint, Sweet! And what’s it called again?
646,28,Griffin," So any time you c-- “The Physician’s Pendant”. So any time you cast a healing spell, roll a d20, and there’s basically a 25% chance that you get to keep the spell slot."
647,28,Travis," Now, Ditto, let me ask you a question. All of these seem pretty specific to us, do you have twenty different items for each of us that it could be?"
648,28,Griffin," Um, I have a list of items for each of you what it could be. So, Magnus is not gonna get like a wizard shit."
649,28,Travis," Lemme just say, once again, DMing, knocking it out of the park. That’s genius."
650,28,Justin, Excellent work.
651,28,Travis, It’s a really cool mechanic.
652,28,Griffin," Thanks! Um, but honestly, you know what my greatest creation is…"
653,28,Justin, What?
654,28,Griffin, It’s the- everybody’s favourite retail shopping franchise…
655,28,[Travis and Justin gasp],
656,28,"[A musical jingle plays, with Griffin singing", Fantasy Costco! Where all your dreams come true. Got a deal for you!]
657,28,Griffin," You’re in the Fantasy Costco now, that’s that catchy jingle, that chart-topping tune, plays as the sliding doors open."
658,28,Justin, I gotta figure out how to sell ringtones…
659,28,Clint, I think Barry Manilow made that one.
660,28,Griffin," Uh… and a haunting, semi-spectral vision floats up to you, and goes"
661,28,Garfield," [high-pitched, theatrical voice] WELCOME TO THE FANTASY COSTCO, I’M GARFIELD THE DEALS WARLOCK!"
662,28,Magnus, Yes.
663,28,Taako, Fuck me.
664,28,Garfield," WE’VE GOT A LOT OF EXCITING DEALS FOR YOU TODAY, IF YOU’RE WILLING TO PART WITH YOUR COIN!"
665,28,Justin, How many monies do we have?
666,28,Griffin," Uh, you each got eighteen-hundred gold pieces. You got forty-five hundred as your winnings for the race, and you got nine-hundred for the uh… for the lockbox that Travis-- that Magnus beat in a poison drinking contest. And if that doesn’t sound familiar to you, it’s ‘cause it happened five fucking months ago. [Clint laughs] But that was episode one of uh, of “Petals to the Metal”."
667,28,Justin, Uh I also would… don’t we get money from the Bureau? For doing the mission?
668,28,Griffin," Not for this one actually, ‘cause the winnings were illegal, and so like-- they were just like, “why don’t you just take that instead and it’ll be kinda like a fundraising--” [cutoff]"
669,28,Justin," It’s almost like they were trying to like, maintain balance."
670,28,Griffin," Yeah like, that’s sorta their whole thing right. [crosstalk] Like it’s sorta like there in the name."
671,28,Clint, [crosstalk] And doctor the books.
672,28,Justin, [crosstalk] Just kind of juice it a little bit.
673,28,Justin," Okay so uh, I’m looking at a-- just a whole wide array of--"
674,28,Travis," Yeah, this is an amazing list. [lots of crosstalk]"
675,28,Justin," I wanna highlight a couple, just because like, I know we won’t be able to afford this one, but John Williams’ 8-year-old son Colin created the Flaming Poison-- “Flaming Poisoning Raging Sword of Doom”. A steal at just sixty thousand gold pieces-- [cracking up]"
676,28,Griffin," So that one is sitting- that one’s sitting in like a, big ol’ safe with a glass display case, it is a uh, it is an important item here at the Fantasy Costco."
677,28,Clint," “Gigantic blade, wreathed in flames, with a crooked, oozing, scorpion stinger affixed to its point. Deals an extra 20 melee damage.”"
678,28,Travis, I would like to steal that. What do I roll.
679,28,Clint, [Clint laughs] A 40.
680,28,Griffin, Something tells me that would not be successful.
681,28,Travis, M’kay.
682,28,Griffin," So just running down the list, I’m just gonna bust out some of the things cause I know-- I’ll probably post these on the Tumblr, but I don’t think everybody’s gonna read that. Uh… you got a rusted can of Cheerwine, that is sitting on the store shelves, it looks like it’s been through hell, but it seems to be just radiating this vital energy. The one I really like was sent in by Chris Callison-Birch, it’s the “Shield of Heroic Memories”--"
683,28,Travis," Yeah, I’m getting that one."
684,28,Griffin, Okay.
685,28,Travis, Chris did such a good job crafting this item that I- [Griffin Yeah] I can’t not buy it.
686,28,Griffin," Okay well if you’re gonna buy it, read the description ‘cause it’s fucking radical--"
687,28,Travis," “This perfectly round, silver shield initially has a mirror finish. As a hero takes it into battle, it remembers the enemies encountered, gaining a plus 1 to AC on any subsequent battle with creatures of that type. The events of the battle are intricately engraved into the shield’s surface, which has a seemingly endless capacity for detail.”"
688,28,Griffin, Like that’s bada-- that’s fucking radical. And then my boy Chris Callison-Birch took it up another level-- this next part--
689,28,Travis," “The bearer of the shield may also attempt to recount past battles real or imagined to the shield. Upon a DC 10 charisma check or DC 15 bluff check, the shield confers a plus 1 AC against the creatures described in the tall tales. Three failed attempts at recounting stories causes the shield to be cleared of all its memories, the engravings disappear, it reverts to its mirror finish, all bonuses are lost.”"
690,28,Griffin," So this is a shield that remembers shit that you fight, and gives you a plus 1 AC whenever you fight them again. Or you can lie to the shield and say “oh yeah, kobolds, totally fought those dudes”. That’s fucking great."
691,28,Travis, It’s brilliant.
692,28,Justin, Now does that stack?
693,28,Griffin, Whaddya mean?
694,28,Justin," Does it-- If you fight kobolds like twice, do you get plus 2 AC--"
695,28,Griffin," No no no, it’s just- no no no, it’s always just plus 1."
696,28,Justin, Okay. Got it.
697,28,Griffin," Or else that would get crazy. Um, we got Asher Volmer sent in the anti-gravity sphere, which is like a little bomb that you throw, that disables gravity around you."
698,28,Drew Davenport sent this one and I really like it," the “Glutton’s Fork”. “Once a day this fork will allow the user to eat any non-magical item they can fit into their mouth and gain 2d6 points of health.” Just tap on the fork, tap the fork on the item and it will turn edible. "
699,28,"Uh… you got the “Champion's Belt” from Ben C. which lets you once per day, instead of making a wisdom or charisma check, when you would make those checks you can substitute your strength modifier.",
700,28,"“Phone-a-Friend Scrying Bones” from Matthew Wallace, those allow you to cast these bones that allow you to ask me a question, and get like a yes or no answer…",
701,28,"I really like the “Nitpicker”, that was sent in by Tom H., [Clint", That’s what I want.] You wanna buy that? 
702,28,Travis," [crosstalk] Okay good, cause I couldn’t decide if I wanted that or not. I’m glad you--"
703,28,Griffin," Can you read the description for me uh, Merle?"
704,28,Merle," Well, “it resembles a miniature garden gnome that carries lock-picking tools in his hands, and when not in use it’s just this four inch tall statue. But twice a day, it can be placed in front of a locked object to unlock it, and at this point the statue comes to life in order to pick the lock. After the lock is picked, or if he’s not able to open it, it reverts back to the inanimate statue.” Now, “while picking that lock the Nitpicker critiques any or all members of the party [cracking up] on their recent performance in the campaign. Nothing escapes the critical eye of the Nitpicker! No matter how small the perceived offense.” I gotta have that."
705,28,Griffin," That’s fucking brilliant! [Clint Yeah!] That’s fucking good! Uh okay, so you’re gonna buy that."
706,28,"Uh, uh, Samantha Parimba sent in the plastic sheriff badge, uh, it “adds plus 3 to bluff checks when impersonating a person of authority;” I like that, got kinda a psychic paper feel to it.",
707,28,"Got the “Flaming Poisoning Raging Sword of Doom”, from Colin, we talked about that.",
708,28,"Bianca Rodriguez sent in the “No Sodium Salt-Shaker”, which is a salt-shaker, but if sprinkled over food or drink that contains poison, the salt turns a bright shade of pink.",
709,28,"There’s “The Immovable Rod”, this one was sent in by a bunch of people, the first one I saw was Timothy Rena-Feri, the Immovable Rod is actually in The, uh, The Player’s Handbook, “it’s a flat-iron bar with a button on one end, when the button’s pushed, the rod does not move from where it is, even if staying in place defies gravity. Thus the owner can lift or place the rod wherever he wishes, push the button and let go. Several Immovable Rods can even make a ladder when used together, can support up to eight thousand pounds before falling to the ground.” Um, so you just freeze this thing in space.",
710,28,"And then the last one, Eric Atkinson sent in"," “The Diadem of Fabulous Truthiness”, which once per long rest you can cast a free ‘Zone of Truth’, but target a single target rather than a radius."
711,28,"There’s a bunch of other stuff on there also that I came up with, but we’ll get to that if you wanna buy it. If not, that’s the stuff that people sent in. Thank you so much for sending in your suggestions! If it- if I didn’t include yours it’s probably because it was a little bit too complicated for us to use in regular play, we try to keep things fast n’ breezy here or it was um… a joke, and I enjoyed that joke, but it didn’t make the cut.",
712,28,Travis, I would like… the Shield of Heroic Memories.
713,28,Griffin," It’s twelve-hundred GP, you got six-hundred left."
714,28,Travis," And the Glutton’s Fork. Now admittedly, that puts me at nineteen-fifty, but I would like to sell back my old shield for a hundred and fifty."
715,28,Garfield, LET ME SEE IT. LET ME SEE THAT BAD BOY!
716,28,Magnus," This is a Magnus Burnsides, official merch, uh… you could put this up if you open like a, a Rock n’ Roll Hall of Fame, or something like that."
717,28,Garfield," THAT’S NOT A BAD IDEA, YOU BOYS… I SEE YOU INCREASING IN EQUITY BY THE- BY THE ADVENTURE. TELL ME, CAN YOU SIGN IT FOR ME?"
718,28,Magnus, Yes.
719,28,Clint, I hand him my Sharpie of Truth.
720,28,Travis, And I sign it.
721,28,Garfield," OH NO, OH NO DEAR I MEANT IN BLOOD!"
722,28,Magnus," Oh, yeah. That too. Sure."
723,28,Travis, I do that.
724,28,Merle," It won’t be in mint condition, then."
725,28,Garfield," [almost lustfully] OHOHH, I DON’T NEED IT TO BE IN MINT CONDITION."
726,28,Magnus," [alarmed] What are you gonna do with it, Garfield!?"
727,28,Garfield," LEMME JUST SEE THAT BLOODY SHIELD, AND UH… GOOD TRANSACTION! EVERYONE GOT WHAT THEY NEEDED."
728,28,Magnus, Oh no. Am I gonna die?
729,28,Garfield," [cracking up] NO, DEAR."
730,28,Travis," That was Travis asking, I’m terrified of Garfield the Deals Warlock. [laughing]"
731,28,Garfield," WHY, I’M JUST HERE TO SAVE YOU SOME SPONDOOLI, MY MAN!"
732,28,[Clint and Justin laughing],
733,28,Griffin," Okay so um, Merle you’re buying the Nitpicker, that’s nine-hundred GP, which leaves you with another 900 [crosstalk]"
734,28,Clint, What are you gonna get?
735,28,Justin," I dunno, there’s not a lot that’s like… blowin’ my skirt up."
736,28,Clint," Well, I really like the Nitpicker. I really like the- the Phone-a-Friend Scrying Bones."
737,28,Griffin," Oka, yeah, those are cool. That’s five-hundred, so that’s fourteen-hundred-- [interrupted]"
738,28,Clint, Did you want those?
739,28,Justin," No, you go nuts. I will appreciate having some options ruled out for me."
740,28,Clint," Yeah… can I hang onto the rest, or…?"
741,28,Justin, You won’t remember.
742,28,Griffin, Yeah!
743,28,Clint," No, you’re right, I won’t remember… I got four-hundred left? Gimme that can of Cheerwine. I looove some Cheerwine."
744,28,Griffin," Alright. Yeah. You take this can of Cheerwine, and like, you don’t know what it is, but you like… it looks delicious despite the fact that it looks like it literally has been through hell. Like there’s burn marks, and rust all over it. You can only kind of make out the- the logo; you only know that it’s Cheerwine because the uh, the back of the can lists that it was brewed in beautiful Atlanta, Georgia. Probably, I dunno I’m making that up. [lots of crosstalk]"
745,28,Clint, We have one right here!
746,28,Justin," It’s bottled under the uh- it’s bottled in Salisbury, North Carolina."
747,28,Griffin, Oh is it?
748,28,Justin, --manufactured by the independent bottlers… under the authority of Carolina Beverage Corp.
749,28,Griffin," Yeah. So like, you don’t understand those words, but you deduce that this drink that you’re about to slam is called Cheerwine."
750,28,Justin," I’m enjoying a Cheerwine as we speak, it’s fucking great--"
751,28,Clint, Excellent.
752,28,Griffin, I’m fucking super jealous--
753,28,Justin, You know what it’s not as good as?
754,28,Griffin, Quizno’s?
755,28,Justin, [drawn out] Kah-wheezzz-noooos…
756,28,Griffin," Alright as you-as you take a slug of the Cheerwine, and you down that whole can, uh your max HP goes up by 5."
757,28,Clint, Yeah-ah-ha! And that cleans me out!
758,28,Justin," Oh so it’s like good for your digestion too, huh. [everyone laughing] Thank you."
759,28,Clint, Haha! Badaboom!
760,28,Griffin," You’ve got those scrying bones, and you got the.. what? Oh, and the Nitpicker. Okay. And then Taako, you haven’t spent anything yet."
761,28,Justin," Nah, I don’t, um… I want the anti-gravity sphere, and the plastic sheriff’s badge."
762,28,Griffin, Okay. That’s a thousand.
763,28,Justin," Um, and then… tell you what, get- why don’t you throw in that immovable rod. Cause we’re all spendin’ a lot of money here. and"
764,28,Garfield," THAT’S TWENTY ONE HUNDRED MY DUDE, THAT’S A… THAT’S A LOT, DON’T YOU THINK?"
765,28,Taako," [forgetting Taako’s voice] Yeah, I mean… but I have eighteen, so what I--"
766,28,Garfield," MEET ME, MEET ME HALFWAY. MEET ME HALFWAY. LET ME GET THERE… YOU GOT ANYTHING ON YOU THAT I THINK I CAN RESELL FOR THREE HUNDRED GP, I DON’T CARE ABOUT THE PROFIT, MY MAN, I JUST WANNA BREAK EVEN! [Justin laughs]"
767,28,Clint, What about all that silverware you stole from the kid?
768,28,Justin," Yeah, did I ever sell that?"
769,28,Garfield," YOU ALREADY SOLD THAT… I ALREADY BOUGHT THAT UP FROM YOU, MY MAN."
770,28,Taako," You know what, I’m gonna give you-- I’m gonna cut you a great deal. I’m gonna sell you a… a… a comedy prop, that I thought would come in handy that never really came in handy. It’s my, it’s my pocket spa. [Clint laughing] Gonna sell that to you."
771,28,Garfield," YOU BOUGHT THAT FOR LIKE EIGHT HUNDRED GP LAST TIME, I—"
772,28,Taako, It hasn’t really come in that handy--
773,28,Magnus," Get a couple healing potions, too…"
774,28,Garfield," OKAY, WELL, NO, THAT’S—"
775,28,Taako," No I mean, it’s a good point, maybe, there might be a time when I--"
776,28,Garfield," LISTEN, I GOT YOUR BEST INTERESTS AT HEART, MY MAN."
777,28,Justin," Griffin doesn’t put in a lot of rests, so it’s like, not great."
778,28,Magnus, Sell him the poison.
779,28,Garfield, NON-STOP!
780,28,Taako," Oh here, how about the Gust-Master 5000. How ‘bout I sell you that."
781,28,Garfield," ...DIDN’T LIKE THAT ONE VERY MUCH, HUH?"
782,28,Taako, It- it- all it does is cast a spell I can already cast. I don’t like it too much.
783,28,Garfield," YEAH I MEAN IT’S NOT VERY GOOD. I DUNNO WHAT YOU WANT ME TO SAY, THEY CAN’T ALL BE HITS. [Travis and Clint laugh] YEAH ALRIGHT, WE CAN DO THAT. [lots of crosstalk]"
784,28,Clint, Let the buyer beware!
785,28,Taako," So we got a deal, huh, great."
786,28,Griffin," So that’s, you get the… immovable rod, the plastic sheriff badge, and the anti-gravity sphere. You understand the anti-gravity sphere’s a one-time use thingy, you throw it down, and then--"
787,28,Justin, Got it.
788,28,Griffin," --it explodes, and then. Okay."
789,28,Clint," Same thing for the Cheerwine, right? Same thing for the Cheerwine?"
790,28,Griffin, Yeah it’s gone. You don’t--
791,28,Clint, It’s gone.
792,28,Griffin, Yeah it doesn't… you don’t get to keep getting 5 HP. [crosstalk]
793,28,Travis, But you have permanent-- plus 4 hit points?
794,28,Clint," Oh, I know. Plus 5."
795,28,Travis, Alright.
796,28,Griffin," And you’re about to get more, cause it’s level up time, let’s just burn through this shit."
797,28,Justin, Oh my God. Please. I have a life outside of this podcast.
798,28,Clint, [Softly] Not really.
799,28,Travis, I don’t; I love being here. It’s the only time I feel alive.
800,28,Justin," [crosstalk] Great, now I’m bummed."
801,28,Griffin, [crosstalk] So who wants to go first so I can go to your part of the book.
802,28,Travis, I will do it.
803,28,Griffin," Looks like at level 7, you get a martial archetype feature, and at level 8 you get an ability score improvement. So--"
804,28,Travis," Sweet. Also at level 7, I get a thing called “Know Your Enemy” “If you spend at least one minute observing or interacting with another creature outside combat, you can learn certain information about its capabilities compared to your own”."
805,28,Griffin," Interesting. So you can- you can basically figure out if they could kick your ass in any particular department. When you hit 8th level, you can increase one ability score of your choice by 2, or you can increase two ability scores of your choice by 1."
806,28,Clint, I thought this was level 7?
807,28,Justin," This is level 7, right?"
808,28,Griffin, You’re doing 7 and 8.
809,28,Clint, Oh man!
810,28,Justin," Okay, great."
811,28,Griffin," Yeah, big jump. Um so, Trav? Two stats you’re gonna boost by 1, or one you’re gonna boost by 2? You can’t go above 20."
812,28,Travis," Umm… I’m gonna bump constitution from 15 to 16, so that that will… raise that… also a point into wisdom and take it from 10 to 11. See I’ve spent some time on the road--"
813,28,Griffin," So, you get… you get “Know Your Enemy”, two new maneuvers, also--"
814,28,Travis, [surprised] I- I do??
815,28,Griffin," Yeah. Go ahead and learn those off-book, I’ll trust you, cause that’ll take you awhile, I feel like. And you get an additional superiority die. God, you get a lot of shit at 7. Okay, well, in summary Magnus just became more awesome. Uh, go ahead and do your hit-die roll."
816,28,Travis, Okay. And how many do I roll?
817,28,Griffin," Uh, 1d10. And then you add your constitution modifier, so it’s good you just bumped that up. [Travis Yeah] I’ll give you plus 3 bonus both times, even though it should be plus 2 once."
818,28,Travis," [rolls] That’s a 7, plus 3, so 10… [rolls] and that’s a 2 plus 3 so 15 more. Yeah?"
819,28,Griffin," Yes. Yeah. So you got 15 additional extra hit points. Okay and then figure out your other stuff, your maneuvers and all that jazz, and we’ll just, we’ll talk about those when you do ‘em."
820,28,Travis, I’m up to 72 hit points.
821,28,Griffin," Yeah, you’re a baller. And a shot-caller. You’re level 8 guys, it’s about to get tough out there. Who wants to go next?"
822,28,Justin," Uh, I’ll go. I bumped, I have bumped my spell-slots, so I got that all set."
823,28,Griffin," Yeah so at, by level 8, now you can cast fourth-level spells. That’s crazy. You can cast two of em, you get two fourth level spell slots. Uh… you… it doesn’t look like you get anything at 7 except for the spell-slots and then at 8 you also get the ability score improvement so, plus 1 to two stats or plus 2 to one stat. Can’t go above 20."
824,28,Justin," I’m gonna up my… intelligence 1, and my dexterity 1."
825,28,Griffin, Okay. And then your hit dice. 1d6 plus your constitution modifier. 
826,28,Justin," M’kay. Just, er, twice? Do that twice? [Griffin Yup] Ok. [rolls] 5, and [rolls] 8 so 13. Which brings me to 50 hit points altogether."
827,28,Griffin, That’s a beefy wizard.
828,28,Justin, It’s not bad.
829,28,Griffin," And then you learn some new spells but I trust you can do that off-book, too."
830,28,Justin," Yes, I will."
831,28,Griffin," And… yeah but you do learn new spells. And cleric, time… time for the cleric."
832,28,Clint, Yay!!!
833,28,Griffin, I didn’t even know bards were in here.
834,28,Travis, Oh! Is it too late to make Magnus a bard?
835,28,Griffin, Way too late. About 8 levels too late. About a year too late.
836,28,Travis," I’ll get ‘em next time, on the reboot."
837,28,Griffin," Um, so, at 7 doesn’t look like you get anything except for you can now do fourth level spells, and then at 8 you get… wow, you get a lot of shit. Okay. So at 8, you get the ability score improvement, so go ahead and decide on that. You get either plus two to one stat, or plus one to two stats. Can’t go above 20."
838,28,Clint," I wanna put one in wisdom, which kicks me up to 17, [Griffin ‘Kay.] and one in constitution, which gives me 16."
839,28,Griffin," Uh, and then let’s do your hit dice, too, cause it’s about to get complicated. So that’s 1d8, uh, plus your constitution modifier."
840,28,Clint," ‘K, my constitution modifier is 3. Correct?"
841,28,Griffin," Yes, you just bumped it up to 3. And I’ll let you use it both times too."
842,28,Clint, Okay so you said… a d8?
843,28,Griffin," D8, if Justin, you wanna help find that."
844,28,Clint, 7… I already did! C’mon! I’m not a rookie.
845,28,Justin, You got a… where’s your caddy? Dad’s got a die caddy.
846,28,Clint, I forgot to bring my dice caddy!
847,28,Griffin, Oh my God… is it like a pill caddy that you-
848,28,Justin," It’s amazing, um."
849,28,Clint," I- well, I have it, I saved them-"
850,28,Justin," What was the name? You don’t remember? I wrote it down, though."
851,28,Clint, Next time I will praise these people for giving me the dice caddy. It was wonderful.
852,28,Justin, It’s… it’s amazing. It’s literally a pill caddy--
853,28,Clint, A huge pill caddy--
854,28,Justin," A huge pill caddy that has each slot labeled. [crosstalk Clint “Yeah.” Travis “Nice!” Griffin “That’s incredible.” ] See if you can check the irony, of him forgetting to bring [Griffin laughing] the caddy that--"
855,28,Clint," You know what I need, I need a dice caddy-- [Justin repeating] a dice caddy caddy. [crosstalk]"
856,28,Griffin," Or just a man-- or-- I was thinking like a golf caddy, who just like walks around with you, and- and like hands you-- [crosstalk]"
857,28,Travis, Oh! Looks like you should use the d8 today! Got a downhill slope and it’s been rainin’! [Clint laughing]
858,28,Clint, So I do that twice?
859,28,Griffin," Yeah, did you add your modifier to that?"
860,28,Clint," I have a 7 [Griffin you rolled a 7 or you--] plus 3, [Griffin okay, ten] okay, now I do it again? [Griffin Yep] [rolls] A 5, plus 3, so that’s 8."
861,28,Griffin, So that’s 18.
862,28,Clint, So I… So I add 18 plus the 5 from my Cheerwine.
863,28,Griffin, Yeah. Yeah I’m gonna have to start hitting you dudes hard.
864,28,Clint," That’s a 70, that takes me up to 70."
865,28,Griffin," Nice. At level 8, uh, you have a spell I don’t think you’ve used yet called “Turn Undead”. It’s actually not even a spell, it’s a thing you have called “Channel Divinity”. And it’s a thing you can do a certain number of times a day, and it is this area of eff--"
866,28,Justin," I can “Turn Undead” but I can only do it once. [Travis laughs, Clint blows raspberry]"
867,28,Griffin," You cast this spell and, uh, it casts in a 30 foot radius, and it forces undead things to move away from you as quickly as it possibly can. But at a certain point, it also turned into “Destroy Undead”, so if you use “Turn Undead”, any like, particularly weak undead creatures caught in the blast are just instantly killed. [Clint Okay] But, it only affects like really… weak undead creatures. I’m trying to find a way to explain this in non-game terms, ‘cause there’s like numbers n’ shit in the book, but, at level 8, like, it becomes more capable of destroying stronger undead creatures. [Clint Okay, cool] Does that make sense?"
868,28,Clint, Yeah! It makes total sense.
869,28,Griffin," And then, for your nature domain--"
870,28,Clint, Is he talking to me? [Justin snorts]
871,28,Justin, Yes.
872,28,Clint, Okay. Yeah! Makes perfect sense.
