,episode,speaker,lines
873,28,Griffin," Uh… so you learn the spells “Dominate Beast” and “Grasping Vine”; oh shit-- is this really you? Okay. At level 8, Merle, you gain “Divine Strike”. “You gain the ability to infuse your weapon strikes with divine energy. Once on each of your turns, when you hit a creature with a weapon attack, you can cause the attack to deal an extra 1d8 cold, fire or lightning damage of your choice to the target. When you reach 14th level, the extra damage increases to 2d8.” Holy shit. [Justin Niiice.] So every time you attack, every time you attack you can choose to roll an extra 1d8 of, uh, fire, ice or lightning damage."
874,28,Clint, Yeah. Sweet. [Justin Wow.] That’s sweet.
875,28,Griffin, Remember that! Write Divine Strike down on your character sheet!
876,28,Clint," I just did that! I wrote it down! [crosstalk] I wrote it, I wrote it. I wrote it. So how… so how ‘bout my spell slots?"
877,28,Griffin," Yup. You get more of those too. I’ll figure that out too, [crosstalk] but now you can cast 4th level spells; you and Taako just became better at casting spells, and there’s a way-- I think you don’t have to memorize your spells, you just, you have to prepare them from the pool, but Taako does. And I don’t know how that works, but we’ll figure it out. Guys, we’re just playing it by the seat of our butts!"
878,28,Travis, I’ve chosen my attacks. My new maneuvers. [man-yoovers]
879,28,Griffin, And we’ll get to those. We’ll get to those definitely. [Clint starts laughing]
880,28,Justin," Do you have a button prepared, Griffin? Like some sort of like exciting thing at the end?"
881,28,Griffin," Well, no, and I’m just now realizing that, and it’s made me pretty nervous."
882,28,Justin, Okay. Well let me come up with something. I’ll just make something up.
883,28,Griffin," Yeah, please."
884,28,Justin," And then… we-- The three of us have been sitting around. And I don’t know what that would look like from the exterior, but it would look like-- I think it would look like parts of our bodies were just like… growing. [Griffin laughs] For no reason. [Travis laughs] If you were watching from the outside. And then just as like, that’s concluding, there’s a knock on the door. And the door slowly swings open, and there’s uh, behind the door there’s a shadowy figure. [Griffin Oh boy.] And we turn and see the figure, and then we all go like “oh shit”. And then the figure, in a voice that is both masculine and feminine, old and young, says like, “you got that right”. And then credits. [Clint and Griffin laugh]"
885,28,Travis, It’s Samuel L. Jackson.
886,28,Justin," Doesn’t-- it’s both masculine and feminine, old and young. So it sounds kinda like just all voices, and then it’s just like -- we’re like-- “oh boy” and then the voice is like “you got that right again”."
887,28,Griffin," And then, the beginning now, it’s a sneak preview of the next episode, and you look up and-- [Clint “Next time on…”] [crosstalk All the Adventure Zone] and it shows the figure and it’s an old man with a big bushy grey moustache, [outro music starts playing] and he goes uh, “[in hillbilly voice] Well looks like I’m in the wrong room, sorry gang.” And he turns and leaves."
888,28,[theme music plays out to Maximum Fun ad],
889,28,[Next episode],
