,episode,speaker,lines
0,28,The Adventure Zone,
1,28,Dungeon Master & NPCs, Griffin McElroy
2,28,Magnus Burnsides, Travis McElroy
3,28,Merle Highchurch, Clint McElroy
4,28,Taako Taaco, Justin McElroy
5,28,Episode 28 - Lunar Interlude II - Internal Affairs,
6,28,(part of TAZscripts on Tumblr)  ,
7,28,Griffin," Previously, on the Adventure Zone…"
8,28,Johann," Uh… my name is Johann, but nobody’s ever going to know who I am. And that uh… I dunno it just gets to me sometimes, y'know?"
9,28,Taako," Um… as far as you know is there uh, another, like, are there… is there a bad Bureau of Balance… like a Bad Balance…"
10,28,Magnus and Taako, Bureau of Imbalance?
11,28,Director," As far as we know, the rogue wizards, who called themselves “Red Robes”, created all of these uh… weapons of mass destruction; these Red Robes are all gone."
12,28,Griffin," As he falls you see a figure standing behind him, but you can’t really make out its race definitively, because all you can see is a bright red robe."
13,28,Announcer, Who’s ready to do some character management! C’mon guys we gotta do it at some point… It’s The Adventure Zone!
14,28,[THEME MUSIC," ""Déjà Vu"" by Mort Garson (full song on YouTube)] "
15,28,{1,22}
16,28,Griffin," I’m, we haven’t had this situation before where I’ve got, like, a bit of a sinus thing, going on, and so I guess like, interpreted in fiction, everybody at the Bureau of Balance is gonna be sick. Like everybody you talk to today is gonna have a little bit of a head cold or something."
17,28,Justin, Maybe they got a mold thing going on.
18,28,Travis," Oh that, oh, ya hate to see that. That’s gonna cost ya, that ain’t cheap."
19,28,Griffin," Yeah. Once you get that black mold, in these floating moon bases, what you gonna do, you gonna get a floating mold truck up here?"
20,28,Travis, You just gotta move to a better moon base at that point.
21,28,Griffin," That sucks. Um, anyway, the three of you have just returned from your… successful? Mission. Uh, in the-- the Petals to the Metal story arc."
22,28,Travis," Y’know, I feel Griffin, that success is how you define it, we had a good time, we became better friends--"
23,28,Griffin, That’s good. Did you… the latter thing?
24,28,Travis, M’well--
25,28,Griffin," Okay. Uh anyway, you’re in one of your floating balls, and you’ve returned up one of the moon base’s chutes, and have just arrived in the hangar. And as the door to your ball opens and you emerge into the hangar of the Bureau of Balance’s moon base, you see a big crowd of Bureau employees there waiting, silently, and as you step foot into the hangar, they all just explode into uproarious applause. And they’re all cheering."
26,28,Justin, Yeah they do.
27,28,Travis," And is this the kind of thing that happens every time we come back from anywhere, like we’ve grown used to this or is this new?"
28,28,Griffin," Yeah this is just the first time I told you about it… just assume that everywhere you go, whenever you walk in the room, people are just exploding with uproarious applause."
29,28,"No, this is the first time you’ve gotten this particular treatment. And uh, they all look kinda sick. [coughing] And they uh, Avi runs up to you with a bit of a runny nose, and he runs up to you and says",
30,28,Avi," Guys! That was amazing! We were watchin’ all of that! We watched the whole battle wagon race, that was like the most exciting, thrilling thing I’ve ever-- I’ve ever seen; you guys are nuts!"
31,28,Magnus," You didn’t see the part where I used the bathroom before the race, did you?"
32,28,Avi," No no, we were just watching through the pylons, we didn’t… I don’t watch you every time you go to the bathroom…"
33,28,Magnus, OK…
34,28,Avi, I mean… h-h-how would I even… heh heh heh… get my h-h-hands on that kind of technology.
35,28,Taako," Uh, listen did you, did you… what would it have been like if you had only listened to it though, can you imagine."
36,28,Avi," Well no, because like, the sick stunts and jumps and stuff you guys were doing, like that would--"
37,28,Taako," Wouldn’t have been the same, right? Yeah, just… wouldn’t have translated."
38,28,Avi," Yeah, I really liked uh, I liked how you made that one goblin sled go up in the sky and it was like fwoojshh and then you were like “eat this!” and maybe you didn’t say that but that’s how I remember it, and then it like shot into the sky and exploded and all the people on it died."
39,28,Merle," Should we have gotten some kinda payment for that? I mean isn’t there some kinda rights, we didn’t sign anything away."
40,28,Taako," Yeah, that’s true."
41,28,Magnus, You’ll be hearing from our fantasy lawyers.
42,28,Taako," Did you get on our… you’re part of our Patreon, right? You’re paying for this access."
43,28,Griffin, If we keep joking about that it’s gonna-- [Clint laughs]
44,28,Travis, It was streaming on Witch.
45,28,Griffin," What’s that… oh god, that’s good--"
46,28,Travis, It’s like magical Twitch.
47,28,Justin, It’s like magic Twitch.
48,28,Griffin," That was very, very good."
49,28,Clint, Ohhhhh there you go.
50,28,Griffin," Dad, Twitch is a service that--"
51,28,Clint, I know what it is.
52,28,Travis, Do you? Explain it.
53,28,Griffin," Are you up there all the time? Dad’s climbing that Hearthstone ladder today, on Twitch."
54,28,Clint," I do, I’m a Twitcher. I’m a big Twitcher."
55,28,Griffin, I don’t think that’s true at all.
56,28,Taako," That’s cause you don’t get enough potassium, my dude."
57,28,[all laugh],
58,28,Clint, We’re having some fun now.
59,28,Griffin," Avi looks at you, and with a start, he says"
60,28,Avi," Oh! That’s right! The director wants to see you as quick as you possibly can in her chambers. She needs to uh, she needs to dispose of the-- of the relic."
61,28,Magnus, Oh yeah!
62,28,Avi," You should get over there, you should get over there post-haste. She uh… she seemed um, a lil’ upset."
63,28,Taako, Uhoh!
64,28,Magnus, Ehwww…
65,28,Griffin, He sneezes.
66,28,Avi, Sorry ‘bout that.
67,28,Taako, No problem.
68,28,Merle, Bless you.
69,28,Travis, We go there.
70,28,Clint, Haha! We do that.
71,28,Travis," Do you need to play like, some walking music here? Bumb, bum bum bum bum bum, bumb bum bum bum…"
72,28,Griffin," Nah, I don’t wanna over do it with, like, the interstitial tunes--"
73,28,{5,48}
74,28,Travis, I’ll take care of it.
75,28,Griffin, Okay.
76,28,Travis," Bumb, bum bum bum bum bum--"
77,28,Griffin," You make your way to the big, central dome on the far side of the big, grassy quad. And enter into the kind of throne room situation that the Director has set up here. And as she… as you walk in she doesn’t exactly greet you warmly. She says"
78,28,Director, Do you have the belt?
79,28,Taako, Yeah.
80,28,Merle, Uh-huh.
81,28,Magnus, Do YOU have the belt?
82,28,Merle, Yeah!
83,28,Griffin," She sighs. And sneezes a lil’ bit, has a bit of a sniffle. She says"
84,28,Director, DAVENPORT!
85,28,Griffin," And a familiar little gnome-man walks out, carrying a cart with a lead ball on it, with a glass window--"
86,28,Clint," Crowd favourite Davenport, yeah."
87,28,Griffin, [light laugh] He pops the glass window on this heavy ball open and says
88,28,Davenport, Davenport!
89,28,Griffin," And points to the uh, the hole."
90,28,Justin, It was Merle.
91,28,Merle," I have it, I have it. If you mean… the sash…"
92,28,Taako, The… well--
93,28,Griffin, Sash is just a flowery way to say belt.
94,28,Clint, No.
95,28,Taako, Everyone knows that.
96,28,Clint," I whip out the sash. And I walk over to the hole. I look at it, a little doubt in my mind, but I drop it in."
97,28,Justin," Man, I love this fucking, this like meticulous moment to moment-- [Griffin laughs] I love this. I’m way into it."
98,28,Clint, [crosstalk] The sash swirls down.
99,28,Travis, We never should’ve gotten dad those creative writing classes for Christmas.
100,28,[everyone, hard laughter]
101,28,Clint," Alright, I stroll over to the vociferous hole--"
102,28,Travis, Nice.
103,28,Griffin," No, no."
104,28,Clint, No that’s actually a monster in Harry Potter.
105,28,Justin," Okay, the shit’s in the thing."
106,28,[Travis laughs],
107,28,Griffin," Okay, the shit’s in the thing. Davenport uh… winks. Why? And he shuts the glass window [Travis, Justin, Clint laughing] to this heavy ball and wheels the cart back through the door behind the uh, the throne that the Director is sitting on. And then shortly thereafter you see a guard wheel that cart into the large illuminated chamber, that uh, the Director pulls a string and the curtain parts and you can see into this large illuminated chamber. The guard picks up this big heavy ball and places it on a pedestal in the middle of the chamber. He walks out of the chamber and the Director taps her staff firmly on the ground. And suddenly, like you have seen what… three times already? Or is this the third?"
108,28,Travis, This is the third.
109,28,Griffin," Like you’ve seen twice already, the ball is lifted into the air by these beams of light, as dozens of these beams of light just pierce through it, uh there’s a deafening roar, and then the lights shut off, the ball descends back to the pedestal. A guard comes in, picks it up, it’s a little hot, he’s doin’ a bit of hot potato with it, puts it back on the cart, wheels it back in the room, opens it up. And it is--"
110,28,Travis, It’s full of sandwiches!
111,28,Griffin, --Full of sandwiches. You figured out the true nature of the Quizno’s chamber.
112,28,Travis, We solved the Quizno’s puzzle!
113,28,Griffin," That was just gonna be, like, the resolution of arc seven, but you’ve… I dunno how you’ve pierced the veil."
114,28,Travis," You know that this, this whole, whenever this happens, this is hotly discussed in the reddit. In The Adventure Zone reddit."
115,28,Griffin, Oh yeah.
116,28,Travis," Whenever an article-- one of these days I’ll remember to like, draw something on the ball before it’s taken away, like a magic trick where you write your initials on the bullet."
117,28,Griffin," Yeah, sure. But you didn’t this time."
118,28,Travis, But I didn’t this time!
119,28,Justin, Is anyone else like… DYING for Quizno’s now?
120,28,[Everyone in response, hard laughter]
121,28,Justin," I couldn’t even listen to the shit you guys were shitting. Cause I need, Squizza-- and here’s, lemme give you guys a real kicker. All the Quizno’s here closed."
122,28,Griffin, No! What?
123,28,Travis, It’s a Quizno’s ghost town. It’s Quiz-no-where to be seen.
124,28,Griffin, How did that… how did that-- how did that happen? Was there some kind of union strike?
125,28,Justin," Just… if you can’t keep a sandwich store open in Huntington, man, I dunno what to tell ya’."
126,28,Travis, It’s not really a food town.
127,28,Justin," [gravelly] I’m dying for Quizno’s! Please move-- Diffy, give my mind, a fantasy so rich, it can banish the toasty, crunchy, savory taste--"
128,28,Clint, Gooey cheese… mmm!
129,28,Justin, Gooey cheese! [crosstalk] All the flavour of Quizno’s!
130,28,Travis, [crosstalk] This episode sponsored by Quizno’s. [Clint laughs]
131,28,Justin, I wish.
132,28,Travis, [crosstalk] The freshmaker.
133,28,Griffin, [crosstalk] We don’t exist anymore!
134,28,Clint, And we don’t deliver.
135,28,Griffin," Not to cities where we don’t operate, no. I doubt they would do that. [Justin laughs] You have just seen another grand relic destroyed."
136,28,Travis, Supposedly.
137,28,Griffin," Supposably. And uh, the Director looks at you, and she seems… she seems kinda bummed out, a little bit? Like--"
138,28,Travis, I-I give her a hug.
139,28,Griffin," No, she doesn’t really let you get that close to her. She sorta holds up a hand."
140,28,Travis, I look at her
141,28,Magnus, Offer’s on the table. Open invite.
142,28,Griffin," She says-- she says, um"
143,28,Director," I saw the race, um. It was - it was unconventional, but impressive."
144,28,Magnus, Mm hmm.
145,28,Director, Which might as well be the catchphrase for your trio.
146,28,Magnus, Yes.
147,28,[someone snorts],
148,28,Director," I need to know something, and I need you to tell the truth."
149,28,Taako, Okay.
150,28,Merle," Ah, wait."
151,28,Magnus, Yeah.
152,28,Merle, I cast Zone of Truth!
153,28,Taako, No he doesn’t.
154,28,Merle, Ah okay.
155,28,Director, I need to know what happened in Captain Bane’s office.
156,28,Magnus, Ohhh… that.
157,28,Taako," Oh, that was crazy."
158,28,Magnus, Right right right right right. Is there somewhere we can talk about it where there won’t be any prying ears?
159,28,Director ," Anything you can say in front of me, you can say in front of Davenport."
160,28,Magnus," No, it’s not that I don’t trust Davenport, it’s like everyone else on this island thing--"
161,28,Clint, We don’t trust you!
162,28,Director," Okay um, follow me…"
163,28,Griffin," She takes you through another door, to the left behind her throne, the door to the cerebro chamber is to the right… and you follow her into her private room. And she says, it’s her private office and she says"
164,28,Director," Okay please, tell- tell me everything."
165,28,Travis, We do that.
166,28,Justin," I cast Detect Magic. Just to make sure that we’re like, cool."
167,28,Griffin, Alright.
168,28,Justin," If I sense the presence of magic within 30 feet of me, I can see a faint aura around any visible creature or object in the area that bears magic, so it can permenate - permeate stone, metal, lead or dirt."
169,28,Travis," And I cover my mouth a lil’ bit while I tell her, just- just to help out."
170,28,Griffin," Wait, so wait what are you doing, Magnus?"
171,28,Travis, I’m covering my mouth a little bit when- when I tell her what happened.
172,28,Griffin, [pauses] Why?
173,28,Travis, In case anyone’s listening!
174,28,Justin, For cameras. [Griffin laughs]
175,28,Travis, Haven’t you watched football?
176,28,Griffin," Yeah like a coach calling a play, okay sure. Uh, so you’re casting Detect Magic, um… you don’t detect any persons in the room other than yourselves, and the Director. I mean, at this point when you cast Detect Magic, your guys’ shit just goes up like a Christmas tree. Cause you’ve collected, and received from the Gachapon and the Fantasy Costco a number of magic items at this point, that are all lit up. Uh, the Director has some stuff on her, too… behind her desk, there’s actually a really big portrait of herself, and it has some sorta magical property about it. It has uh, sorta illusion magic appended to it. But that’s as specific as you can get with it."
177,28,Justin," I’m gonna do an arcana check, Griffin. Uh, on the- on the painting. And… lemme see what I get [rolls]. It’s a 20! Woah! Nat- natural 20."
178,28,Clint, Nice! A legit 20.
179,28,Griffin," Um, you have knowledge of magic, and uh, you- you do know that there is some illusory magic on this, and just sorta piecing together your knowledge of illusory paintings-- what it could be, it could be-- ethereal, it could be you can pass through it, it could be the actual image depicted on the painting is not what you’re actually seeing, um--"
180,28,Justin," Okay, well while Travis-- err sorry, ummm, what’s his dumb fantasy thing…"
181,28,Griffin, Magnus.
182,28,Justin," Yeah, Magnus, while Magnus-- I feel sometimes, I feel kidnapped by my brothers who’re forcing me to call them cool shit. [Travis laughs] His name’s Travis, folks. Okay, so--"
183,28,Travis, [exaggerated Magnus voice] No! Call me Magn- I’m deep in character now!
184,28,Justin," How dare you. While Magnus is explaining that, I think I’ll go over just to sorta like… like, if I could do this in a way that won’t be hugely distracting, like, sorta sidle up there and poke around in that portrait, see if I get anything else out of it. I’m not gonna distract us, I’m not gonna take us down a weird rabbit hole, just kinda curious."
185,28,Griffin," A’right. Two things first of all, if you’re having a conversation with somebody I’m not gonna let you just do that?"
186,28,Travis, [crosstalk] Well I’m having- I’m having the conversation.
187,28,Griffin,"  [crosstalk] That’s not just a “we do that” moment, that’s an actual conversation. If you wanna do that, Taako, you’re gonna have to make yourself a stealth check."
188,28,Clint," Let- let me do something first, let me distract her with a little magic trick. [Griffin snorts]"
189,28,Merle," Alright, I have 52 cards--"
190,28,Director, [angry] Would you three stop dicking around and tell me what happened in Captain Bane’s office!
191,28,Merle," No, we will not stop. Now I have 52 cards, look at--"
192,28,Magnus," So he poured some- some booze, tried to get us to toast it, we didn’t wanna toast it, uh Taako over there tried to cast Charm Person, it bounced off, then uh, he slammed the booze on the ground, drank one glass of it, it was poisoned with some kind of like, shadow root or something. Shadow thorn, whatever. He died, and then… dude in a robe showed up, I tried to punch him a couple times--"
193,28,Director, A what?
194,28,Magnus," Tried to chop him with an axe, that didn’t-- what?"
195,28,Director," Stop, stop stop. What did he look like, tell me everything."
196,28,Magnus, Captain Bane? He was- I dunno--
197,28,Director," No, I know what Captain Bane looked like--"
198,28,Merle," He had a mask, and he would uh… it looked like a wrestler’s mask, and he had all these muscles…"
199,28,Travis, That’s not… that’s a different Bane.
200,28,Justin, From Batman. They’re talking about the one who visited us-
201,28,Magnus," He was in a red robe, I think--"
202,28,Director, A what?
203,28,Justin," He looked like Orko, from He-Man."
204,28,Director, You’re sure he was wearing a red robe--
205,28,Magnus," Yeah, that much-- cause I tried to punch it a couple times."
206,28,Griffin, She looks flabbergasted. She- she looks completely blown away.
207,28,Magnus, What’s wrong?
208,28,Director, This is… [pauses] The Red Robes are the order that created the grand relics. I warned you about them.
209,28,Magnus, Oh… yeah yeah yeah.
210,28,Director," But they’re- they’re all… but they’re all gone. They shouldn’t be, they shouldn’t be here."
211,28,Magnus, I mean he might’ve been a… g-g-g-ghost!
212,28,Merle, And he is gone now.
213,28,Taako," He’s gone, yeah he’s not here."
214,28,Merle, They’re all gone!
215,28,Director, Did you- did you defeat him or something?
216,28,Magnus, [high voice] Wellll…
217,28,Taako, Oh GOD no.
218,28,Merle, We tricked him…
219,28,Taako," He seemed like he coulda’ wrecked our shop pretty severely, actually."
220,28,Magnus, I couldn’t even punch him.
221,28,Director," What did he tell you, what did, did you have, did you talk to the- to the Red Robe?"
222,28,Magnus," He told us like, be scared, and that we would learn fear."
223,28,Taako, Yeaaahh. We would understand fear. I remember that part. I remember that being scary.
224,28,Merle, Oh yeah! The fear thing!
225,28,Magnus, Yeah yeah yeah there was a whole thing about fear--
226,28,Merle, And being careful--
227,28,Magnus, And then I think he said that the Director should give us a raise.
228,28,Merle," Uh-huh. Yeah. I remember that part too, yeah."
229,28,Taako, You gotta look both ways before crossing the street--
230,28,Merle, Yeah. Close cover before striking. [crosstalk]
231,28,Taako, A lot of good stuff like that.
232,28,Magnus, And then he said that he loved us--
233,28,Taako, No…
234,28,Merle, Stuff about tearing the tag off a mattress?
235,28,Director, Alright. Okay. Alright. Okay. Alright. Okay. Okay.
236,28,Merle," Hey, listen, Taako klept-out on a little bit of that poison stuff that he-- remember, you took the rest of the bottle."
237,28,Taako, Oh yeah! Yeah yeah yeah yeah. I’ve got- I’ve got some of the bottle here.
238,28,Merle, Would that help?
239,28,Director, Why would poison help?
240,28,[Griffin cracks up a bit],
241,28,Magnus," Y’know just like, if you could-- [crosstalk] send it down to the boys in the lab."
242,28,Merle, Would help us.
243,28,Taako, You have a lab here? D’you have a fantasy lab?
244,28,[Clint laughing],
245,28,Director," Um, no it’s in development. Listen, I- I need the three of you to listen to what I’m about to tell you very carefully and-and-- I love your shenanigans, I do, [laughing slightly] I genuinely love your shenanigans."
246,28,Taako, That’s bull-- Zone of Truth on that one.
247,28,[Clint laughing],
248,28,Director," No it’s, I-- you guys are fun to watch. But, if you encounter the man in the red robe again, just- just run away as quickly as you possibly can. If they… if they do some sort of mind control on you, and they figure out what we’re doing here with our operation, that’s- that’s the ball-game, boys. This- I’m not joking about this. If that, that Red Robe person figures out, what we’re doing here, and finds their way up to the- up to our base, that’s it."
249,28,{18,35}
250,28,Magnus," But what if it just turns out to just be like a person in a red robe, having nothing to like-- lowercase Rs. Just like somebody who bought a red robe at a store and is wearing it."
251,28,Director, I suppose that there’s an outside chance that a person bought a red robe and then somehow became a ghost or something…
252,28,Magnus," Well, I would have to punch it to find out, wouldn’t I?"
253,28,Director," Well that sounds like your M.O. anyway. Listen, promise me--"
254,28,Merle, What if it was Hugh Hefner? He wears a red robe all the time..
255,28,[Justin & Griffin sigh],
256,28,Magnus, Good question.
257,28,Director, Promise me. Promise me.
258,28,Taako," Do they… are they privy to the information that the voidfish hid? They’re all like, in the loop, right?"
259,28,Director," They shouldn’t be, no. They shouldn’t be."
260,28,Taako," But they also shouldn’t exist, right? Like, I mean… we don’t know anything about these cats."
261,28,Director, We don’t know anything about these cats which is a good reason--
262,28,Taako, They’re breaking all the rules!
263,28,Director, Another good reason we need to- to act with caution around them. Promise me.
264,28,Travis," I’m just trying to remember if there’s any other important things, that like, we forgot from the last story arc that people will be like “why didn’t they tell ‘em about blah blah blah--”"
265,28,Justin, Why didn’t they tell ‘em about this!
266,28,Merle, Klaarg showed up! Klaarg was there!
267,28,Magnus," Yeah, Klaarg was there, he was--"
268,28,Taako, Do you know Klaarg?
269,28,Merle, Have you met Klaarg?
270,28,Director, What is a Klaarg? What’s a Klaarg even? [immense cross talk]
271,28,Justin," And then-- wait, let me try it- let me try something. And then the three adventurers told her everything [Clint laughing] that would be relevant to what they had just done."
272,28,Director," I’m... I’m, I am--"
273,28,Clint, And it was good.
274,28,Taako, What did you hear just then?
275,28,[Travis laughs],
276,28,Director, I heard you say the three adventurers--
277,28,Taako," No but it wasn’t me, clearly."
278,28,Merle," What? No, wasn’t his voice."
279,28,Director," I’m- I’m sorry for greeting you so tersely earlier. I-- Captain Bane and I were very close friends, [Merle, Taako, Magnus “hmm” together] I just can’t- I can’t believe… I can’t believe he was turned by the thrall of the Gaia Sash. Did you-- did you taunt him with it in any way?"
280,28,"Merle, Magnus, Taako"," No, no--"
281,28,Magnus, I think he was turned before we got there.
282,28,Taako," Yeah, it seemed like a charm. I tried to charm him and whatever had charmed him, must’ve been… uh, to put it mildly, extremely powerful because I couldn’t- I could not charm him myself."
283,28,Director," Don’t, don’t… don’t discount the thrall that these items have baked into them. They’re… the three of you are the only people I’ve ever met, I’ve ever known that’ve been able to resist it."
284,28,Magnus, Yaaaaaaaaay!
285,28,Director," And, to that end, I have something I need to talk to you about."
286,28,Merle, [singsong] Here comes the raise…
287,28,Director," The three of you have saved, single-handedly, I guess six-handedly, saved this organization. And Captain Bane’s betrayal has proven that nobody else- possibly on- on the planet- is capable of resisting this thrall. So, we only had a few other reclaimers in our order and I’ve reassigned them to other jobs. It’s just… it's just you three now."
288,28,Merle, [singing] Promotion!
289,28,Director," Naturally, yes, you will be reassigned to lodging more deserving of your accomplishments."
290,28,Taako, HELL YEAH!
291,28,Magnus, Will Pringles move with us?
292,28,Taako, Yeah Pringles has to come with us or no deal.
293,28,Director, Who is… who’s Pringles?
294,28,Taako," [laughing, Justin cracking up] He’s our roommate who wants us to get Pringles! We haven’t been back in a while… he’s gonna be sooo surprised."
295,28,Merle, Or dead.
296,28,Director, You’re talking about… you’re talking about Robbie?
297,28,Taako," Yeah, Robbie Pringles."
298,28,Merle," Yeah, Robbie Pringles."
299,28,Director," Don’t, um… don’t concern yourselves with Robbie anymore."
300,28,Taako, [gasps]
301,28,Magnus, Oh no.
302,28,Merle, Uh-oh.
303,28,Taako, What happened to Robbie?
304,28,Director," Robbie has been thrown into the brig. We’re- we’re going to be keeping an eye on him for, for a while."
305,28,Magnus, Pringles?
306,28,Taako, Cause he loved Pringles too much? Did he pop and then neglect to stop?
