,episode,speaker,lines
315,34,Griffin," 14 points of damage for Taako. And that's it for the tardigrades. Taako, you are up."
316,34,Justin," I am going to cast... are they still clumped, or what's the deal? How close are they?"
317,34,Griffin," Not really, not anymore. One of them is... they're probably about 10 feet away from each other. One of them has a tongue attached to a big refrigerator, and the other one is sort of still back towards the big pile of debris."
318,34,Justin," Okay, um and how close are they to me?"
319,34,Griffin, They're both about.. They’re about 10 feet away from you also.
320,34,Justin," Then I am going to cast this as a... I'm gonna cast 3rd-level Thunderwave, and hit both of them."
321,34,Griffin, Okay. Alright.
322,34,Justin," So you have to make a Constitution saving throw, [in unison with Griffin] for both of them."
323,34,Griffin," Okay. Uh, 12, we'll say that one was for the one back near the debris, that's not gonna do it. [Justin No.] And then the one at the Roma zone… [dice roll] wow, Jesus, rolled a 7."
324,34,Justin, Certainly not.
325,34,Griffin, No. Okay.
326,34,Justin, So now they're both gonna take—
327,34,Travis, A thousand points of damage.
328,34,Justin, 4d8 Thunder damage.
329,34,Griffin, Fuck me! Wow!
330,34,Travis, Man! Really makes my ax seem not so great. [sigh]
331,34,Griffin, This really isn't Magnus's area to really shine.
332,34,[dice rolling multiple times],
333,34,Justin, 17.
334,34,Griffin," 17 points of damage. Okay, the one that was in the Roma zone, you blast him backwards with your wave of Thunderwave. Doesn't there-, isn't there a push effect, too?"
335,34,Justin," Uh, yes, 10 feet away."
336,34,Griffin," Yeah, the Roma zone one gets blasted backwards, he just collides with the wall, and you see some pink fluid come out of his snoot, and he, it stops moving. Dead. He's dead, he died. The other one that was back towards the pile looks pretty bad off."
337,34,Travis," Magnus yells,"
338,34,Magnus, Push him towards me!
339,34,Griffin," Well, no, you-- I don't think you can choose which way to push him, I think you just push him away— [crosstalk]"
340,34,Travis," Yeah, you can!"
341,34,Griffin, Can you? Can you Thunderwave-pull it? [crosstalk]
342,34,Clint, It's not telekinesis.
343,34,Justin, [crosstalk] I think it would be in a trajectory away from me.
344,34,Travis," Any time I've done push with Phantom Fist, I got to choose where they went. Sorry."
345,34,Justin," You're the one in control of Phantom Fist, Thunderwave is more like an explosion. "
346,34,Griffin," Yeah, imagine like a Fus Ro D ah. You can't be like [mouth noises similar to ‘Fus Ro Dah’ but it sounds like Scooby Doo saying it.]"
347,34,Justin, Fus Ro Dere! Over dere! No! Fus Ro over dere!
348,34,Griffin," Also, all of the debris in the back of the room has also broken up and now this room kind of has like a snowglobe thing going for it, where just like, there's just shit flying around all over this spot. Uh, yeah, so... next in the order is Magnus, you got one 'grade left."
349,34,Travis," I got what? [Griffin One- there’s- Tardigrade.] Oh, gotcha. I'm going to... is there anything I can push off towards it?"
350,34,Griffin," Yeah, you're pretty close to the giant industrial fan blade."
351,34,Travis," Okay, I want to push off that toward the tardigrade."
352,34,Griffin, Okay.
353,34,Travis," And— I'll just say what I wanna do, and you tell me what I have to roll to do it."
354,34,Griffin," Okay. This is the tardigrade that— oh no no no, the tardigrade that just died was the one that was attached to the refrigerator."
355,34,Travis, Okay. I want to grab it and throw it at Merle.
356,34,Griffin, Okay.
357,34,Clint, [sighs] Ugh... hahaha haha.
358,34,Travis, Okay. So I bounce off and I grab it.
359,34,Griffin," Okay, yeah, so he's pretty much right up against the wall, so you push yourself off the fan blade and get to the wall, uh, right next to where he is; that would be a strength contest."
360,34,Travis, Good news!
361,34,Griffin," Yeah, you're real good at that."
362,34,Travis," Yeah, so that’s 16+7… 23."
363,34,Griffin," I got a 19, which would've been good against a mortal man… "
364,34,Travis, Yeah. Except I work out every day.
365,34,Griffin," Yeah, you get those fucking sick gains for throwing microscopic science creatures."
366,34,Travis, Yeah. So I throw him at Merle.
367,34,Griffin," Okay. You chuck 'im real good. You chuck 'im real, real good. Now Merle, you got a fuckin' fastball special coming your way—"
368,34,Travis," Well, so, it's going to enter the Roma zone for the first time."
369,34,Clint, Exactly.
370,34,Griffin," Oh, yeah, okay!"
371,34,Clint, Yeaaaaah!
372,34,Griffin," Yeah, so that— we don't even need to get to that turn. What does he do? Wisdom saving throw?"
373,34,Clint," He has to make a Wisdom saving throw, yes."
374,34,Griffin, [dice] 21.
375,34,Travis," Ohhh, snap! Sorry Merle!"
376,34,[group cackling laughter],
377,34,Justin," Fuckin' smart tardigrade, huh? Smartigrade, if you will."
378,34,Griffin," He had a stroke of, he had a flash of genius."
379,34,Justin, Does he not still have Disadvantage?
380,34,Griffin," He does on attacks, not on Roma avoidance. [laughter] Not on angel-dodging."
381,34,Justin, Roma has a way of short-circuiting all of our defenses.
382,34,Travis," I get, I have a special called Commander Strike. So for my second attack, I'm actually going to Command Merle to attack, uh, make a weapon attack, and then I add my Advantage, uh my dice to his damage."
383,34,Griffin," Okay. Yeah, this thing is going to be in melee range of Merle, definitely. So wait, I don't— what the fuck, you're like pulling— you're controlling his mind?!"
384,34,Travis," No, I'm basically saying like, 'Attack that guy!' And then he's using my second attack to do it."
385,34,Griffin," Interesting! That's neat! Okay. So Merle, make a— [crosstalk]      "
386,34,Clint," That's great! It's working out as well as the first part, I hope!"
387,34,Griffin," Merle, make a melee attack against this waterbear."
388,34,Justin, If only you still had your Romper Room ax.
389,34,Clint," I've got little Choppy, my real ax."
390,34,Justin, Li'l Choppy...
391,34,Griffin," I don't know how many times I have to tell you, you don't have an ax. You got that battle wrench— [crosstalk; Travis You got a hammer!] you got the battle wrench, you got your war hammer."
392,34,Clint, I have an ax! I've had an ax from the beginning!
393,34,Travis," No, I have an ax! That's my steeze!"
394,34,Justin," Ehhh, I think Dad has an ax."
395,34,Clint," Alright, I'll hit him with my war hammer, but we will discuss this in the off-season."
396,34,Travis, [crosstalk] We'll talk about this in the ‘Adventure Zone’ zone.
397,34,Griffin," You had an ax— we'll talk about how, how, just, like, loosey-goosey you are with your belongings. [laughter] C'mere, Scuttle Buddy! Bye! Get on that train to hell! See you later! Axe! Oh, axe, I found you, I love you— bye, I threw you into a monster's mouth and he turned it into shit."
398,34,Clint," And I'm gonna get an apology in the next episode from you, because—"
399,34,Griffin, [crosstalk] That seems very unlikely—
400,34,Clint," —I am right, and you are wrong. [Griffin that seems super unlikely.] All right, I'll hit him with my warhammer. Do I get to name that?"
401,34,Griffin," Yeah, if you want!"
402,34,Clint, Smoosher. [dice roll]
403,34,Griffin," Okay. I feel like you've already busted that out, but..."
404,34,Clint, Okay. What did I just roll for?
405,34,Griffin, [exasperated] Oh my gosh.
406,34,Justin, Hurting.
407,34,Clint," 17, and none of my modifiers..."
408,34,Travis, That's what the plus 3 is.
409,34,Clint," Okay. 17, then."
410,34,Griffin," Yeah, that's a hit."
411,34,Travis," Excellent. All right, my superior dice— [dice roll] so whatever your damage is, plus 4."
412,34,Clint, Okay. 5 plus 4.
413,34,Griffin," 9 points damage? [Clint Okay.] Okay, yeah, you guys basically just did a, like a quick little baseball game."
414,34,Clint," We need to name it something, Trav."
415,34,Griffin," In this zero— yeah, you guys have just invented a new hot zero gravity waterbear sport."
416,34,Justin, That only works on smart ones.
417,34,Travis, Yeah.
418,34,Griffin, Yeah. [crosstalk]
419,34,Travis, —Smart Waterbear.
420,34,Griffin," You, yeah, you club this thing with your bat and you hear it grunt and cry sadly and some pink juice comes out of it, and it hits the wall and is dead."
421,34,Clint, We just Joey Votto'd that thing.
422,34,Justin," I'm not gonna have a bunch of people tell me I missed another great Travis joke, so Travis, Smart Waterbear is a very funny joke."
423,34,Clint, Yes it is. That is good. [crosstalk]
424,34,Travis, Thank you. Thank you very much.
425,34,Griffin," What, just because Smart Water is an extant product?"
426,34,Travis, Yeah.
427,34,Justin," But Smart Waterbear, and it was a smart waterbear."
428,34,Clint, [Commercial voice] This portion of Adventure Zone brought to you by Smart Water.
429,34,Justin, So Smart Waterbear.
430,34,Clint, And Gummi Bears.
431,34,Griffin," [PSA voice] Also the National Bear Council. Hey guys, can we chill out a bit on bears?"
432,34,Travis," [PSA voice] Hey, let's be cool on bears for two seconds."
433,34,Griffin," If you see a bear, it's time to fuckin' go, man."
434,34,Travis," Get out of there! That's the bear's house! Unless the bear's in your house, then call somebody. Don't try to take care of it on your own."
435,34,Clint, Wait a minute. Let's not gloss over the fact that we just won a battle.
436,34,[BACKGROUND MUSIC, “Competent Battle Fanfare” by Griffin McElroy (full song on SoundCloud)]
437,34,Travis, Yeah! And like- legit won!
438,34,Clint, Cuz that doesn't happen all the time!
439,34,Justin, Normally a much better equipped woman has to come in and save us. [Clint laughs] That's typically the way we do it.
440,34,Griffin," All three tardigrades burst open, and a million baby tardigrades swarm out—"
441,34,"[laughter, as the song “Competent Battle Fanfare” continues]",
442,34,Travis," Now, they are eggs, and it takes 14 days for the eggs to hatch [Griffin loses it, clapping] —do your fuckin' research!"
443,34,{32,35-3829} [commercial break]
444,34,"[Transition music, “Competent Battle Fanfare” plays]",
445,34,Griffin," You've exited the zero-gravity room and made it through the airlock into what looks to be the main lobby of the lab. Which isn't crystallized. It is still in its normal, labby form. And there's a bunch of different airlocks leading to a bunch of different chambers from this like central hub. You can see an airlock leading to the main entrance of the lab— [Clint laughs] — what's wrong?"
446,34,Clint," I'm just thinking this is like our bottle episode, where we just re-use the airlock set over and over again."
447,34,Griffin, Yeah.
448,34,Clint," Just a little, just hang a different sign on it."
449,34,Griffin," Yeah, this is basically like old school Doctor Who, like, I've only got the one airlock. Uh... one of them is labeled to head to the main entrance, and that airlock is actually shut down, it's powered down. There's another airlock on the opposite end of the room that you can't really make out, that's also powered down. There is the airlock you just came from. There are three airlocks leading to the med bay, one leading to-- one labeled to go to the main elevator, and one heading to a room called Cosmoscope. And then right next to you, right next to the door that you just exited from, is the airlock leading into the Thermal Regulation Chamber, which also has a layer of ice around it. But as you enter into the room, you hear coming from that door, you hear some banging and shouting and chopping coming from that iced-over door."
450,34,Travis, I start chopping too!
451,34,Griffin," And you— Okay. Yeah, you get your ax out and start chopping on the other end of it. You guys hear Killian and Carey going,"
452,34,Carey," [muffled, like Griffin is speaking into a plastic cup] Merle? Taako? Magnus, is that you guys?"
453,34,Magnus, Is that you guys?
454,34,Carey," Yeah, it’s Killian and Carey, we-"
455,34,Magnus," Oh, I was thinking of different guys."
456,34,Carey," No, no, no, we’re... can you help us get out of here? We've been chopping at this ice wall for forever."
457,34,Magnus, I'm chopping too!
458,34,Carey," Okay, let's just hurry, we're running out of time!"
459,34,Magnus, [sing-song] Hackin' and whackin' and slashing...
460,34,Clint, I get my ax ready so I can help him.
461,34,Griffin," [exasperated] You don't have an ax. You hear,"
462,34,Carey," Taako, Taako, do you have any like fire stuff you can do? We’re like, really up shit creek in here. [crosstalk]"
463,34,Magnus," [annoyed] Oh, sure, what good is an ax when there's MAGIC around?"
464,34,[Griffin laughs],
465,34,Taako," Yeah, everybody step back."
466,34,Clint," I got fire! I got fire, you want me to use... [so much crosstalk]"
467,34,Travis, You guys have fun! 
468,34,Justin," Yeah, go for it, my firearm is a little—"
469,34,Clint," Well, so you don't, you know, burn a spell..."
470,34,Justin, Sure!
471,34,Clint," And since I don't use mine right. Okay, I cast Sacred Flame on it."
472,34,Griffin," Okay. Uh, Sacred Flame is sort of fire of a divine origin. I, the, you—"
473,34,Clint, I'm a divine guy.
474,34,Griffin, I know this. I know this very much about you.
475,34,Clint, Would radiant damage not help?
476,34,Griffin," Uh, no, but you did teach the ice a quick parable about Pan and his divine guidance."
477,34,Justin," Okay, fine, I'll use Fireball. Fuck."
478,34,Griffin," Okay. Yeah, you blast the door with Fireball and Magnus, you're chopping away with your ax... Merle, you hear a voice in your head. You hear a whisper come from behind you."
479,34,[Ominous music; if you know the track name please add! {41,27} ][a][b][c]
480,34,Travis, [sinister voice] Kill again.
481,34,Clint, [snickers]
482,34,Griffin," No, it’s, uh… the voice sounds like,"
483,34,Whisper," Merle... Merle, behind you. Merle... Merle [laughs]... dammit, Merle, look behind you!"
484,34,Clint," Uh-uh, nope."
485,34,Whisper," Merle, it's Pan, look behind you! You fool!"
486,34,Clint," All right all right, I turn around and look behind me."
487,34,Griffin," You look behind you while everybody's busy get-getting to this door, heeding this voice that apparently only you can hear, and you see a small rift open in space, and you see the crystal with the white fire starting to come through it. And that voice says,"
488,34,Whisper," Merle, listen, you have to trust me. It's me, Pan. You have to grab the crystal. Grab it with your hands before it touches the ground! You can stop this room from getting crystallized! You can save your friends! Grab the crystal!"
489,34,Clint, [skeptical] Hmmmmm...
490,34,Griffin," And the thing's starting to pop out of this rift-womb, and make its way out."
491,34,Clint, Well! That certainly is a conundrum. [pause] All right! I grab it.
492,34,[Justin gasps],
493,34,Griffin," Okay. Yeah, you catch the crystal before it drops to the ground. Yeah, the rift closes up, and nothing gets crystallized, as you grab this white fiery crystal. And as soon as you grab it you hear that voice again, and it goes,"
494,34,Whisper," [changes to Cockney accent] Oh, well, this is gonna be a lot easier than I thought!"
495,34,Griffin," And you hear a sound like a light bulb shattering as the crystal in your hand just kind of, kind of shatters and fractures into splinters, and you feel a sharp pain in your hand. And that sharp pain is kinda replaced by this strange numbness. And as you open up your hand, you realize that you have a few little needles of this crystal sticking out of your hand."
496,34,Clint, Okay...
497,34,Travis, [singing] Choppin' away at the door...
498,34,Griffin," And your hand is starting to get— starting to change. Hand is actually starting to turn— turn— the suit, I should say, around your hand and your arm, you can feel it, like it hurts a whole bunch. I can't even describe how bad it feels. But yeah, your hand is starting to turn into pink tourmaline."
499,34,Travis, [overlapping] I turn around and chop it off.
500,34,Clint, Hey wait!
501,34,Griffin," Okay... yeah, it's grown up to his forearm... how do you, I guess my question is, how would you know...?"
502,34,Travis," Well, he's probably screaming by this point. Unless he's just like super cas’ [short for ‘casual’] about the whole arm turning into crystal thing. ""Huh, that's weird!"""
503,34,Clint," What's turning into crystal, the suit, or my arm?"
504,34,Griffin," All of it. The whole kit and caboodle. It's growing up, it's up your wrist now, it's about halfway up your forearm."
505,34,Clint, Would it help if I took the suit off?
506,34,Griffin," It's like, already in your body, it seems like?"
507,34,Clint, Okay!
508,34,Griffin, It's going up ya. [Clint Okay—] It's about to your elbow now.
509,34,Clint," I turn and say with a calm but manly voice, "
510,34,Merle," Uh, Noelle? Check this shit out!"
511,34,Noelle," Oh my god! Guys, he's crystallizin’!"
512,34,Travis, I turn around and chop it off! [Noelle GUYS!] I chop it off!
513,34,Clint, Quit chopping me off!
514,34,Travis, I'm gonna chop it off!
515,34,Clint, No!
516,34,Magnus, Let me chop it off!
517,34,Justin," Travis, that seems like a very personal character choice you're making for Dad right now. I don't think you should decide whether or not he wanders this earth as a one-armed dwarf."
518,34,Travis," No, I'm— but I want you to know that Magnus, in character, is screaming, ""Let me chop it off!"""
519,34,Justin," That's fine, but you can't say you chop it off!"
520,34,Travis," I'm saying that in character, I have a history of arm removal."
521,34,Griffin, [cracking up] I will give Travis Advantage on this roll. He is an arm removal specialist.
522,34,Clint," Wow, that's a really good point."
523,34,Taako," Merle, do you want me to freeze it? Maybe I should freeze it?"
524,34,Merle, I don't know if freezing it would do any good!
525,34,Taako," I mean, it's better than chopping it off—"
526,34,Merle," Wait, is that all Noelle did? You bitch at us for not using her and then I try to use her and she just goes ""Oh, poopie!"""
527,34,Noelle, Well I can't–I can’t like... I can't anti-crystal you! Somebody do something!
528,34,Merle," Chop the damn thing off! Chop it off! Just chop it off! I don't care! [Travis Yeeeeaaahhh! I roll— I roll a 15!] Chop it off! Hey, wait, no, I got an idea! Chop my head off! Then I won't suffer! [Griffin laughs] Here, chop off— here, right here, chop it off here! Leave the tattoo—"
529,34,Travis," I rolled 15 plus 7, 22."
530,34,Griffin, Okay.
531,34,[laughter],
532,34,Clint, You're chopping off my damn arm! Seriously!
533,34,Griffin," Noelle floats over to you, Merle, and opens up your helmet and puts a little wooden spoon in your mouth."
534,34,Noelle," Bite down on this, you're not gonna like this next part."
535,34,[Justin is laughing so hard he’s snorting],
536,34,Merle," Why did Pan lie to me?! [Griffin starts to interject; Justin is dying of laughter in the background] Oh, it wasn't Pan, was it. Shhhhit."
537,34,Griffin," And that is your last thought as a two-armed man, as Magnus brings Railsp— Magnus brings Merlesplitter down just above the elbow, and you hear a grisly cra- cra-snump."
538,34,[Justin is just completely losing it in the background],
539,34,Clint," Wait wait wait, at least below the elbow, come on. Not above."
540,34,Griffin, He actually very artfully carves it just about where the crystal was—
541,34,Travis, I'm really good at this!
542,34,Griffin," Yeah. And uh, go ahead and roll damage, Magnus."
543,34,Travis," Okay. Let's see... two-handed... [dice] That is 7 + 6, so 13."
544,34,Justin," I feel like damage should be reduced, though. Because it's, he's not aiming to cause damage to Merle."
545,34,Clint, I don't want him to half cut off my arm!
546,34,Justin," I guess, but like— okay, well, I guess that's true, yeah. All right."
547,34,Clint," Matter of fact, when he brings the ax down, I'm throwing the arm up in its direction. I'm leaning into the chop."
548,34,Griffin," [laughing] Okay. ""Whoosh! Clink clink clink!"" Your arm falls to the ground, and Merle, make a constitution saving throw just to see if you can like, stay conscious during all this. 'Cause this is like— [crosstalk] This is fucking—"
549,34,Clint," No! I don't wanna be conscious! I don't wanna look down and see my arm! [crosstalk] No, I'll do it. Constitution. [dice rolling]"
550,34,Justin," This'll be a sick roll. You watch this. Nat- Natty 20, I can smell it."
551,34,Clint," No. Look at it, Juice. Look. What is it?"
552,34,Justin, That's a critical miss.
553,34,"[Travis laughs, lots of crosstalk]",
554,34,Clint, It's a one.
555,34,Justin, Blacks the fuck out.
556,34,Griffin," You're down for the count. Merle is unconscious now. He just falls backward, sees what's just happened and faints. And Killian and Carey have just, like, gotten through the ice and look over like,"
557,34,Killian," Oh, I'm so glad that you guys— WHAT THE FUCK?!"
558,34,Travis," Step two, somebody heal him."
559,34,Noelle," I don't have any— my med— my med spray ready yet! Ah, shit."
560,34,[Various 'ah shit' reactions.],
561,34,Griffin," You hear Lucas say,"
562,34,Lucas," What just happened?! You're close to the med bay, bring him in! Did you just cut his fucking arm off?"
563,34,Magnus, … Yes.
564,34,Clint, [moans]
565,34,Travis, I pick him up and I run in the med bay.
566,34,Clint, [sobbing moans]
567,34,Griffin, You pick him up Rescue 911 style and run him over to the med bay. Maybe singing a sweet lullaby to him? 'Cause he's scared?
568,34,Travis," [sings] Oh shiiiiit, sweet fliiiiiiips..."
569,34,Clint," Wait a minute, who's carrying me, the guy that just chopped my arm off?! Or the guy that just let it happen?"
570,34,Griffin, You basically just begged him to.
571,34,Justin, It happened really fast.
572,34,[laughter],
573,34,Justin," In fiction it happened really fast. I don't know how— uhhh, I will, as we're running, I mention to Merle that if we need a new arm, the good news is, he's got lots. [Travis Yeah.] So if we could figure out a way to make that work? That would be rad."
574,34,Clint," [snide] Yeah. I'm unconscious, thanks."
575,34,Justin," Now, I'm not—okay, that's not what unconscious people say, but let's keep moving."
576,34,[laughing],
577,34,Justin," [Rodney Dangerfield voice, maybe?] ""Hey, if you were lookin' for input from me, you're not gettin' it, 'cause I'm out of it!"""
578,34,Travis," ""I'm totally unconscious over here! Nothing to add!"""
579,34,Justin," ""I'm unconscious as hell!"""
580,34,Griffin," Your whole party, the three of you— Merle, you're unconscious— with Noelle and Carey and Killian, rush in through the airlock towards the med bay as just chunks of this room that has become crystallized start to break up and start to— it looks like this thing is self-forming again, but you don't really stick around long enough to watch it put itself together into some sort of grisly monster."
581,34,Travis, With Merle's arm floating in the middle.
582,34,Griffin," Yeah, Merle's arm is actually part of the mix. You see this thing using Merle's arm as part of its form, but you don't really see how it ends up in the production. And yeah, you hoof it through the med bay. As you go through the airlock, before you actually get into the med bay, you reach a sign that says, “Decontamination Chamber,” and as you open it up, it's actually a pretty small chamber that has some medical equipment in it, and what looks like an observation bay, but this whole room has also been completely crystallized."
583,34,Travis," Ah, bummer."
584,34,Griffin," And as you pass through that, and through another airlock, you do actually make it into the med bay, and there you see Lucas, for the first time since you met him in the voidfish's chambers."
585,34,Magnus," Lucas, fix my friend! I don't know what happened!"
586,34,[wheezy laughter],
587,34,Griffin," Lucas— Lucas has a big bandage on his head? He has a big, like, bloody bandage on his head? But he says, like,"
588,34,Lucas, What did you do to that dwarf?!
589,34,Magnus, Well—
590,34,Taako, You said you needed us to give you a hand!
591,34,"[Travis, Clint, and Justin all do comedy ""Ah!"" reactions]",
592,34,Lucas," Seriously, what did you guys—"
593,34,Griffin," Before he can finish that sentence, Killian actually grabs him and picks him up. And is like,"
594,34,Killian," This has been the worst, shittiest day ever, we are two people down, your lab SUCKS."
595,34,Magnus, Fix my friend!
596,34,Lucas, You better put me down if you want me to help him!
597,34,Magnus, Killian...
598,34,Griffin, Carey's like
599,34,Carey," Yeah, guys, can we take this thing— just bring it down just a little bit, let's figure out how to help Merle out right now."
600,34,Clint," Meanwhile, bleed bleed bleed bleed bleed!"
601,34,Griffin," Lucas grabs him like,"
602,34,Lucas," Help me put him up on this table. Magnus, use your big strong- your big strong- [Travis Fishlifters.] arm-removing arms—"
603,34,Travis, I do it.
604,34,Lucas," How ironic that your big strong arms are only good at one thing, and that's removing other people’s arms."
605,34,Magnus, Yeah. It's very ironic.
606,34,Travis, I put him on the table.
607,34,Griffin," Okay. Yeah, he starts to rustle around in a drawer—"
608,34,Travis, Full of spare dwarf arms...
