,episode,speaker,lines
609,34,Griffin," It's full of spare dwarf arms, and he just like, sticks one on, and you're just fine. Uh, no, he actually pulls out a syringe and jams it into Merle's arm, um, and you— it regrows. No. It’s, uh... The bleeding starts to slow a little bit, Merle, you actually wake up a little bit, you gain a little bit of consciousness as you feel this needle go into you—"
610,34,Merle, AAAAAAAH SHITTTT!
611,34,Griffin, But.. the… I can't tell if that was real or not.
612,34,Travis, He’s a very good actor.
613,34,Clint, That's 'cause I'm an actor.
614,34,Griffin," It was really terrific. But this thing is actually numbing your grisly wound pretty significantly. It's bringing you some pain relief. Not so much HP relief. But you're not in a horrific amount of pain anymore. And Killian's in the corner, she's using, she is speaking to the Director through a stone, and just like checking in, letting the home base know the situation, and Lucas asks, like,"
615,34,Lucas, What has been goin' ON out there?! What are you guys doing? What happened to Merle?
616,34,Magnus," Well, he uh-"
617,34,Merle, I got disarmed.
618,34,Travis, That's pretty good.
619,34,Magnus," He started to crystallize, we were chopping on a door and magicking a door, then we heard Noelle scream, then we turned around, his hand was turning to crystal, and then his arm was turning to crystal, and I heroically - valiantly - chopped his arm off, against my wishes— he begged me— and I cut his arm off so that he wouldn't all crystal. And..."
620,34,Taako," Hey, listen, let me stop you right there. Lucas isn't your dad. You chopped your dad's arm off. You don't owe Lucas any explanation. Get us the fuck out of here!"
621,34,Merle," [slurred, moaning] You dirty prick, I can't believe you did this to me! "
622,34,Magnus, And now he's drunk.
623,34,Merle," Oh the pain, kill me!"
624,34,Lucas," I can’t- We can't get out of here, we can't get out of here until we manage to stop the base from sinking into the sea and crystallizing the whole world. Did you forget why we're here in the first place? 'Cause I— well, I—"
625,34,Magnus," Oh, yeah."
626,34,Taako," It's been like four episodes, my dude."
627,34,Lucas," It's because I fucked up an experiment pretty bad. But we— that's not, this, the arm thing's not on me, I don't think!"
628,34,Magnus," Well, it was crystallizing—"
629,34,Merle, I blame that on everybody! [woozy laughing]
630,34,Magnus," Merle, can you hear me?"
631,34,Merle, [woozy laughing] Yeah?
632,34,Magnus, Why was your arm turning to crystal? What happened?
633,34,Merle," [slow, gasping] God... lied."
634,34,[Griffin loses it],
635,34,Magnus, God lied to you?
636,34,[Justin laughing],
637,34,Merle," [slow, slurred] God liiiiiied to meeee. You have the prettiest eyes."
638,34,Magnus," Okay, yes I do, but focus up, what do you mean, God lied to you?"
639,34,Merle, I'll say it a different way. Godddddddddd liiiiiiiiiiied toooo meeee.
640,34,Travis, I turn to Lucas.
641,34,Magnus," Well, there you have it."
642,34,Lucas," Okay, I guess God lied to him, that's what I'm picking up from the situation."
643,34,Merle," And then some British guy [slurs] threw a crystal at me, and I grabbed it, and it hurt."
644,34,Magnus, Some British guy...
645,34,Lucas," No, I heard all of that, um, okay... I, I, it's that being. It's that being that's been attacking my lab. I don't know what the fuck that thing is, but I'm so sorry that you guys had to get mixed up in this. I didn't want any of this, you have to believe me."
646,34,Merle, I think it was that guy that was married to Katy Perry. [Travis Russell Brand?] It sounded like that— Russell Brand. It sounded like Russell Brand took my hand. [wild laughter]
647,34,Magnus," Lucas, is Russell Brand here?"
648,34,Lucas," No, he's not, hold on—"
649,34,Griffin, He rustles around and gets another syringe out and gives Merle another shot.
650,34,Merle, In my butt! Give it to me in my butt!
651,34,Griffin, As you shout 'give it to me in my butt!' [Clint laughs] you feel much more sedated.
652,34,Magnus," There's a lot of shit going on, Lucas, [Merle snores loudly] that I feel like you're not being honest about? [Lucas You’re right, I--] Like this— compact—?"
653,34,Lucas," Oh, god, you went in my room?"
654,34,Magnus," I did, it was a fucking mess! And it looked like somebody stole all your gems before we got there."
655,34,Taako," Clean your shit, dirty boy."
656,34,Lucas," Wait, what?"
657,34,Clint, Bleed bleed bleed bleed bleed.
658,34,Lucas," All my gems are gone? Listen, let’s- priorities! I'll explain the compact, I'll explain what you saw in there, I'll explain everything— we gotta get this guy taken care of!"
659,34,Magnus, He'll be fine! Tell me about the compact!
660,34,Clint, Bleed bleed bleed bleed bleed.
661,34,Griffin," He gets out a notepad, writes something down—"
662,34,Clint, I bleed all over it.
663,34,Griffin," —and hands the note to Carey, and says,"
664,34,Lucas," Carey, I need you to get over to the bugbears and tell Jamie Green to bring me these supplies right now, or you can bring them back, tell her to give you these supplies and get back to me as quick as you can."
665,34,Griffin," And she says, uh,"
666,34,Carey," Oh, you got it!"
667,34,Griffin, —and she grabs the note and just darts out of the room with blinding speed.
668,34,Magnus," Wait, Carey!"
669,34,Griffin," She's gone. [Magnus Aw…] And he's doing some work, the bleeding is stopped, he's wrapped a big bandage around it— Merle— so it doesn't seem like Merle's gonna die, and he goes over to a desk in his corner and he starts tinkering with some stuff. He takes off his belt—"
670,34,Magnus, Whoa whoa whoa!
671,34,Lucas, Don't worry about it! I've got a plan!
672,34,Griffin," And he's working with it, he's got this petri dish that he's like mixing some sort of fluid in... and he's like,"
673,34,Lucas," As much as I want to, we can't leave, we can't get him out of here until we stop this thing from spreading. I, I, [sighs] I was down in the lower chambers of my lab—"
674,34,Travis, Late one night… 
675,34,Lucas,"  One night, and—[Griffin forgets the words to ""Monster Mash""] monster boy? How does it— anyway— I was attacked by one of my robots. And I came up here to the medbay to, you know, treat my wound, and when I tried to leave, I found that crystal monster, or whatever it is— it's not, the monster itself isn't crystal, it's what's inhabiting the crystals— it attacked me in the decontamination chamber, and so I, I made my way back here into the med bay, and I flooded the room with anti-Conjuration energy because obviously, he's traveling between planes to move from spot to spot, [Magnus Obviously.] so I blocked it off— obviously, come on, that's like, 101— you guys figured that out by now, right?"
676,34,Magnus, Yep.
677,34,Lucas," I, guys, I'm just so sorry, I promise, I'll get him patched up, I have an idea for how to patch him up, and we're gonna be able to, you'll see, we'll get out of this and we'll get down to my lower levels and I'll stop the crystal from spreading and— mission accomplished!"
678,34,Magnus, Great!
679,34,Lucas," And you guys will say, 'Good work, Lucas! Thanks for the good teamwork!'"
680,34,Magnus, Sounds like us.
681,34,Taako," Yeah, that sounds like something we'd do."
682,34,Merle, [slurred] Shaaddup.
683,34,Clint, Let me say one more thing.
684,34,Griffin, Kay?
685,34,Clint," Hello, beloved fans of Adventure Zone, it's me, Clint McElroy. Please write and drastically protest the treatment of your favorite dwarf cleric in this episode. Thank you."
686,34,[Travis giggling],
687,34,Griffin," Um. Nah, I think, I think—"
688,34,Travis," Listen, we've had a lot of fun here today, but I really just wanna drive home the point take the doors off your refrigerators before you throw them away."
689,34,Clint, Because somebody can get their arm chopped off.
690,34,Travis, That's what it always leads to.
691,34,Lucas," Hey everybody, this is Lucas, a fictional character. I do want to step outside of kayfabe for a second and tell you, for real though, the thing about the refrigerators, that one was on me, and if I had taken it off, I'm pretty sure Merle would still have both of the arms. I don't, I'm not sure how it's connected, but hey, Sliding Doors! Have you seen that movie? Anyway, later! This is me, Lucas, [crosstalk] on the Sliding Doors Council."
692,34,Travis, [over] Fading back into the ether.
693,34,[End theme fades in],
694,34,Justin," Hi. This is Justin McElroy. I'm an actor who plays the role of Taako on The Adventure Zone. I just wanted to say... I don't feel like I really did anything that funny this time around, [background laughter] but hey, get 'em next time, I guess..."
695,34,[End theme music!],
696,34,[Next episode],
697,34,"[a](I ran through the OST and couldn’t immediately find it, sounds kind of like Cosmoscope at parts and a darker version of Pan, will double check later!  )",
698,34,[b]actually i have no idea rip,
699,34,[c]My friend says it's a distorted version of Pan's theme?,
