,episode,speaker,lines
0,35,The Adventure Zone,
1,35,Dungeon Master & NPCs, Griffin McElroy
2,35,Magnus Burnsides, Travis McElroy 
3,35,Merle Highchurch, Clint McElroy
4,35,Taako Taaco, Justin McElroy
5,35,Episode 35 - Crystal Kingdom - Chapter Seven,
6,35,(part of TAZscripts on Tumblr) ,
7,35,Griffin," Previously, on the Adventure Zone..."
8,35,Director, It's time for the Regulators to roll out. We're sending you in to detain and extract Lucas for his abuse of confidential information. Standard protocol applies.
9,35,Griffin, You pull out from inside an old compact mirror. Inside is actually just a circular disk of emerald.
10,35,Travis," Okay, so he's stealing technological ideas from our world."
11,35,Noelle," Guys, he's crystallizin’!"
12,35,Travis, I turn around and chop it off! [Noelle GUYS!] I chop it off!
13,35,Clint, Quit chopping me off!
14,35,Travis, I’m gonna chop it off!
15,35,Clint, You're choppin’ off my damn arm! Seriously!
16,35,Justin," If we need a new arm, the good news is, he's got lots."
17,35,Travis, Yeah.
18,35,Justin, So if we could figure out a way to make that work? That would be rad.
19,35,Clint," Yeah. I'm unconscious, thanks."
20,35,Justin," That's not what unconscious people say, but let's keep moving."
21,35,Announcer," I hope Merle's proficient in unarmed combat! ...I'm sorry, I'm better than that, and you should expect more from me. It's the Adventure Zone!"
22,35,[THEME MUSIC," ""Déjà Vu"" by Mort Garson (full song on YouTube)]"
23,35,{ 1,29 }
24,35,Griffin," We come to you live from— a breaking news story— a tragedy, a tragedy that has—"
25,35,"[Over this, Justin and Travis make beeping ""breaking news"" sound effects.]",
26,35,Griffin," Oh my God. Well, don't both do it. When they do breaking news at TV stations, they don't have two different beep-a-deeps."
27,35,Travis," But they do have someone live do it, like on Carmen Sandiego, when Rockapella would do the breaking news."
28,35,Griffin," Yeah, but if Rockapella did it, they'd be fucking harmonizing and stuff. Anyway, breaking news story Dad has just touched Justin's dice."
29,35,Justin," He touched my dice, he got it— whatever it is, he got it all over them. [Justin sounds a little low and raspy from a cold.]"
30,35,Clint," Guuhh. Get over it, dork!"
31,35,Travis, That's not— you're not supposed to touch—
32,35,Clint," I'm a rebel, man! I got attitude! I got serious attitude!"
33,35,Griffin, It sounds like Justin has implied that there's some sort of residue that Dad has left on the dice.
34,35,Travis, Sticky Coke Zero fingers...
35,35,Justin," Not bad, it's just like, whatever he does—"
36,35,Clint," Critical misses, you mean?"
37,35,Justin," Just, his critical stink is all over it right now. And I'm worried that like—"
38,35,Travis, Critical Stink is a great D&D punk band name.
39,35,Justin," [English punk voice] Oi, we're Critical Stink, let's roll! [noises imitating punk music]"
40,35,Griffin, Before we get into the—
41,35,Travis, [snickering] Let's roll!
42,35,[Clint laughing],
43,35,Justin," Thank you, Travis. Somebody appreciated it."
44,35,"[raspberry, probably from Clint]",
45,35,Travis, I liked it.
46,35,Griffin," Before we get into the excitement and action and resolution and shit, I feel like we need to do some corrections and amendments here at the top."
47,35,Justin, Okay… 
48,35,Griffin," Just— Dad does have an ax, but it's a— and I, he announced it in the first episode, and people were kind enough to remind me that Dad does have an ax— [distant thunder sound] Wow! Y'all hear that?"
49,35,Justin, What's that?
50,35,Griffin, That's some fuckin' atmo! It's stormy as hell.
51,35,Travis, Oh!
52,35,Justin, Okay.
53,35,Griffin," Just know that that's not in post, it's not storming inside of Lucas's lab. Um... Dad does have a hand ax, he announced it in episode one, but it's basically a hatchet, it's like a hatchet that they would use in like— a child would get for Christmas—"
54,35,Travis, Like you would use in the book... Hatchet?
55,35,Griffin, Like a Gary Paulsen hatchet.
56,35,Clint, Hence the name Li'l Choppy.
57,35,Travis," I also wanna say, the reason we didn't use the red barrels [during the tardigrade fight] is because we beat them anyways, pretty handily. I don't think we took a lot of damage. We didn't need the red barrels, and it wasn't until afterwards when all you punks got to hear Griffin say ""the red barrels"" that you went yeah— [crosstalk] like— hindsight, 20/20, you guys."
58,35,Griffin," Another quick one, I learned this, I didn't— there's no such thing as negative Kelvin."
59,35,Travis, But what if he's really sad?
60,35,Justin," There also isn't, I think I said a thousand degrees Kelvin. That's not a thing either."
61,35,Griffin," Anyway, I, uh... I'll uh, just one last, as long as we're piling on here, I've been saying the word ""proboscis"" wrong my whole fuckin' life. "
62,35,Travis," You know what we're not? A factual show. This is not about science and learning, it's about Dungeons and Dragons!"
63,35,Griffin," I saw somebody trying to defend me like, 'Well in this fantasy universe, maybe it's pronounced probiscis!' No. No, friend."
64,35,Justin, You're embarrassing yourself.
65,35,Travis," Wait, it's not probiscis?"
66,35,Griffin," My sweet friend, no. Proboscis, with an o."
67,35,Travis, Jesus...
68,35,Clint, Probiscis is a flower.
69,35,Travis, No...
70,35,Justin," I thought it was probiscis the whole time, is it not probiscis?"
71,35,Griffin, It's proboscis.
72,35,Clint, Proboscis.
73,35,Travis, Is probiscis like a weird West Virginia thing?
74,35,Griffin," Yeah, it's like aunt [pronounced ant], aunt [pronounced ahnt]."
75,35,Travis, All right. Let's play Doon-jens and Dray-guns and get on with it.
76,35,Griffin," Okay. Um, who needs a refresher, anybody? Dad— Merle's arm got chopped off."
77,35,Travis, I just listened to it!
78,35,Justin," One last correction. I'm sorry last week after we beat them that I didn't call them ""fartigrades."""
79,35,[All groan at the missed opportunity.],
80,35,Travis, Or nardigrades!
81,35,Griffin, A gross factual error from Justin.
82,35,Justin," Yeah, it was incorrect of me."
83,35,Travis, We got a lot of fanmail about it.
84,35,Griffin," One thing we also need to resolve Merle, what is your dominant hand? 'Cause I think that's the one that we're gonna say got got. 'Cause I don't see why you would grab a thing with your non-dominant hand."
85,35,Travis, I actually think he said he was ambidextrous.
86,35,Clint," I did at the very beginning of the show, but along with all these other facts, I guess that was forgotten too..."
87,35,Griffin, [laughing] It's been two years!
88,35,Travis, It feels like five.
89,35,Griffin," Well, if you wanna flip a coin and tell me which hand got got… "
90,35,Clint, I'll roll a die.
91,35,Justin," While Dad's rolling that die to tell you which hand got got, I should also mention that very early in the show, I also said that whenever people are around Taako, they get super horny and want to give him lots of money. I said that and everybody was like, uh huh, good good good good."
92,35,Clint," Yeah, we like that- like that’s canon-"
93,35,Travis," I actually, I wrote that down."
94,35,Justin," [slower, as if taking notes] They get super horny... and want to give him lots of money."
95,35,Clint, I lost my dominant hand.
96,35,Griffin," Nice. Which is it, your right or left?"
97,35,Clint, My right.
98,35,Griffin," Okay. Taako, I actually remember the super horny, giving you money thing. Like, has that not... that's just how it's—"
99,35,Justin," I just have it. It's like my acrobatic skill, it just hasn't… "
100,35,Griffin, You just haven't used it. So about twenty minutes have passed since you guys got Merle into this medbay room.
101,35,Travis, Merle's dead. He bled out.
102,35,Clint," I'm dead, right?"
103,35,Griffin, And— he died between episodes. It's a D&D podcast first.
104,35,Travis," But he's been recast, as a younger— this is Oliver, the new Merle… "
105,35,Griffin," No, he is alive, and through a series of medicines and salves that Lucas has applied, you're actually pretty lucid, and the pain from your grisly wound has almost completely subsided."
106,35,Travis," Hey, it was a very clean cut, thank you very much!"
107,35,Griffin," I meant gris— okay, yes."
108,35,Clint," Take pride in your work, Trav."
109,35,Travis, It was surgical!
110,35,Griffin, It was surgical in nature.
111,35,Travis, I was surgical with this bitch!
112,35,Clint," By the way, while we're on this subject, thanks to all those people who tweeted and said, 'here's hoping Merle dies!' Thank you!"
113,35,Travis," Well, everybody loves a shakeup, Dad, I don't think that that's personal against you, but like, you know, the interjection of an— who knows what celebrity we could get to play the next Merle!"
114,35,Griffin," The possibilities are very exciting. Let me, let's do some storytelling."
115,35,Justin," Wait, wait, just to be clear—"
116,35,Griffin," Oh, boy."
117,35,Justin," —Travis, you're saying that we would not replace— let Dad play a new character, [Travis Uh-huh!] —we'd bring his old character back to life with a new actor, like Doctor Who."
118,35,Travis, Yeah.
119,35,Justin," Okay, got it, cool. Got it. Perfect."
120,35,Clint," Thanks! Thanks, bud!"
121,35,Travis," You could, you could come back as like maybe a whimsical spirit, or some kind of like, talking book…"
122,35,Clint," Sure, yeah."
123,35,Griffin, Or talking dog… 
124,35,Justin," Maybe more of a producer role in the back, taking a backseat, a Robin to our Howie… No?"
125,35,Clint, [cracks up] … Why am I laughing?
126,35,Justin, I don't know.
127,35,Griffin, I don't know. It's very sad. Merle—
128,35,Justin," That's what you'll be doing a lot of, though. And you— a lot of, ""Good one, sirs!"""
129,35,Travis, And you'll be asked to leave the set because you're interrupting the filming.
130,35,Justin," ""Excellent, young masters! Way to goof 'em again!"""
131,35,Travis," ""Do you need any lem-o-nade?"""
132,35,Justin," ""Thrilling plot twist!"""
133,35,Griffin," Okay. Merle, you've been treated. What I'm trying to establish is, you're actually doing okay. Aside from, you're missing your right arm. And by right arm, it's mostly your forearm, it kind of just kind of stops at the elbow, and you're really thoroughly bandaged up on that arm. The bleeding has come to a stop. Things have calmed down in the past, in the twenty minutes that have passed."
134,35,Travis," And just to be clear, when last we left, [Griffin Yeah.] Merle had explained to us that he heard a British guy, [Griffin Yeah.] who tricked him, [Griffin Yes.] and then Lucas, if I remember correctly, said, ""I'll explain everything."""
135,35,Griffin," Yeah, Lucas right now is actually in the corner, he's actually removed a panel from the wall of this medbay and you can see he's got some sort of like, hastily constructed terminal that he's like, rewiring some stuff in the panels, and he's like, fiddling with this terminal, and as he does, you can hear sort of rumbling and some ambient noises coming from pretty far off in the lab. "
136,35,"And in this medbay, now that things have calmed down, you've actually got a chance to sort of take in your surroundings. There's some cabinets with medical equipment and medicines, there is some sort of scanning device, and there is a null suit chamber, much like the one that you guys had in the Bureau of Balance, it's maybe a little bit smaller than the one that you have in your lab that you used to suit up at the beginning of this adventure, and hanging off of the side of it are— is a suit, that is Lucas-sized, it is human-shaped. And Lucas stops messing with this panel that he's fiddling with, and he goes,",
137,35,Lucas," Okay, I've rewired and shut down most of the rest of my lab, it should buy us about an hour and a half to get downstairs and shut this thing down."
138,35,Magnus," That should give us about an hour and 29 minutes for you to explain what the holy hell is going on, and one minute to get downstairs."
139,35,Lucas," [sigh] There... [sigh] what don't, what don't you already know? Some— There was an accident, and somebody—"
140,35,Magnus," Oookay, what don't we know? I got a compact, lets me see into some strange world, A. B, there's a voice that keeps talking to us. C, some British guy more or less took Merle's hand. D, what the fuck is happening?"
141,35,Justin," Oh, ah, he really shifted blame— that, I mean— [crosstalk]"
142,35,Clint," Yeah, some British guy—"
143,35,Justin," He's exorcised himself from the story, huh— [crosstalk]"
144,35,Magnus," Listen, if you— if somebody got stabbed with a sword would you say the sword killed him? No. I was merely the tool that operated on Merle, through this British guy— I was a tool."
145,35,Justin," Travis is telling his shield, ""I don't know, I never cut his hand off… """
146,35,Clint," So this is like, guns don't kill people… "
147,35,Griffin," Magnus takes axes, kills arms."
148,35,Justin, Got it.
149,35,Griffin," He says,"
150,35,Lucas," Actually, before we get started, Merle, I had an idea. Because we're gonna need your clerical ways as we go deeper, and I was thinking, I had a kind of idea of how I could maybe restore some of your two-handedness? If that makes sense?"
151,35,Merle," I'm listening. I'm a little grumpy, [Lucas Okay.] as everybody can understand..."
152,35,Travis, A little put off.
153,35,Lucas," Magnus, I understand that you may have taken a little trophy from Hodge Podge after defeating him. Can I see it?"
154,35,Magnus," Uhhh gimme a minute to find it. [Travis Rustle rustle rustle.] Not this one... not this one... not this one... not this one... this? No, not this one... is it this—? No not that one..."
155,35,Clint," Boy, you are really well-armed. [Griffin laughter]"
156,35,Magnus, Is it this one?
157,35,Lucas," Yeah, that's it."
158,35,Griffin," He takes it, and uh—"
159,35,Justin," God, I was so hoping Griffin would say no."
160,35,Griffin," He takes the right arm and he holds it up to Merle, and it's really little. It's like a small, like a doll's arm. Like a toy, like a GI Joe arm. He's like,"
161,35,Lucas," No, I'm just— I'm just kidding, that would be... that would be ridiculous, it's like a little toy arm. Like if I could somehow plug this into you, how would you control it? That's sci-fi bullshit. Robot arms."
162,35,Clint, Today the part of Merle being played by Kristen Wiig.
163,35,[crosstalk],
164,35,Griffin," Can you imagine? Uh, he actually goes back to that desk where he was messing around with a belt and a petri dish, where he was messing around, and you see him—"
165,35,Magnus, Can I have that arm back please?
166,35,Lucas," Well, I need a piece off of it."
167,35,Griffin," He unscrews this, like, cap at the end of it, and attaches it to this thing that he's tinkering with. And as he's tinkering with it, Carey comes back into the room, and she says,"
168,35,Carey," Hey, I'm back! I’ve uh, I got what you asked me to get from Jamie."
169,35,Griffin," And she is holding a potted plant with these four wooden shoots, it looks like, coming out of it. And if you'll recall, you saw this very briefly when you went into the bugbear chamber. And Lucas goes,"
170,35,Lucas," Okay, no, this is the idea. This is going to be great."
171,35,Griffin," And he takes that plant and removes it, de-pots it, takes it out, and as he's like taking it out of the pot and shaking the dirt off of its roots, you actually see the plant kind of protest? Like it's like trying to slap his hand away? And he plants it in this petri dish that you can see has some sort of green viscous fluid in it, and he sprays it down with something. He picks it up, and it just kind of looks like this wooden plant is hanging off of this belt. And he creates—"
172,35,Travis," Feed me, Lucas!"
173,35,Griffin," He creates some sort of concoction that he walks over to Merle, and he says,"
174,35,Lucas," Here, drink this. Trust me. Please. This is gonna be so sick. This is— Merle, I know you’ve been burned by people asking you to do stuff that maybe you don’t trust, in the past like 15 minutes, but trust me on this, this is gonna be tight as hell."
175,35,Merle, Sure. I’ll do it. Yeah.
176,35,Griffin, Your other arm falls off.
177,35,Merle," I'm really down, so, yeah, go ahead, kick me while I— I'm vulnerable, I feel very vulnerable right now."
178,35,Griffin," Okay, so you're downing this bev…"
179,35,Clint, Mm! It's like an appletini!
180,35,Griffin," It actually tastes more like a carbonated wheatgrass shot. [Justin Nice.] It doesn't taste especially great. But as you taste it, and as you drink it, you see this wooden— these four wooden shoots hanging off of this belt kind of come to a standstill and start to wrap around each other and tie around each other, and they form what looks like kind of a crude four-fingered arm."
181,35,[MUSIC, ???]
182,35,Griffin," And Lucas explains, he says,"
183,35,Lucas," Okay, so biology's not my specialty, but this is definitely gonna work. This is a plant called soulwood, and it's a psychically tuned plant that can resonate with certain people that resonate with them, and it can sort of change its biology based on the whims of other living creatures. And Merle, from what I understand, plants are kind of your specialty, um, so—"
184,35,Magnus, Romantically.
185,35,Lucas," Romantically speaking. So, my thinking is— do you mind? I'm gonna get close, I'm gonna get intimate."
186,35,Justin," Hell yes, ASMR."
187,35,Griffin, He starts whispering in nerd ASMR.
188,35,Lucas," [low nasal whispering] Okay, so what it's gonna do… "
189,35,Griffin," He takes this belt and wraps it around your shoulder, and then there's another fastener which goes around your chest, and as he's doing this—"
190,35,Magnus," Merle, how do you feel about auto-erotic asphyxiation?"
191,35,[laughter],
192,35,Griffin," And as he's doing this, he is straight up, like, Army of Darkness, attaching this wooden arm to you that is now roughly the size— it's actually kind of bigger than your other arm—"
193,35,Travis, I chop it off.
194,35,Griffin," Oh no. That didn't last very long at all, huh."
195,35,Travis," No, I don't. Not this time."
196,35,Griffin," Yeah, you have this wooden arm, and you feel this like, this psychic link with it. You feel like a deep connection with this arm made up of these four wooden shoots that have twisted around each other to form the shape of an arm."
197,35,Clint, Awesome...?
198,35,Travis, So I guess it all worked out!
199,35,Clint," Yeah, everything worked out for the best!"
200,35,Justin, Worked out fine.
201,35,Clint," I want you to feel completely off the hook, Magnus."
202,35,Travis," And then Magnus and Merle engage in a very complicated like high five secret handshake so he can test out the hand, we do the Shimmy Shimmy Cocoa Pop, the Bureau handshake—"
203,35,Griffin," Yeah, as you do the secret Merle and Magnus handshake, Merle, you feel like it is not a big deal to move this thing at all. It takes maybe a little bit to become as dextrous with it as you were your original OG dwarf hand, but yeah, you have pretty good control over this soulwood arm. And it actually like kind of curls up towards you and gives you a big thumbs-up as if to say, hey! I'm your arm now!"
204,35,Clint, Wow! Creepy! Really creepy! Yeah! Good. That's really gonna cut back on my fireworks—
205,35,Travis, I want it in the canon—
206,35,Justin," And hey, good news, now you got somebody to blame for your rolls. [Travis laughs] It's the tree!"
207,35,Travis," I want it in the canon that Magnus is actually like a little bit jealous of his sweet new wooden arm. Not out loud, mind you, but just quietly to himself."
208,35,Clint, And I would like it in canon that Magnus can kiss my Kenny Chesney tattoo.
209,35,Travis, Fair. All of this is fair.
210,35,Justin," Can you imagine what delectable torture that would be though, for Magnus, to have a tree on his arm that he cannot split."
211,35,Griffin," Yeah, true… "
212,35,Clint," Well, he can."
213,35,Travis, Can Magnus make a tree even he can’t split?
214,35,Griffin," So in terms of mechanics, Merle, you now have just a permanent disadvantage on sleight of hand rolls. That's just— your days of having good sleight of hand rolls are behind you."
215,35,Clint, My days of having any good rolls are behind me!
216,35,Griffin," But! You can now control this hand separately from yourself. You can take it off, chuck it, control it like you would normally, [Travis What?!] like your hand, only you can control it remotely."
217,35,Travis, Awesome.
218,35,Justin," So it gave him superpowers, basically. Great."
219,35,Travis," More so than the magic he could already wield, you know, summoning angels and all that."
220,35,Griffin," Magnus cuts both his legs off. Like, all right! Juice me up!"
221,35,Travis, What've you got for me?!
222,35,Justin, Taako cuts his head off.
223,35,[snickering],
224,35,Griffin," Lucas says,"
225,35,Lucas," Okay, so we don't have a lot of time for you to get acclimated to your new arm, so you're gonna have to figure it out on the fly, but before we get out there, you're gonna need to recharge your suits."
226,35,Griffin," And Noelle says,"
227,35,Noelle," Oh! That's right! Oh gosh! Sorry, I completely blanked."
228,35,"And a little compartment opens up and a tank pops out that looks very much like the tank of spray that they plugged into the chamber when you first got sprayed down to null-suit yourselves. And Lucas slips into his null suit and plugs the tank into the chamber, and he's like,",
229,35,Lucas," Alright, everybody, pile on in! It's time to recharge!"
230,35,Griffin," And I guess very awkwardly, because there's more of you now, you're doing like a Real World/Road Rules like, how many co-eds can we fit into a phone booth challenge... you all get coated in another layer of null-suit juice. The meters, you have these little panels on your wrist that are showing how much energy you have left in your null suits, are completely full up now. And everybody gets all sprayed down."
231,35,Clint," And may I say, in Amazon reviews, I'm giving the null suits originally one thumbs down… "
232,35,Griffin, [laughs] That's not how Amazon reviews work.
233,35,Clint, I couldn't pass up a thumb joke.
234,35,Griffin," Oh, that's— good point. We're gonna have a lot of those now, I bet."
235,35,Magnus," Hey Lucas, while we're all showering together…"
236,35,Lucas, Yeah?
237,35,Clint," ""What is that?"" [crosstalk]"
238,35,Magnus, When Merle—
239,35,Lucas," You're standing on my thigh, which is weird."
240,35,Magnus," Thank you for the boost. When Merle mentioned a British guy, did that ring any bells for you?"
241,35,Lucas," Okay. I swear, guys? The lying stuff? Is over now. I have no fucking idea what—"
242,35,Magnus," But you realize that like this is an all-audio medium, so all I can do is ask questions, right? I can't look around and observe… "
243,35,Lucas," No, I get it. Um, if you want, I can tell you all about the compact… "
244,35,Magnus, Yeah! That'd be cool!
245,35,Lucas, It'll be easier if I show you the Cosmoscope. Can you guys— are you guys ready to roll?
246,35,Magnus, Yeah.
247,35,Justin, Uh... [clears throat]
248,35,Taako, [voice strained and breaking] Yeah.
249,35,Merle," Yeah... still in a lot of pain, but okay."
250,35,Taako, [voice breaking a lot] Let's do it.
251,35,Griffin," Justin, I wanna hear your—"
252,35,Justin, The role of Taako today will be played by a ghost.
253,35,Griffin, The Cold and Flu version of Taako should be interesting.
254,35,Justin, Yeah. Taako silently nods in agreement.
255,35,Griffin," You guys make your way out of the med bay and through the decontamination chamber back into the central hub. This room is kind of a mess because the crystal golem started to form in here and kind of fucked shit up, as he was like breaking pieces of crystal off. And you make your way into the door that you saw earlier that was labeled 'The Cosmoscope.' And as you pass through the airlock into the Cosmoscope you enter into what you assume to be a pretty large chamber, although it is like, completely pitch black in here. Save for a pillar of light which is illuminating what looks like a circular disk that is kind of free-floating in the middle of the room, facing you. And uh, Lucas walks into the back of the room, into the darkness. You see him get out a flashlight and you can see he's messing with some sort of lectern back there… "
256,35,Travis, Time for scary stories!
257,35,Griffin," He says,"
258,35,Lucas, This is the tale of the... [stalling] old... sailor's... mummy!
259,35,[laughter],
260,35,Griffin," No, he flips some switches on this lectern and you see an image pop up on this disk, and it looks like the lab that you are currently standing in, as seen from above, from outside of the lab. And he says,"
261,35,Lucas," Okay, I’m about to get into some pretty heavy concepts. Um, I’m probably going to blow your whole mind and just kinda reshape the way you think about existence and stuff. So if it ever gets to be too much or you have any questions, please feel free to stop me, okay?"
262,35,Magnus, Okay wait stop you’re blowing my mind.
263,35,Lucas," Okay. Boy, this is gonna take forever, I bet. Let’s take this slow. My whole life, I have been obsessed with the concepts of taxonomy and hierarchy. That, for everything that exists, there’s always a bigger thing that contains it."
264,35,Magnus," There’s always someone cooler than you, right?"
265,35,Lucas," That’s one way of putting it, yeah. So there’s always a bigger thing that has a bigger thing that contains it, and so on and so forth, repeated on to just inconceivable degrees."
