,episode,speaker,lines
266,35,Magnus, Turtles all the way down.
267,35,Lucas, Turtles all the way down. Turtles all the way up. Bigger turtles. So…
268,35,Griffin," And he points to this disk in the middle of the room, and he says"
269,35,Lucas," Okay, so this is my lab. We can go way deeper on, like, the micro scale. To, like, elementary particles and stuff like that. But for the lightweight version of this demonstration, let’s start here. Here’s my lab."
270,35,Travis, Got it.
271,35,Griffin," And he holds up two index fingers, and does, like, an iPhone pinch-- pinches them together, and the image pans out. You see it zoom out, and now you can see the Stillwater Sea underneath his lab."
272,35,Lucas, Okay so here it is floating over the Stillwater Sea --
273,35,Griffin, And he pinches the screen again.
274,35,Lucas," And here’s that sea in relation to the neighboring landmasses, and here’s the whole continent, Faerûn. And here’s our whole world, Abeir-Toril."
275,35,Magnus, How’d you do that?
276,35,Lucas," Just bear with me. You’re gonna go way way further. [Magnus What?] Here’s our solar system. [Magnus Huh??] Here’s the local interstellar cloud, [Magnus What?!] the local bubble, the local arm, the galaxy…"
277,35,Griffin," And as he’s doing this, you’re seeing the entire galaxy, spiraling. And it’s beautiful. You’ve never seen anything quite like it."
278,35,Lucas," And here’s the local group -- [Magnus I’ve seen it.] ...Oh. [Laughs] Okay. I wanna actually ask you guys about that here in a minute, but here’s the local group, the local cluster, the local supercluster, and so on and so forth, until… Here!"
279,35,Travis, It’s all just a collar on a cat! 
280,35,Griffin," Uh, it’s- [laughs] yeah. He says,"
281,35,Lucas," This is the... observable universe. This is every- everything we know, everything- every place we’ve ever been, every person we’ve ever met, every- every place anyone’s ever been, uh, is in here. But- but more importantly so are the immutable rules that govern the people, places, and things inside of this universe. Things like gravity, thermodynamics, and arcane interactions. And all that stuff, all that matter and energy and the rules that govern it comprise this our universe. You- you guys are just a handful of people who have ever seen the observable universe before, so… It’s pretty cool, right?"
282,35,Taako, [low and raspy voice] Way into it.
283,35,Merle, Yeah.
284,35,Magnus," Yeah, is there, like, a guest book we need to sign or-"
285,35,Taako," Hey, listen. Hey, uh, listen. What if- "
286,35,Travis, [Like imitating bill cosby] Jo-zabba-zoo
287,35,Clint, [starts humming a tune]
288,35,Taako," Listen, what if I was to take one step past what you’ve shown me here?"
289,35,Lucas," Taako, can I say something?"
290,35,"[Someone snorts, Clint probably]",
291,35,Taako, What’s up?
292,35,Lucas," You have just made me… very, very happy."
293,35,Griffin, And he walks to the back of the room.
294,35,Justin," And, also, just to clarify, horny, right?"
295,35,"[Clint wheezes, Travis laughs, crosstalk]",
296,35,Justin," And, also, you have a deep desire -- [Clint It all ties together!] to give me a lot of money."
297,35,Lucas, You’ve made me very horny.
298,35,Griffin," He says. And he flips a switch on that lectern -- [Justin Yeah, flip it!] and the whole room lights up. And the disk on the middle- you can see- uh, that- that you were just looking at is made of this dark blueish-green material in a perfect circle with some silvery trim, um, all around it. Uh, that -- And- and this disk is levitating. But, you realize as the lights go up, that this room… is filled with these disks and they’re all arrayed in- in- in orbit around this central disk, in- in rings, uh, around it, and there’s ten other, uh, of these disks in the room and they’re all these different colors bright reds and oranges and greens and blues and whites. And they’re all displaying a wide array of scenes of impossible things. You look into this, this red disk -- "
299,35,Travis, Like what?!
300,35,Griffin," Well, you see like a world that looks kind of like the world if the world was made completely out of lava and fire and then, there’s a blue disk where it’s just, uh, uh, a giant ocean, a world made of water and ice. Um, you see a world where millions and millions of these living lights float weightlessly through the air and worlds where oceans of magical energy wash up on shores made of these brilliant white sands. You see --"
301,35,Justin, That- that’s- there’s a name for that one. It’s Ibiza (using spain spanish pronunciation ee-bee-tha).
302,35,Griffin, [laughs] You see --
303,35,Travis," You see a world where everything’s the same, except everyone’s got mustaches."
304,35,Griffin," You see -- Well, no, that’s not one of them. But you see all of these incredible worlds and you don’t know where to look, and Lucas says-"
305,35,Justin," Uh, I would. I would look at Buffet Planet back there, couple planets back."
306,35,Griffin," [laughs] Uh, Lucas says"
307,35,Lucas," Taako, to answer your question, this is the next thing that’s bigger. This is our planar system. This, this, this disk, that you see, that represents our observable universe, this is actually our plane. This is the prime material plane. We’re smack-dab in the middle of the planar universe. And each of these are different planes of existence, and they, they each produce unique energies and they share these energies. They inform the material and physical makeup of, of, of each other. Some connections -- They each have connections, some are more tenuous than others. But these make up the real existence, uh -- each plane having its own sort of energies and rules. This, this is what’s bigger than the universe."
308,35,Magnus, Okay.
309,35,Merle, And then what’s bigger than that?
310,35,Travis, Good question.
311,35,Clint, Thank you.
312,35,Lucas," Well, let’s start with this There are six building block planes, right?"
313,35,Griffin," And these, he points to these disks that are on the outermost ring away from the prime material plane disk that’s in the middle of the room. And he goes"
314,35,Lucas," So you’ve got your elemental planes Fire, air, water, earth. And then you got the planes of light and shadow. [Magnus Heart?] No. Taako, certainly, you probably know a little bit about these during your studies at Wizard U."
315,35,Taako," [low and raspy voice] Yeah, I’ve gotten balls-deep in some of those other planes."
316,35,Magnus, I think he’s got a secret room in one of ‘em.
317,35,Taako," When I use Blink, I get all up in those other planes."
318,35,Lucas," Yeah, that’s right. When you use Blink, you end up in the ethereal plane."
319,35,Taako, You didn’t list that amongst your planes.
320,35,Lucas," Well, there’s more. I’m gonna run through them. But if you actually look --"
321,35,Griffin," You can actually see underneath the disk that you were looking at first, where you’re looking at your own universe, you actually see another disk underneath it. And he’s like"
322,35,Lucas," That one is the ethereal plane, and it’s kind of like a filter. It’s like where the raw energies of the rest of the planes are kinda filtered into the prime material plane so it’s not just like, everything’s on fire or drowning all the time. So yeah, anyway, that’s the seventh, and then we got the planes that sort of inform the energies of life itself, like the plane of magic where magic energy is born. And then on the opposite end of that, you see there’s the plane of thought which is the source of logic and reason and emotion."
323,35,Travis," So, the boring one."
324,35,Griffin," Well, as you actually look into the plane of thought, which is this deep green emerald mirror, you see similar scenes to the things that you saw in the compact, Magnus. You see a large, wide, gray road with a bunch of vehicles just sort of sitting stuck on it."
325,35,Magnus, Metal dragons!
326,35,Griffin, Yeah! You see scenes like you saw in the compact.
327,35,Travis, So this plane is where all the creativity and energy for this world comes from. The creation.
328,35,Lucas, Yeah! It’s like where the home of logical thought is. That’s why I call it the plane of thought.
329,35,Magnus, Show me Donald Trump!
330,35,Lucas," I don’t... know quite who that is. Although, the fact that you guys make so many references to this world makes me think you have to have spent some time there at some point."
331,35,Magnus, I have a little house there.
332,35,Lucas," I can’t tell if you’re joking, which is like, kinda par for the course. Anyway, there’s the other higher planes, there’s the celestial plane, which is inhabited by the beings that I guess some people would consider deities."
333,35,Clint," There’s the meat plane, the vegetable plane, the dairy plane, the breads plane…"
334,35,Justin, Soluble fats plane…
335,35,Lucas," Yeah, but you only wanna visit that one sometimes!"
336,35,Travis," The plain plane, that's not very exciting."
337,35,Justin," The plane plane, that's just full of planes."
338,35,Clint, And the plain plane plane with all these plain planes in the plane.
339,35,Travis," Yeah, you gotta be careful with that one."
340,35,Lucas," I’ve been working on a new version of the food pyramid, to kinda educate the people of Faerûn, but it’s kinda like a cube? And it’s for people who like to party."
341,35,[laughter],
342,35,Taako," Uh, hey, listen, I gotta be honest. From me to you, that sounds dope as hell."
343,35,Lucas," [continuing from before the comedic tangent] And then the prime material plane, the ethereal plane, you know about those. And then the astral plane, which is where our unconscious forms -- our souls -- retire when we die here in the prime material plane."
344,35,Travis, Is Merle’s arm there?
345,35,Merle, Wait a minute! Wait a minute! That goes completely against my theology. Is there a Pan plane?
346,35,Taako, Please respect his beliefs.
347,35,Lucas," Well, Pan probably kicks it in the celestial plane."
348,35,Griffin," Actually, as he was talking about the astral plane, you realize he’s talked about 12 different planes but there are only 11 in the room. He says"
349,35,Lucas," The astral plane -- so anyway, let me explain. Crystals, certain types of gemstones, if grown into a perfect circle -- they can’t be cut! If you cut it, it doesn’t work. They have to be naturally grown in a perfect circle -- resonate with the different planes of existence. With the twelve planes that form our planar system, right?"
350,35,Merle," Well, everybody knows that."
351,35,Magnus," Yeah, that’s 101."
352,35,Lucas," Literally nobody outside this family knows that, until now."
353,35,Merle, I knew it.
354,35,[crosstalk],
355,35,Magnus," We talked about it yesterday. You remember that, Merle?"
356,35,Lucas," [Frustrated] Yeah, okay, so-"
357,35,Merle," Yeah, when I wasn’t speaking to you."
358,35,Taako," [lower voice] Hey, listen, little man, these guys are just being braggadocious. Don’t let them rattle your chain. Go ahead with what you were saying. I’m loving all this. Lay it down."
359,35,Lucas," So, anyway, my great-grandfather found a crystal, just like that. And it was a perfect emerald disk that had just grown like that naturally in nature. And through that, he was able to see into the plane of thought. And using that, we may have gained a little bit of inspiration for our inventions here in the prime material plane. Kind of cheating, I guess, if you wanna call it that."
360,35,Magnus, Lucas?
361,35,Lucas, Yeah?
362,35,Magnus," Is it possible that through tampering and connecting with these planes, that you might have gotten the attention of something that we shouldn’t have?"
363,35,Lucas, [instantly] Definitely not!
364,35,[laughter],
365,35,Magnus, That really kinda feels like what’s going on here.
366,35,Griffin," Can you guys give me a minute? Sorry. One sec. [beeps, then a slamming noise]"
367,35,Justin, He’s gotta go write a new story.
368,35,Travis," He’s like, “Uh, no no no! Give me twenty minutes!”"
369,35,Justin, Like when the producers of Lost pretended that it wasn’t about purgatory the whole time.
370,35,Clint, It was?
371,35,Justin and Travis, It was.
372,35,Clint," It was about purgatory? Oh, I thought it was inside like a snowglobe thing and it was, like --"
373,35,Travis," Here’s the thing, Dad, the tricky thing is even when it wasn’t about purgatory, it was. ‘Cause that’s how purgatory works."
374,35,Clint, Ahhh.
375,35,Griffin," Hey, I’m back, sorry."
376,35,Lucas," So, yeah, my family [sigh], we’ve sort of led the Industrial Revolution in this world for generations now because of that mirror. And so because of that, my mother, Maureen, started to sort of come up with this idea of how we can create other mirrors into other worlds. But it’s really hard to do, you know? Because you can’t, like I said, you can’t cut these gemstones to create these mirrors."
377,35,Magnus," Well, if it was easy, everyone would do it, you know what I mean?"
378,35,Lucas, Exactly! Everybody would have their own extra-planar sort of telescope situation.
379,35,Griffin, Killian’s actually getting a little short-tempered about all this. She’s like
380,35,Killian," Can you please, just, like, explain what thi- why you use the grand relic to do all this stuff? Cause these are, I don’t- this is cool and everything-"
381,35,Magnus, He was trying to grow another mirror for the ethereal plane.
382,35,Killian," Okay, yeah that's what I assumed I just kinda hoping he'd get to the point a little bit."
383,35,Magnus," Read between the lines, Killian!"
384,35,Griffin," Uh, he says"
385,35,Lucas," Okay so,"
386,35,Merle," So, she's not seeing anybody? [Justin Nice try.] Your mom is not like, dating or anything, right?"
387,35,Lucas," Yikes, okay no she's-"
388,35,Merle, Maybe Carbon dating?
389,35,Taako, Is she a plant? That's his thing. He nasty.
390,35,Lucas," I mean my mother was very, very much a botanist she, she sort of helped-"
391,35,Justin, Mmhmm.
392,35,Magnus," Did your mom die, or did she like disappear one day?"
393,35,Lucas," She passed away, unfortunately."
394,35,Merle, Passed away into another plaaaane??
395,35,Lucas," Well yeah, into the astral plane, ‘cause that's where you go. Anyway, I- so I was wor- we- I used the Philosopher’s Stone to transmogrify, uh just pools of water into these different mirrors, uh, it took me some experimenting. I had to, to figure out which gemstones corresponded with which planes. Man, I made so many gemstones. And I uh, yeah the result is I created these 12, I unfortunately was working-"
396,35,Griffin," He flicks another switch on the lectern and the disks just start to sort of rotate around the central one, like they're moving like planets in orbit."
397,35,Lucas,"I was trying to get their trajectories right, and I accidentally broke the astral mirror, so I gotta grow a new one of those although-"
398,35,Magnus," Smooth move, Ex-lax!"
399,35,Lucas," Yeah I very much doubt that you’re gonna let me keep playing around with that Philosopher's Stone, so I guess I'm just gonna have to cut my losses there."
400,35,Magnus," Well, but then again, I get it when you want the complete set and you don't have it, and you're like one away you know."
401,35,Lucas," Yeah, exactly. Anyway-"
402,35,Clint, Just like NASCAR plates.
403,35,Magnus," I’m a collector too, man, I get it."
404,35,Lucas," This is what I was working on. This is what I was using the Philosopher’s Stone for, is to create the cosmoscope which I could use to see the whole planar system, and, Merle, you asked a very important question earlier that I would also like to circle back to!"
405,35,Merle," Ah, yes, what was it?"
406,35,Lucas," [sighs] You’ve already forgotten. Of course, that qu—"
407,35,Griffin," He freezes and time kind of [Travis Well, you son of a-] time kind of freezes. Um and,"
408,35,Travis," You’re in complete control of this world, Griffin! You made that happen! Don’t act like that was out of your control!"
409,35,Griffin," Yeah, time has kind of frozen here. The orbit of these disks has stopped. Um, and Killian, and Carey and Noelle have just kind of stopped, a- and from behind you, you hear a voice ask that question, uh and it asks-"
410,35,Red Robe, What’s bigger than this?
411,35,Travis," Oh, yeah!"
412,35,Clint," Oh, god, if he’s got a raincoat on, I am not turning around!"
413,35,[Snorting laugh],
414,35,Travis," Oh, like a flasher and his penis!"
415,35,Clint," [Laughing] Thank you, Travis."
416,35,Travis," I just want to make sure that all our listeners, especially the younger ones, really understood what dad was implying."
417,35,Griffin," Yeah you know the child- the children who listen to the podcast, [Clint laughing] Daddy!"
418,35,Clint, Of course.
419,35,Griffin," Children who are going to be very confused the first time they see an onion, like, “I don’t know what these are supposed to be for!”"
420,35,Justin," You shouldn't let your kids listen to this show. Griffin literally named a character King Fu**di** (beeped). And it’s like, where does that even fit in, y’know I don’t even. Well, I know where it fits in, but- listen I didn’t mean it in the way that you thought I meant it."
421,35,{38,"45 -- A Far Friendlier Robot plays and announcements start, and end at 4628 with Cosmoscope. But let’s be clear it starts during the ‘King Fu**di**’ joke}"
422,35,{46,41}
423,35,Griffin, I’ll do a recap of what happened before we started talking about dicks. You hear a voice behind you say
424,35,Red Robe, What’s bigger than this?
425,35,Travis, “I turn around!” No! Magnus turns around! Which one am I?
426,35,[Wheezy laugh],
427,35,Griffin, Um. As you-
428,35,Travis, I’m lost within myself!
429,35,Justin," I don’t know, nobody does character voices except me [cross talk] so it’s hard to say."
430,35,Magnus, I turn around!
431,35,Justin," That’s fucking, that doesn’t make any sense! Why would he say that right now?"
432,35,Clint, [high pitched voice] I turn around too!
433,35,Justin, “I’m turning around. We’re all turning!”
434,35,Griffin," Uhm, as you all say that you’re turning around, as you turn around [Justin Out loud.], out loud, you see, a floating figure in a bright red robe."
435,35,Travis, I attack it!
436,35,Justin," Yeah, I blast it with magic missile."
437,35,Griffin, Okay. Magnus roll your dice.
438,35,Travis," Fifteen plus seven, twenty-two!"
439,35,Griffin," Okay, he’s incorporeal and your axe passes right through him."
440,35,Travis," I attack again, I get two attacks per turn. [background laughter] Fourteen plus seven, Twenty-one!"
441,35,Griffin, Your second attack hits! It’s a crit!
442,35,Travis, What!
443,35,Griffin," No, it doesn’t, [Travis Fuck] he’s incorporeal, it passes right through him. Uh, and Taako,"
444,35,Travis, But does he seem miffed?
445,35,Griffin," Uh-nope! Taako, you’re magic missiling him?"
446,35,Justin," No, I, well I mean, it depends, did I know he was incorporeal before, or did I watch him, Travis, attack first? If I watch Magnus attack first, I probably didn’t blast it with Magic Missile."
447,35,Griffin," Okay, uh then-"
448,35,Travis," I step- Magnus steps into the place that he is, and kind of blends in with him and goes"
449,35,Magnus," Oh, Ho Ho, I’m in a red robe!"
450,35,Griffin," He phases, he phases-"
451,35,Justin," Okay, now I do use magic missile."
452,35,Griffin," He uh, he phases sort of upwards so he’s floating above you."
453,35,Red Robe," Okay, excuse me…"
454,35,Magnus, Uh-huh!
455,35,Red Robe, Uh… sup?
456,35,Griffin," No, uh-"
457,35,Travis, A/S/L.
458,35,Justin, ASMR.
459,35,Red Robe, I spoke to you about the hunger of all living things.
460,35,Magnus, When?
461,35,Merle," Well, when was that?"
462,35,Griffin, The last time he fucking saw you. Remember a thing! Remember-
463,35,Travis," No that was in character, Griffin. That was Magnus."
464,35,Griffin, Oh.
465,35,Red Robe," The last, when - in the office building."
466,35,Magnus, In the-? Oh. Oh! With Bane Bane. With Captain Captain Bane.
467,35,Red Robe," Yeah, he tried to poison you. But I st-"
468,35,Magnus, He tried to poison us!?
469,35,Red Robe," Okay, so a lot of things went unnoticed."
470,35,Merle," I’m not remembering, that one is by me."
471,35,Red Robe," Well, take it on credit. I warned you about the hunger of all living things."
472,35,Magnus, Mmhmm.
473,35,Griffin," He motions to all the different planes, and he says"
474,35,Red Robe, This is the power it seeks. The power of creation itself.
475,35,Magnus, Got it.
476,35,Red Robe, A billion billion lives have been devoured by this hunger in pursuit of its power.
477,35,Magnus, A billion billion?
478,35,Red Robe, Yes.
479,35,Magnus, That’s a lot!
480,35,Red Robe, It sure is.
481,35,Griffin," He waves a hand and uh, there is a crate sort of in the back of the room by the lectern. It actually kind of looks like a, kind of like a trash bin? And as he motions towards it, it tips over and some small gemstone disks crash out of it. One of them, you can see, is a very dark disk kind of like black. But you can see definitely like flecks of red and green and blue color in this black disk. This disk, this disk begins to shake and this horrifying black cloud sort of emerges out of it and it slowly creeps towards these disks that are floating in the room, and one by one, just consumes them. As each disk is consumed you hear like, screaming voices coming from it."
482,35,Travis," Woah, hey."
483,35,Griffin," It is an absolutely terrifying scene. It consumes the prime material plane, and you feel kind of sick watching it. After it has consumed all of them, this red robed figure snaps his fingers [snaps] and the cloud disappears. This vision kind of leaves you. And he says-"
484,35,Red Robe," There is no more running, there is no escape. This world is life’s last chance."
485,35,Magnus, Who are you?
486,35,Red Robe, It's not time for me to tell you that yet.
487,35,Magnus, What time will you tell me?
488,35,Red Robe," In like, ten episodes."
489,35,Magnus," Okay, I'll put it in my calendar."
490,35,Griffin," He says, uh"
491,35,Red Robe," You three are the on– Taako? Taako, where did you find that umbrella?"
492,35,Taako," Yeah, I took it off this uhh, I took it off this dead thug with a red robe. This dead guy, he had a red robe."
493,35,Red Robe," [breathless panic] You f- you, you-"
494,35,Magnus, He was totes dead!
495,35,Taako, He was dead though I didn’t [cross talk]
496,35,Merle, You just killed-Did we kill him or?
497,35,Taako, No.
498,35,Merle," No. Okay, we would have!"
499,35,Magnus, He was long dead.
500,35,Taako," No problem, no problem here."
501,35,Griffin," This, this, he’s starting to shudder. There’s red electricity kind of crackling through him. He says-"
502,35,Red Robe, Wha- What? Where di-? What did you? You found her?  
503,35,Travis, I’m gonna step a little bit away from Taako.
504,35,Merle, It was a lady?
505,35,Griffin, As he shouts that he bursts into flames and disappears.
506,35,Justin, Dag.
507,35,Clint, Wow.
508,35,Griffin, And the lights turn back on and Lucas says-
509,35,Lucas, —What’s bigger than this?
510,35,Travis, And we turn around and he’s got his penis out!
511,35,Taako," Listen, we've been through a few things just now, time— it doesn't matter, go ahead with your little presentation. I think we're all getting a big kick out of it. [Griffin Um] Hey, by the way, I meant to tell you, this is a great PowerPoint."
512,35,Lucas, Thanks!
513,35,Taako, A lot of people forget to give props for PowerPoints [crosstalk]
514,35,Lucas, Thanks!
515,35,Magnus, It’s not as easy as it looks.
516,35,Lucas," Thanks, I-"
517,35,Taako, It’s not as easy as it looks. There’s a lot of aesthetic issue-
518,35,Magnus, I like the fonts!
519,35,Lucas," I worked really hard on it. There’s some good clipart. Like free, fair-use clipart."
520,35,Travis, Hey it’s me Clippy! I see you’re trying to explain the “Planar system.” Might I recommend comic sans?
521,35,Griffin," Noelle, uh Noelle has her little satellite dish scanner thing out. And its- it’s glowing green. And she says-"
522,35,Noelle," Well, that’s weird,"
523,35,Travis, ‘I sense green.’
524,35,Noelle," I had my scanner on before, from before when I scanned that crystal monster. It’s uh, I’m picking up- it says it’s. One of you guys isn’t a lich are you?"
525,35,Magnus, A what?
526,35,Noelle, A lich.
527,35,Magnus, I’m not! 
528,35,Taako," No, not to my knowledge."
529,35,Merle," No, but, but -  I have a couple of liches that are friends."
530,35,Magnus," Yeah, oh yeah, I got lich friends."
531,35,Merle," They’re cool, they’re really - they’re good, good people."
532,35,Noelle,"I guess my scanner is on the blitz. On the fritz, I’ll have ta’-"
533,35,Magnus, You’re sensing a lich?
534,35,Noelle," Yeah, I’ve picked up on a lich being in the room."
535,35,Merle/Magnus, A lich? [cross talk]
536,35,Magnus," Like a lich,"
537,35,Merle, Like a lecher? I don’t-
538,35,Magnus," A lich is like, uh, an undead, like uh-"
539,35,Griffin," You could make an arcana check, and I can tell you exactly what a lich is."
540,35,Travis," Alright, yeah, rolling. I forgot about that. Okay, that’s not gonna do it. That’s a four plus zero four."
541,35,Griffin," Yeah, uh, you have -"
542,35,Clint," Alright, I’ll make one. With my plant arm. Fifteen!"
543,35,Justin, Nice.
