,episode,speaker,lines
0,40,The Adventure Zone,
1,40,Dungeon Master & NPCs, Griffin McElroy
2,40,Magnus Burnsides, Travis McElroy
3,40,Merle Highchurch, Clint McElroy
4,40,Taako Taaco, Justin McElroy
5,40,Episode 40- Lunar Interlude III - Rest & Relaxation,
6,40,(part of TAZscripts on Tumblr),
7,40,Griffin," Previously, on the Adventure Zone…"
8,40,Griffin," Killian gives you guys some gifts, too. Hand-carved, personalized whetstones. But they’re nice, they’re carved in the shape of… ducks."
9,40,Travis, Awww.
10,40,Killian, They’re my favorite!
11,40,Griffin, She says. 
12,40,[Travis laughs],
13,40,Merle, You’re chopping off my damn arm! Seriously. 
14,40,Merle, God... lied... to me…
15,40,[Griffin laughs],
16,40,        Magnus, God lied to you?
17,40,Griffin," Angus is off in a corner, he gives you guys a big thumbs up."
18,40,Justin, I give Angus a thumbs down.
19,40,Angus," Oh my god, sir! Have you become… have you been learning…  wizardly magics?"
20,40,Travis, I take his nose.
21,40,Angus, Oh my god!
22,40,Announcer, What kind of nasty things do our boys get into betwixt adventures? I’m almost afraid to find out in... The Adventure Zone!
23,40,[THEME MUSIC," ""Déjà Vu"" by Mort Garson (full song on YouTube)]"
24,40,{1,17}
25,40,[A Lunar Interlude plays for a few seconds],
26,40,Griffin," Um, so it’s- so it’s been a few weeks, since you successfully completed the Crystal Kingdom mission."
27,40,Travis," What- what have I done [said as ‘down’] with my downtime, Griffin? Paint me a word picture."
28,40,Griffin," That's up to you, dawg! Maybe you're into puzzles?"
29,40,Travis, Uh-
30,40,Griffin," Maybe you're into- maybe you did a bit of long-overdue self-grooming? Those sideburns, those sideburns, man, they need some-"
31,40,Travis," Okay, I definitely brushed out the sideburns."
32,40,Griffin, Okay-
33,40,Travis, Maybe got a little sideburns perm.
34,40,Griffin, Two hundred thousand nits fall out.
35,40,Travis," I- I don't see Magnus doing puzzles, but I see Magnus wanting to do puzzles, but like-"
36,40,Griffin, Magnus kind of is a puzzle.
37,40,Travis," Man, that's so deep, Griffin."
38,40,Griffin," Thank you. Um… uh, I can tell you what you're doing right now."
39,40,Travis, Pooping.
40,40,Griffin," This was the scene that you wanted to do for your first solo sort of character development scene, for Magnus's-"
41,40,Travis," Oh, I thought you meant what I was doing in real life."
42,40,Griffin," I have so many questions, like how would you even get the mic stabilized… "
43,40,Travis, Wha- that's my whole recording setup!
44,40,Griffin," Okay, wonderful. Um, uh, the scene that you have decided to do with Magnus, uh, is, uh, let's just hop right into it!"
45,40,Travis, Okay.
46,40,Griffin," You, uh, so you walk into the private training moonbase dojo of Carey, Killian, and new regulator team member Noelle, um, and, uh, you see the three of them performing some, some pretty impressive acrobatic violent manoeuvres, and, uh, it looks like Killian and Carey are kind of, like, breaking in Noelle, like teaching her the- the new manoeuvres. Uh, every once in awhile Killian will shout, uhh, “Orange Eleven”! Or, that's not her voice,"
47,40,        Killian, Orange Eleven!
48,40,Griffin," And then, uh-"
49,40,Travis, Did you accidentally do a character voice when the character voice is your voice?
50,40,Griffin," Is my own, yeah."
51,40,Travis, Yeah.
52,40,Griffin," And then Noelle will like, grab Carey and do like a fastball special with her."
53,40,Travis, Mmm-hmm.
54,40,Griffin," So, so they're running through some, some routines, uh, and they see you, uh, walk in, and uh, stop--stop their practice sesh. Uh, Killian throws the two girls some towels, Noelle says,"
55,40,Noelle," Well, I don't need that, ‘cause I'm a robot."
56,40,Griffin," Uh, and Carey walks up to you, and says, uh,"
57,40,Carey," Oh, hey, Magnus, what's going on?"
58,40,Magnus," Oh, I-, I-, I didn't, I didn't mean to interrupt."
59,40,Carey," Oh, no, it’s fine, we've been at it for a few hours. She's really coming along fast."
60,40,Magnus," I-, I can- I can come back, I didn't--I, uh, if there's a better time, don't-"
61,40,Carey," No, spill it, what's going on?"
62,40,Magnus," Carey, can I talk--can I talk to you in, in private, please?"
63,40,Carey," I just became instantly pretty nervous, but, uh, yeah, I guess so--uh, ladies, take ten!"
64,40,Griffin," And, uh, Killian and Noelle waltz out of the room. Literally, they waltz, which is weird."
65,40,Travis, It's beautiful.
66,40,Magnus," I don't, okay, I don't know how to say this. Um, so, in the lab, um… "
67,40,Carey, Yeah?
68,40,Magnus," I, I really liked your moves! I thought, I--you, uh-"
69,40,Carey," Okay, I'm gonna stop- I'm gonna stop you right there, Mag, because… you're a good dude, and I had a lot of fun in that crystal kingdom, killing a bunch of robots with you, but I, uh, you're not really my… cup a’ tea, um, so to speak."
70,40,Magnus," OH! No, no."
71,40,Carey, No.
72,40,Magnus," No, no, no--"
73,40,Carey, No?
74,40,Magnus," No, no."
75,40,Carey, No.
76,40,Magnus," No, no no no no no no, no! No. I--I want you to train me."
77,40,Carey," What do you mean? Like, in the ways of love? ‘Cause--"
78,40,Magnus," No-ho-ho, no. Carey, I have just always punched? And kind of rushed? And, done--you know, kind of thrown myself into everything."
79,40,Carey," Right, right."
80,40,Magnus," But I saw you move and finesse and almost dance your way through battle, and--I want to be more precise. I want to, I want--I've done some things in the last couple of missions that, looking back on, some might say were suicidal. And I think that--"
81,40,Carey," Yeah, you've done some, you've done some goof-ass stuff."
82,40,Magnus, I think that I--
83,40,Carey," You want me to take you to thief school, is what you're saying."
84,40,Magnus," Yes! Yes, I want to learn to fight smarter."
85,40,Carey," Okay, um- I think you're a great guy, Mag, but you are also the-- just the loudest single person I think I've probably ever met. So, I'm, I--I can totally train you, but the question is are you willing to be trained?"
86,40,Magnus, Yes?
87,40,Carey," That was the first test, you passed it."
88,40,Magnus, Yeah!
89,40,Griffin," Okay so, over the uh--why don’t you roll a persuasion check, just to see if like. She’s gonna, like, require anything from you. I don’t know, is there a persuasion skill?"
90,40,Travis," Umm… that’s such a good question, Griffin, [sound of papers shuffling] let me see here. Yes, there is!"
91,40,Griffin, Mmkay. Go ahead and roll that just to determine if she’s gonna require anything from you.
92,40,Travis," [sound of dice rolling] Probably, because that was a three."
93,40,Griffin, Mmkay…
94,40,Travis, Plus one! Four.
95,40,Carey," Um, listen. I’m into it, I’m into this idea. Um, the question is, I think it would be only fair if you could teach me a little something-something,"
96,40,Magnus, [crosstalk] Okay.
97,40,Carey," On the side, too. And again, I know I said something-something, I mean it in a strictly platonic sense. Um,"
98,40,Magnus, [crosstalk] Great! Great great great. Good. Cause I’m not - you’re not my-yeah.
99,40,Carey," [crosstalk] What kind of--sure. What kind of skills do you bring to the table, you think ol’ Carey Fangbattle might benefit from?"
100,40,Magnus," Well, I know a lot about animals, I know a lot about vehicles, I can build stuff. I’m a carpenter, do you wanna learn carpentry?"
101,40,Carey," Bing bang boom! Bingbangboom. I need a, uh, I’m actually in need of a birthday present. I could use, I don’t know, some sort of special box, or a neat chair, or a- a really nice bookshelf or somethin’?"
102,40,Magnus, Tell me about this person. I like to craft the thing specifically for the person.
103,40,Carey," She--She’s super big, "
104,40,Magnus," Ah-huh,"
105,40,Carey, I-it’s Killian.
106,40,Magnus, Okay. Yep! Great great great.
107,40,Carey," She likes ducks, she - she’s a duck fan."
108,40,Magnus, Yeah! Would she like a puzzle box shaped like a duck?
109,40,Carey, That sounds--yes.
110,40,Magnus," Alright, we could do that."
111,40,Carey, That’s such a good gift I might teach you the secret thieves’ skills that I wasn’t supposed to--that my sensei told me not to divulge to anybody.
112,40,Magnus," And you know what, if we butter him up a little bit, Taako might enchant it so that it quacks when you solve it."
113,40,Carey, OH YES.
114,40,Magnus," I know, it’s pretty good!"
115,40,Carey, Bazinga!
116,40,Magnus, Everyone's gonna want one.
117,40,Griffin," Uh, okay, so, she is convinced. And over the course of the next couple of weeks, Carey takes some time out of her regulator training schedule to teach you some of the thieving arts!"
118,40,Travis," Now, Griffin, would you say it is a simultaneous montages of her teaching me thieves’ arts and us carving a duck."
119,40,Griffin," Uh, yes. It’s side by side,"
120,40,Travis, [crosstalk] Concurrent montage!
121,40,Griffin," She starts off and carves a duck, but it’s more of just sort of a ball? With like, a face but no neck. So it’s just like, on the front of the ball. And she says."
122,40,Carey, I know this isn’t my best.
123,40,Travis, And it’s just a shot of -  as music plays - of Magnus putting his head down and shaking his head back and forth.
124,40,Griffin," Yeah. I do wanna run through some thievery training with you, [TravisOkay.] s-so you’re sitting in the Regulators dojo dome, and just sort of sitting cross legged on the floor, and she’s holding a bean in her hand. And,"
125,40,Travis, [crosstalk] Lik-like a bean? Like a food bean?
126,40,Griffin," [crosstalk] Yeah, a little pinto bean. And she says,"
127,40,Carey," If you’re able, snatch this here be-"
128,40,Travis, [crosstalk] I take it.
129,40,Griffin," Okay. Roll a uh,"
130,40,Travis," [crosstalk] Oh, sorry."
131,40,Griffin," You can roll whatever you want, maybe a sleight of hand check would be appropriate? [sound of dice rolling]."
132,40,Travis, That’s a 19 plus 2. 21.
133,40,Griffin," Mmkay, yeah, you snatch that bean right out of her hand, and she says,"
134,40,Carey," Uh, okay, you didn’t let me finish but fair’s fair. That was a good bean grab, m’boy."
135,40,Magnus, Thanks!
136,40,Griffin," She holds up her left hand, and in it is your wallet."
137,40,Magnus, Ohhhh… 
138,40,Griffin," She says,"
139,40,Carey," Ha ha! That was lesson number two. Being speedy is really important, b-but so is whipping up a good distraction from time to time."
140,40,Magnus, You got me.
141,40,Carey, I need that bean back.
142,40,Magnus, I need my wallet back. [pause] Same- same time?
143,40,Carey," [Griffin laughing] One, two… "
144,40,Griffin," Later on, a few days later, in the same montage, she’s just walking in circles around the room as you sort of prowl on the shadowy outskirts of the room. And she has challenged you to pick her pocket."
145,40,Travis, Okay… I do that.
146,40,Griffin," Mmkay, that would be - what check would that be, like, stealth, do you think? And then probably-"
147,40,Travis, [crosstalk] Is this pre-training? Pre-leveling up? 
148,40,Griffin, Oh yeah yeah yeah yeah.
149,40,Travis, So my stealth is still bad. 
150,40,Griffin, Yeah.
151,40,Travis," Okay.. my stealth is plus 2, so let’s see."
152,40,Griffin, That’s actually not bad! [sound of dice rolling]
153,40,Travis," Oh yeah, it’s another 19! So 19 plus 2, 21!"
154,40,Griffin," Alright, you sneak up behind her, and sort of walk in step with her very silently, and go ahead and roll sleight of hand? Is that the best? There’s not a pick pocket check, is there? "
155,40,Travis," No, I think it’s gotta be sleight of hand too. [sound of dice rolling] That’s not as good, but 13 plus 2. So 15."
156,40,Griffin," Mmkay- Yeah, she’s wearing a loose fitting robe, which is not really her style but sort of giving you an easier time. And you reach in and you pull out a smoke bomb, which explodes in your face! And she says,"
157,40,Carey," That’s lesson three, homie. Gotta always carry a smoke bomb, smoke bombs are great."
158,40,Magnus," B-but now, okay, hold on though, Carey, I did do the thing, like, I did pick your pocket, that’s just mean-"
159,40,Carey, [crosstalk] That’s that basic! Those are the basics!
160,40,Magnus," [crosstalk] So rule number three is “always be aware that when you’re picking someone's pocket, they might be a dick”."
161,40,Carey," It’s a good thing to remember, there could be pudd- [Travis laughs] they could have just loose pudding in there! And then you put your hand back and-"
162,40,Magnus," [crosstalk] Who walks - who walks around with loose pudding, Carey?"
163,40,Carey," Taako definitely, I’ve - I’ve had some of his pocket pudding before."
164,40,Magnus," Okay. Yep, okay. Y’know, asked and answered."
165,40,Griffin," And then I think, later on in this montage, a couple days later, I think you guys are just like - just like fighting? But she doesn’t, like - no weapons, no Phantom Fist, just, like, just straight-- straight fisticuffs fighting. So go ahead and make an attack roll, on her."
166,40,Travis," [sound of dice rolling] Uh, that’s probably not good. 8. I mean, plus 7, 15."
167,40,Griffin," Uh, no, she easily like, dodges out of the way of that and grabs your arm and like, jiu jitsu flips you and, like, carries your momentum. She says--"
168,40,Travis," [crosstalk] Wait, I’m gonna do an acrobatics saving throw! Hold on."
169,40,Griffin," Okay, cool."
170,40,Travis, [sound of dice rolling] Or is that athletics saving throw?
171,40,Griffin, It’d be acrobatics.
172,40,Travis," Okay, well that’s not gonna do it. That’s a 2 plus 2, 4."
173,40,Griffin," Okay, you try to land on your feet but you overcorrect, and land directly on your face and your wiener!"
174,40,"Travis, laughing", [crosstalk] At the same time?
175,40,Griffin, At the same time. And she says—
176,40,Travis, [crosstalk] What kind of pill bug roll am I in?
177,40,Griffin," She sits down, and she says,"
178,40,Carey," Oh, sorry, that was - I was just supposed to dodge it, that was just kind of reflexive."
179,40,"Travis, impersonating Carey", Sorry about your wiener.
180,40,Carey," Sorry about your wien, um. Yeah, it’s-- how’d you get that scar over your eye?"
181,40,Magnus, Um…
182,40,Carey, Th-this is an important part of the lesson.
183,40,Magnus, [avoiding the question] I-I got it in a fight.
184,40,Carey," No, that, I figured that. I figured it wasn’t like, a big paper cut, you filing some documents. You got hit though, right?"
185,40,Magnus, Yeah.
186,40,Carey," That’s the biggest thing for you, like, not getting hit is like, the whole job. A good thief doesn’t--"
187,40,Magnus," [crosstalk] To be fair, when I got the scar, I was pretty drunk."
188,40,Carey," Okay. I- I think that’s gonna be the hardest thing for you, Magnus, like, you’ve always struck me as the big brash guy willing to take the big hits so somebody else doesn’t have to. T-there may be a time where you aren’t able to do that, if you really wanna pursue this lifestyle."
189,40,Magnus, When I can’t protect someone --
190,40,Carey," [crosstalk] When you don’t take the big hit, and let somebody else do it. You’re surrounded by pretty strong people, you don’t gotta be the- the damage sponge all the time, you know?"
191,40,Magnus," Yeah, but like. I-I don’t wanna lose Merle and Taako."
192,40,Carey," Yeah. Yeah, they’re pretty good. I guess I understand what you’re saying. Hey, you know what? I think I learned a little bit of something else from you, too."
193,40,Magnus, Making a duck?
194,40,Carey," No - you, - I think duck-making is probably beyond my capabilities."
195,40,Magnus," No, you’re doing great, it’s really coming along!"
196,40,Carey, Don’t you bullshit me.
197,40,Magnus," No, it’s good--"
198,40,Griffin," She holds up a duck, but it’s got two asses. No head this time."
199,40,Carey, I got the - I flipped the thing upside down accidentally while I was mid carve.
200,40,Magnus, A lot of people would prefer that version!
201,40,Griffin," Yeah, so uh, you spend the next couple weeks learning from Carey. Master - not mastering the art of thievery, but getting on enough that you feel a little bit more comfortable, a little bit more confident. And Carey holds a little impromptu graduation ceremony for you."
202,40,Travis, [hums Pomp and Circumstance]
203,40,Griffin," Right, except you’re not really wearing a graduate’s cap and robe. You actually have to sneak up to her, to steal your diploma. It’s a very on-brand ceremony. And at the end of it, Carey is also holding her enchanted hand carved duck box. You did a lot of the work on it, you - she did the butt half, like, really good, but enlisted your help on the head half, she seems really happy with it. And she says,"
204,40,Carey," Magnus, I’ve actually had a pretty great time hanging out these past couple weeks. And, I wanted to give you something."
205,40,Griffin," And she hands you a small leather pouch with some belt loops on the back of it, that you might string a belt through? And when you open it up, you find a set of fairly old looking, but pretty sturdy thieves tools."
206,40,Travis, Ooh!
207,40,Griffin," There’s like a, like a lock pick, a bunch of tools you don’t really understand what they are? Like metal loops and rings and some sort of small hooks? And she says,"
208,40,Carey," I can show you how to use those but, um, I bought those. When I decided to become a thief. And I’ve gotten a way better set now, but um, I want you to have ‘em."
209,40,Magnus," Well I have something for you too, Carey. Um--"
210,40,Carey, [crosstalk] Another - a second duck?
211,40,Magnus," Well- well, hold on."
212,40,Travis," And Magnus reaches into his pocket, and pulls out a wooden ring that he’s carved, with a rose on top, and it’s carved out of rosewood."
213,40,[A Lunar Interlude fades in.],
214,40,Magnus," I made you this, I had to guess at the size, but I think this would fit Killian. If you would like to put it in the box, for her, it’s completely up to you, I won’t say a word."
215,40,Carey, That’s a real sweet thought.
216,40,Griffin," She says,"
217,40,Carey, Hey. High five me. Right now.
218,40,Magnus, High five! [high five sound]
219,40,{17,00}
220,40,Griffin," So you have been off duty for a couple weeks now, Merle. You’ve basically been put on injured reserve, essentially, because of the trauma that you went through in the Crystal Kingdom saga, and again, I apologize for that."
221,40,Clint," No, I think it all worked out. I think it’s made me more of a mythic figure."
222,40,Griffin," But yeah! You have been granted sort of special leave… oh, that was a tree pun!"
223,40,Clint, [laughs] I feel like a sap for not getting that!
224,40,Griffin," [makes some awful noise, like laughing except instead of ‘ha’ it’s ‘oh’, like a dolphin] That’s the only - that’s my genuine laugh, if I do it any other way I’m being sarcastic."
225,40,Clint," I don’t wanna hear the genuine one anymore, then."
226,40,Griffin," Okay fantastic, don’t say any more funny stuff. So you’ve been given special leave due to sort of the trauma of the last mission, and were granted an all-expense paid weekend long spa resort visit."
227,40,Clint, Sssshut up!
228,40,Griffin," Yeah, congratulations. This is a special bonus on top of your regular payment for the mission. You were given a plus one, for- for this, uh, spa stay - I should mention this was a scenario that you came up with - and the person you chose to go with you as your plus one surprised basically everyone. You chose the Director of the Bureau of Balance to go with you for a spa visit with you."
229,40,Clint, Yeah!
230,40,Griffin," And let's say you’re about a day into this spa visit, you’ve gotten a thorough scraping. You’re kind of a crunchy individual, so I imagine there was a lot of -"
231,40,"Clint, resigned", Yeah.
232,40,Griffin, Cruft to be removed in nice long aromatic hot baths. I wanna hop in-
233,40,Clint, [crosstalk] You mean I got exfoliated?
234,40,Griffin," Well you got exfoliated, you got-- you got scrubbed down with a fantasy loofah. You’ve been getting the works. Cleaned up, inside and out. There’s a colonic element."
235,40,Clint," Wha? Oh, well."
236,40,Griffin," So, for this scene, you and The Director are - by the way, it’s been maybe a little bit uncomfortable between you two? Just because like, she’s like your boss, and wasn’t quite sure why you picked her to go with you? And she’s not really one for rest and relaxation, so, uh, it’s been a little bit uncomfortable, but you guys - I think you guys are both getting the same spa treatment right now. What kind of spa treatment would you be getting?"
237,40,Clint," Well I think… I’ve been exfoliated, we’ve done all that. So something that gets rid of the toxins, you know, now that I have, y’know, tree sap flowing in my veins, along with the blood, I figure I gotta get some stuff out of there?"
238,40,Griffin," Okay. How about a um, like a macrobiotic mud sort of situation? So it’s like a hot macrobiotic - biotic mud bath?"
239,40,Clint," Yeah! Yeah, yeah yeah!"
240,40,Griffin," You and The Director are in side by side sort of baths, and you get the impression this is maybe set up as a couples activity? Which is just really, really driving home the discomfort of this situation. And let’s say your arm is off, and in its own small potted plant mud bath."
241,40,Clint," Oh yeah. Because if it was going to be anywhere - it’d have to, y’know, - if anything was gonna be in the mud, it’d be old tree arm."
242,40,Griffin," Old tree arm. And somebody is actually spraying it, with a sweet-smelling fluid out of a spray bottle and like pruning it and just seeing to it. And it seems to be really enjoying that. Do you have any refreshments? They have a lot of refreshments here."
243,40,Clint," [crosstalk] I would love some refreshments, yeah."
244,40,Griffin, L-like a tea sandwich?
245,40,Clint," Tea sandwiches, yeah, and maybe some cucumber water?"
246,40,Griffin," Okay. Yeah, you get the whole cucumber suite, and the Director, the Director’s drinking a huge like, Tami Taylor-sized [Clint laughing] glass of dark purple wine. And so it’s been a little bit uncomfortable, but she breaks the silence after sort of the attendants, the spa attendants, leave the room and it’s just the two of you. And she says,"
247,40,The Director," Merle, I uh, I suppose I should thank you, it’s been a bit stressful for the past, ohh… like, 7, 8 years? So I guess I could use a break away from it all. I appreciate you choosing me. I guess my question is... why did you decide to take me on this spa trip with you?"
248,40,Merle," Ah, well, you know. You are my boss, and uh, y’know, we haven’t really hit it off very well, and you know, you and I, we’ve got a lot in common. Y’know, a little bit more in age, than the other two young whippersnappers."
249,40,Griffin, She- she laughs.
250,40,The Director, I-I suppose that is- that is true.
251,40,Merle," I mean, you’re still much younger than me, but, you know."
252,40,The Director," Well, thank you for that."
253,40,Merle," You’re very mature. You’re a mature woman, and I’m a mature-ish man. And you know, I read women pretty well. Women and trees. [Griffin laughs] And I was able to see you know, this lady needs a break and a friend. I can be the friend, and I can help her get the break."
254,40,The Director," I appreciate you being considerate like that. Y-you understand - I try not to be cold, it’s just. I have to keep a professional distance from my staff members."
255,40,Merle, [crosstalk] You got a tough gig! Tough gig!
256,40,The Director," It is a tough gig. I wish I could, you know, go on adventures and-- eat macaroons all night long and gab about--"
257,40,Merle," [crosstalk] Macaroons or macarons [pronounced macarones]? Cause I really love the macarons. You know, there’s a difference!"
258,40,The Director, Is that what you call macaroni?
259,40,Merle," [laughs] No no no. Macarons are like the cookies, but they’ve got a little icing in the middle. Mhm!"
260,40,The Director," This has been pretty confusing so far-- Merle, I wanna know a little bit more about, sort of… you always seem to keep kind of an irreverent attitude, I think it’s safe to say? Where does that come from? "
261,40,Merle," Ah, basic insecurities. About my appearance, my height, my only having one damn arm now. Just always been that kind of guy! Hey, you know, why worry about things, have a light attitude. We’re not getting out of this life alive anyway! Why not enjoy the process?"
262,40,Griffin," She takes a big sort of gulp out of her giant glass of wine. And says,"
263,40,The Director, I’m surprised to hear you can keep things sort of… that light hearted and still be a man of… a man of the cloth.
264,40,Merle," Well, I’m glad you brought that up. I’ve never been a traditional man of the cloth, I’m more like uh - I don’t know if you ever saw the movie Poseidon Adventure but uh, Gene Hackman. That’s more of my role model. Gene Hackman, you know, a priest who curses a lot and really doesn’t get himself tied down. And, hey, I’m gonna be honest with you Director, because - I’ve been having some doubts.  Some conflict, some tests of faith here over the last, what -"
265,40,The Director," To be frank with you Merle, we’ve, we’ve both seen some pretty existentially horrifying things. How do you go about keeping the faith when you see such horrible things?"
