,episode,speaker,lines
266,40,Merle," Well, like I said, try to keep an open mind. And you know, while I think having that faith is important, because you need to have that relationship, and you need to have some idea about, you know, some idea about a higher power or a higher purpose. I’ve never been much of a church guy. [Griffin laughs] I know as a priest that sounds a little weird, but yeah. I think it’s more important to just kind of embody the ideals and the things you wanna do and not make a bunch of rules for people. Y’know."
267,40,The Director, So how did you settle on Pan as your patron deity? Is there a story there?
268,40,Merle," Cool beard. Pan’s got a cool beard, like a goatee kind of beard-"
269,40,The Director," That’s, sorry. You’ve based your sort of theology and life direction on a--"
270,40,Merle," [crosstalk] On a beard. Yeah. Yeah! And you know, the cloven hooves are kinda cool. I’m a very shallow person, Director. I’m just really- I’m as shallow as a mud puddle. But you know, cool beard, hairy legs. I have hairy legs, I want my beard to be cool."
271,40,The Director, I see. There’s some synergy there.
272,40,Merle," There is. There’s a connection there. I grok Pan. So, you know at first it was “Yeah! That guy's cool! I’d like to be like him!” And I was like a lot of other young dwarves, when I was a kid and the Pannites would come around with their literature and you know, their-- their songs, their contemporary Pan songs, and you know it was all really cool. And we had Pan camps. You’d go to Pan camp and learn about Pan. And it was fun, it was a great way to socialize with people."
273,40,The Director," Yeah no, a lot of I guess, important values being imparted."
274,40,Merle,"Sure yeah, yeah! Playing the pipes, cavorting, there’s a lot of cavorting at Pan camp. So, y’know, that’s how I kinda got dragged in, and next thing you know, I’m learning more about him, and boom bing boom I’m wearing the collar, and well I don’t really wear a collar, but you know what I’m saying."
275,40,The Director," I guess… I’m jealous, in a way. I wish I could have this sort of... comfort... that your deity brings to you, that your faith in Pan brings to you. But I don’t think, I just don’t think I’ll ever be able to make that leap."
276,40,Merle," Well it’s kind of, well, lemme tell you something. It’s pretty much a one-way street. [Griffin laughs] Old Pan, I don’t think Pan really cares. Doesn’t really give a shit whether or not I’m his buddy or not. It’s all about how it makes me feel."
277,40,Griffin," You hear [sound of fingers being tapped on a table] and she says,"
278,40,The Director, Oh I don’t-- I don’t know about that.
279,40,Griffin," And you look over, and your wooden arm is sort of impatiently tapping its fingers-"
280,40,Clint, [crosstalk] Ooh.
281,40,Griffin, - on the side of the tub. 
282,40,Merle," Oh. Well, maybe Pan does give a shit. [Laughs] But you know what, here’s the thing. Here’s my feeling on faith, and maybe this’ll help ya. I’m not trying to convert ya - although I do have a couple of those Pan tracts if you wanna take a look at them. But my thing is if my faith and believing in Pan helps me get through the tough times, hey! What’s the harm? If it helps me- if it helps me get through stressful things and helps me get past all the goo and the blegh and all the blood and stuff, hey! Works to my advantage."
283,40,Griffin, She drains the rest of her fishbowl of wine.
284,40,Merle," Whoa, easy! Easy goin’ Sister Sue!"
285,40,Griffin," She says,"
286,40,The Director," I appreciate you telling me more about this. I-I want you to understand, my whole life I dedicated myself to the study and the service of other people's discoveries, of other people's adventures. I was a supporter. But one day I made the decision to… stop championing other people's heroism and to take the direction of my life into my own hands. And, I lost dear, dear friends because of that decision, but it was the only one to make. So, I-I admire your faith Merle, I-I do, but I think I’m done waiting on anyone to fix my problems for me."
287,40,Merle," Oh no, Pan doesn’t fix problems! Let’s take a look at the stub where my arm used to be, I think it’s more problem causing. But hey!"
288,40,Griffin," You hear that, [sound of fingers tapping]"
289,40,Merle," Yeah, yeah, yeah! But you gotta stand for something, or you’re gonna fall for anything. So listen! You have got faith it’s faith in - in you."
290,40,The Director, I guess that’s a good way of putting it. Let's get some more booze up in here.
291,40,Merle," YEAH, let’s do that! Here, lemme pour that for ya."
292,40,Clint, Glug glug glug glug glug glug!
293,40,Merle, What is this by the way? What is this purple shit that you’re drinking?
294,40,The Director, Grape juice.
295,40,[A Lunar Interlude begins playing],
296,40,Merle, Oh. How old is it?
297,40,The Director, 125 years old.
298,40,Merle," Ahh, you know, there's a name for grape juice that’s  120-something years old!"
299,40,The Director, That was what my jokes sound like.
300,40,Merle," Yeah, we’re gonna- We’re gonna work on that."
301,40,{30,39 A Lunar Interlude fades out.}
302,40,Griffin," So you, Taako, are also- you got some downtime after finishing the Crystal Kingdom campaign. And you’ve decided for your time off, and maybe you can talk a little bit more about the motivations that have led you to do so, because I thought this was a surprising character choice. You decided to give young Angus McDonald, boy detective, some tutelage in the ways of magic after he expressed some interest in it in the last episode."
303,40,Justin, Yes. I feel guilty about the whole silverware--
304,40,Griffin," [crosstalk] About all of just this, oh just the silverware, not like the constant ceaseless bullying of this ten year old."
305,40,Justin," [crosstalk] That’s kind of like, fun ribbing. Just like, two equals ribbing each other. I don’t feel particularly guilty about that, no, I feel a little guilty about stealing his family's silverware and lying about it."
306,40,Griffin," [crosstalk] And pawning it off, for like, I think you bought like a soda pop with it. [Justin laughs]"
307,40,Justin," Nothing! I did nothing with it. In the grand scheme of our adventures, it was not a lot of money."
308,40,Griffin," Yeah, okay, that’s fair. And so you’ve decided to give him some magic lessons. So it’s mid afternoon, and you are in the Bureau of Balance cafeteria - the mess hall. And it’s between meals, there’s a kitchen staff cleaning up in the backroom, you can hear them clinkin’ and clankin’ around back there as they wash dishes and prepare for the dinner service.  But basically, you got a big open room right now, you’ve moved some of the tables out of the way. And in walks little five foot nothin’ Angus McDonald, wearing his Sunday best, and he’s holding a little dinky wand. And he just prances into the room, he’s very excited. And he goes,"
309,40,Angus, Hello sir! It’s magic day! It’s magic day!
310,40,Taako, I suppose... I’m already regretting this.
311,40,Angus," [very quickly] Oh, I’m sorry, I can tone it down if you’d like, I’m just excited to begin my magic. My magic adventure into the - into the arcane arts!"
312,40,Taako," Okay, alright. Let’s calm down a little bit."
313,40,Angus, Let’s - what kind of spells am I gonna learn today?
314,40,Taako," No spells today, the first day isn’t about spells. It’s about the spells you don’t learn. Really on the first day-"
315,40,Angus, [crosstalk] Okay!
316,40,Taako, How many spells don’t you know?
317,40,Angus, All of them?
318,40,Taako," Mmm, good start, all--"
319,40,Angus," I mean, I know all about the principles of arcane interaction and sort of the different schools of magic and how they behave, I’ve done a lot of studying up. But for some reason I just can’t seem to get the dang magic to come out!"
320,40,Taako," Sure, here’s your first problem what is this you’re holding here?"
321,40,Angus, My magical wand?
322,40,Taako," Yes, what is this you have here, where did this come from?"
323,40,Angus," Leon gave it to me because I helped him solve a couple mysteries on the side. Those didn’t- those didn’t make the episode cut, but there was a whole little campaign we went on together!"
324,40,Taako," Okay. See, the problem is, a lot of people get wands and they think “Well, magic time, baby,” like starting a car, but really a wand is just a conduit for the magic that has been inside you all along."
325,40,Angus, That’s wonderful!
326,40,Taako," Yeah, it’s pretty inspirational ‘n shit. So-"
327,40,Angus," [interrupting] So how do I get that magic to come out of me, sir?"
328,40,Taako, Put the wand down first.
329,40,Angus, Okay.
330,40,Griffin," He very gently, very gently sets it down. Like, very very very-- This thing is more precious to him than his family’s silverware. He sets it down gentle on the ground."
331,40,Justin," [crosstalk] Ironically, ironically."
332,40,Taako," So, the first thing is what if you don’t have your wand? Well that’s a good question, it’s on the table right? So you don’t have it. So here’s- here’s the first spell I’m going to teach you, are you ready?"
333,40,Angus, Yes sir!
334,40,Taako, Mage Hand!
335,40,Angus, Oo-oh! I’ve heard of- I’ve heard of Mage Hand.
336,40,Taako," That’s good! Mage Hand, it is a cantrip, which is the ea- one of the easiest things to cast. And it’s conjuration, which just means making something out of nothing."
337,40,Angus," I know tha- I know what the words mean, sir. [pause] I’m sorry, I didn’t mean to step on your thing,"
338,40,Taako, [crosstalk] You got a problem here?
339,40,Angus," [crosstalk] No, please teach me."
340,40,Taako, Is this a problem? Trying to salt my game?
341,40,Griffin," You run him through sort of the incantation, that conjures Mage Hand up out of nothing, and after a good ten minutes of him just standing with his hands, his open palms, like, an inch apart, a very very small spectral hand, with just a single finger, just the ring finger appears, and instantly just, like, falls on the ground and starts twitching. And Angus sees this like, monstrous, just pained hand and he starts, um"
342,40,Angus, Oh! Oh god!
343,40,Taako, Kill it! Kill it!
344,40,Angus, [crosstalk] What did I make?
345,40,Taako," Angus, kill it! Dude, stab it with something!"
346,40,Griffin, He picks up a fork from the table and stabs the hand-
347,40,Taako," [crosstalk] Stab it! Stab the hand with the fork, quick! "
348,40,Griffin," He stabs the uh, he stabs the hand with the fork and it dissipates back into smoke. And he goes,"
349,40,Angus, That was terrible!
350,40,Taako," That was great! That’s a-- You did a nothi- you did a something out of nothing! That’s magic, baby."
351,40,Angus," I guess that’s true. I’d like to make a full big hand last time. Hey Taako, can I ask you a question? "
352,40,Taako," Yeah, sure!"
353,40,Angus, Who taught you how to do magic?
354,40,Taako," Uh, that. That’s a long story, I-I didn’t so much learn, I used to be a chef, um, a long time ago."
355,40,Angus," That’s right, you made me those macaroons. Those tasted so good. I ate it as a Candlenights treat for myself by myself in my room. [Taako lets out a pitiful aww] Yeah, I just cuddled up next to the Candlenights bush, and there weren’t so many presents under mine but that’s okay. And I ate the macaroon and it was the highlight of my holiday."
356,40,Taako," I- I tried to learn, um, I was a chef and I thought transmutation magic would help... you know, spice things up a bit, right? Nobody's impressed if you put mustard on a hotdog, because you had the mustard, but what if you- if you went into a box with just mustard and a hotdog and came out with like, chicken cordon bleu? People would be really impressed by that, right?"
357,40,Angus," That would be amazing, sir!"
358,40,Taako," Chef du Jour. So yeah, I tried to do that, I wasn’t really that um… comp-e-tent at first. And then I sort of lost control. And I was transmogrifying things sorta left and right without really thinking about it. Which was a bad scene. And then-"
359,40,Angus," Well, absolute power corrupts absolutely! As my grandpa said."
360,40,Taako," That’s not relevant here, but uh, a fine point and well observed."
361,40,Angus," So why don’t you cook very much anymore, sir? The macaroons you made were so delicious, and I wonder why you don’t cook for your friends more often sir?"
362,40,Taako," [sighs] Well Angus, uh, one time I transmogrified something that, uh… I transmogrified it into something you really shouldn’t eat, ever? For life, to live, I mean? And, uh, a lot of people ate that. And that went... so sideways. Um... I-I just decided I would never again cook for people I cared about, because I couldn’t risk, um, y’know, something happening to them. Until I get this under control, I guess."
363,40,Angus," That’s very sad, sir. I’m sorry- I’m sorry for making you bring that up. I can tell that it upset you."
364,40,Taako," Yeah, that’s okay. I just don’t cook for anybody who’s close to me. That I care if they live or die, I guess, more specifically."
365,40,Angus, You did let me eat the macaroon.
366,40,Taako," [High pitched] I did! I did. Hmm… that must have been a lapse, I gue- you know what, in hindsight? That was a lapse of judgement. I was actually just really excited about making macaroons, and I’m fairly certain that I didn’t, ummmmmm, poison-"
367,40,Angus, [crosstalk] Didn’t goof that one up!
368,40,Taako," Didn’t goof - didn’t goof that one up, as near as I can tell. I mean, you’re here, right? You’re fine! You were- have you always been this height?"
369,40,Angus," Um, I have shrunk like, four inches in- in the past couple months!"
370,40,Taako, Not related. I’m sure that’s not related.
371,40,Angus, I thought it might just be weird moon gravity stuff.
372,40,Taako, [interrupting] Weird moon gravity stuff? That’s exactly - I was about to say that when you said it. It’s amazing.
373,40,Griffin," You spend the rest of that day conjuring up Mage Hands, with different numbers of fingers on it. We did a montage in Travis’s bit, so we’ll do just a very fast one here. Just kind of jump to the end of it, it’s been about a week and a half, and you’ve given him several lessons. And you’re back in that cafeteria between meals again, and Angus says,"
374,40,Angus," Sir, sir! Check it out! Check it out!"
375,40,Griffin," And he holds out his hand, and a small but pretty steady flame appears in it. And he has cast a very competent version of the cantrip Produce Flame. He’s holding it up to you looking for approval."
376,40,Taako," That is awesome. Congratulations, Ang-Agnes."
377,40,Angus, T-thank you sir! I-- Did you say Agnes?
378,40,Taako," [laughs] You have done an amazing job. You know, if you keep it up, then someday you might be a better wizard than I am!"
379,40,Angus," Tha-that’s very kind of you to say, I hope--"
380,40,Justin, And I grab him by his lapels.
381,40,Taako," [low voice] And when that day comes, little man, oh when that day comes... I will summon whatever powers I still have at my disposal, that you have not siphoned away from me, and I will take all of my canny and all of my cunning and all arcana still within my reach, and I will use it to strike you down. Little man, don’t ever, EVER, again challenge my power. [long pause] It’s a monologue I’m working on, Agnes, sorry, that wasn’t actually directed at you. That’s from a one-man show I’m doing."
382,40,Angus," [nervously] O-oh okay, so that was just from your play acting then, sir."
383,40,Taako," You peed your loincloth there Agnes! I know you got a little suit. Peed Your Loincloth is the name of the show. You Peed Your Loincloth, it’s the name of the show I’m working on."
384,40,Angus, C-can I get t-tickets?
385,40,Taako," [laughs] Oh, can’t you just conjure them, Mr. Wizard? [Griffin laughs] Mr. Big Tough Magic Boy?"
386,40,Griffin," And he says,"
387,40,Angus," This is kind of, uh, uncomfortable now."
388,40,Griffin," But he holds out a small, a small cardboard box. With a small ribbon around it. Which he undoes and opens up, and there’s some macaroons inside! He says,"
389,40,Angus," I made th-these for you, sir. To thank you for the magic lessons."
390,40,Taako," Oh hell yeah! Thank you so much, Agnes. I am going to enjoy these, uh… in my bunk!"
391,40,Angus," Y-you don’t wanna eat one right now, sir?"
392,40,Taako," Yeah sure, I’ll eat one right now, what the hell. Only going around once, right?"
393,40,Griffin," You take a bite into it, and the texture’s fine, and the texture’s hard to nail on a macaroon. It is completely flavorless. It’s just-- there’s no flavor in it, whatsoever."
394,40,Taako, [unenthusiastic] It’s fine. It’s just fine.
395,40,Angus," I-I know I probably.. I probably goofed up on the flavor profile, a bit."
396,40,Taako," I’ll tell you what, you got the texture exactly right, and really with a macaroon that’s- that’s the hard part. You gotta make sure to rise, one thing that might help is if you give the pan a little shake after you actually dollop out the meringue you can remove some of these peaks. And also sugar, any sugar-- at all. Would be great."
397,40,Angus," Dang, that was it. Yep."
398,40,Taako," That’s the one, yeah. That helps with structure."
399,40,Angus, I-I was wondering if you could maybe use Prestidigitation to get some better flavors on these bad boys.
400,40,Taako," [sighs] Y-you could, but really-- uh, you shouldn’t cross those streams, little man. That got me into some bad trouble, I wouldn’t recommend it."
401,40,Angus," I was just hoping maybe you could just show me how Prestidigitation works. [Taako sighs] But I understand if- no, I understand."
402,40,Taako," [tired] No, it’s fine. Yeah, Prestidigitation. So this has two components, V and S. [Griffin laughs.] Here you go. I’ll just make these sort of… taste better."
403,40,Griffin," You point your Umbra Staff at the box of macaroons, and begin to cast Prestidi-digitation - wow, that’s a hard spell name to say - but Prestigigi-digitation does not come out of your Umbra Staff. It feels like, actually, your Umbra Staff is sort of exerting a will of its own? And Prestidigitation doesn’t come out of it, the spell Scorching Ray does."
404,40,Justin, Aw dag.
405,40,Griffin," And you blast this little box full of macaroons into dust with a powerful version of the spell Scorching Ray. And you actually have to hold your elbow to prevent the recoil, this is a powerful ass version of this. And once you do this, Angus goes,"
406,40,Angus," Well, uh, okay, I can understand if you didn’t like them sir, but that’s all you had to say. You didn’t have to burn ‘em all up."
407,40,Taako," No, it- I - that’s not what I cast."
408,40,Griffin," Scorching Ray comes out of your Umbra Staff again, and this time your Umbra Staff, like, pulls your elbow so that it’s pointing in a straight line. And it’s firing the spell Scorching Ray into the wall? And you can just feel the Umbra Staff, like, making you trace a shape. And it carves out the letter “L”, in fire, in the wall. And then it does a “U”. And then it does a “P”. And then the staff shuts down. And you feel it like, just kind of, lose any power that it was exerting over you in that moment. So your staff, you lost control of it and you blasted the letters L U P into the wall."
409,40,Taako, Why? What does that - what is L U P?
410,40,[A Lunar Interlude fades in.],
411,40,Griffin," Angus takes out a notebook and he says,"
412,40,Angus," Sir, I appreciate the magic lessons, but it sounds like you’ve just given me an even better gift. A new mystery to solve!"
413,40,Taako, Aw fuck.
414,40,{45,28-5120 ad break.}
415,40,Griffin," I—we’re back all together again. And I hope all that went okay. We’re recording this part—we’re recording the second half of this episode before the first half of the episode that you just listened to, so. If it was a fail—if it was a colossal failure, should we apologize in this part of the show?"
416,40,Travis," We—no, you know what? I’m gonna say you’re welcome."
417,40,Griffin," It—whatever it was, I’m sure it went really well. So the three of you have sort of regrouped back at the Bureau of Balance and I don’t know why you didn’t do this stuff immediately after the Crystal Kingdom arc, but you’re doing it now. ‘Cause we gotta do some…"
418,40,Justin, [crosstalk] Yeah!
419,40,Travis," Well, ‘cause everyone was on Christmas break, Griffin."
420,40,Griffin, That’s—
421,40,Travis, We had to wait for Leon to get back from his Candlenights break.
422,40,Griffin," [crosstalk] Fuckin’ fantastic, yeah, Leon was out. His family celebrates… elven Candlenights. Which, as we all know, lasts twice as long. And, that’s, the end of the goof."
423,40,Travis, [laughing]
424,40,Griffin, But Leon the ar—
425,40,Justin, I wish more goofs had that. [crosstalk] That’s so nice.
426,40,Griffin," [crosstalk] Yeah, that—"
427,40,Clint," Just—when they’re done, they’re done."
428,40,Griffin," Uh, but Leon the arti—"
429,40,Travis," [crosstalk] Just a Friday night bookend, and then the joke-teller says, “and that’s the end of the joke.”"
430,40,Griffin, And that’s—and now you know the rest of the goof.
431,40,Clint, [old-timey radio announcer voice] The rest! Of the story.
432,40,Griffin," Um, so Leon is back in his—in the gachapon artificer chambers where the three of you find yourselves now with a shiny gachapon token. And as soon as you walk into the room, Leon just goes,"
433,40,Leon," Aw, fuck. Aw, no."
434,40,Magnus," No, we’ve got it this time, Leon."
435,40,Leon, You’ve said that every time that you’ve come in here.
436,40,Magnus," Leon, look me in the eyeballs. I’ve got it."
437,40,Travis, And I hand my token to Taako.
438,40,Clint, [wheezing]
439,40,Leon," You’re gonna give Taako two—two goes at it, then?"
440,40,Magnus," Well, he’s gonna do it for me."
441,40,Leon," You’re—no, that’s not how it works. Double—here’s the, okay—"
442,40,Magnus," [crosstalk] No, I know!"
443,40,Leon," [crosstalk] No, no, no!"
444,40,Magnus, [crosstalk] I give it to you!
445,40,Leon, No you—no you shut up. Here’s the thing.
446,40,Justin, [snickering]
447,40,Griffin," He reaches into his robe and he pulls out three, shining, sparkling, wrapped, delicious-looking pieces of candy. And he says,"
448,40,Leon," You guys get it right on your first try,"
449,40,Magnus, Uh-huh. Ooh?
450,40,Leon, And you’ll be rewarded with the most delicious leftover Candlenights sweets…
451,40,Magnus, [gasps]
452,40,Leon, That your sweet little mouths have ever tasted.
453,40,Magnus," Point of order, do we all three have to get it right to get a candy, or does each person get a candy for getting it right? "
454,40,Leon," No—you know what, let’s raise the stakes. Yes, it’s an all or nothing game, Magnus."
455,40,Magnus," Oh, you got me, Leon."
456,40,Leon," Put the coin in the gachapon machine by yourself. Turn the wheel. Get your prize. Do it good. Ooh, tasty candies in there."
457,40,Magnus, Okay.
458,40,Leon," Hey, let me ask you a question. Let me axe you a question, that’s a fun Magnus joke."
459,40,Magnus, Uh-huh?
460,40,Leon, What’s your favorite candy?
461,40,Magnus, Turkish delight.
462,40,Merle, Marzipan! Marzipan!
463,40,Leon," And you, Taako?"
464,40,Taako," Uh, I like Ferrero Rochers."
465,40,Leon," Oh, wouldn’t you just know it?"
466,40,Griffin," He waves his hands over these sweets, three sweets, and they transform magically into the three things you said."
467,40,Justin, Dunk.
468,40,Travis," Alright, let’s do this. I put my token into the machine myself!"
469,40,Leon," Hell yes, one for three."
470,40,Travis," And I got… a 2. Is that good, should I roll again?"
471,40,Griffin, The number does not… matter.
472,40,Travis," Is it good, Griffin?"
473,40,Griffin," Uh, this is actually very good for you, Magnus."
474,40,Travis, Okay.
475,40,Griffin, You hear a loud ka-chunk come out of this machine as a pretty sizable package falls out of it.
476,40,Travis, Tell me more about my sizable package!
477,40,Clint, [wheezing]
478,40,Griffin," We’re just gonna say, like every—there’s—"
479,40,Clint, [laughing]
480,40,Griffin, Every one of those is just—you’re not gonna let any of ‘em sail by.
481,40,Justin, Ha!
482,40,Clint, Nope.
483,40,Griffin," It is a very—you know what, I just changed my mind. It’s an empty package, you get nothing."
484,40,Travis," No, no, no!"
485,40,Griffin," No, it’s a pretty big package. It is, uh, you pull out a capsule from this machine and as you pop it open, you see what appear to be dark grey feathers."
486,40,Travis, Ooh!
487,40,Griffin," And, they’re not actual feathers, they seem to be made of some sort of, like, studded leather?"
488,40,Travis, Oooh-hoo!
489,40,Griffin," Like, super-light leather. And as you sort of unfurl it, it looks like some sort of, uh, a very light piece of torso armor, chest armor, with this light grey feathered design."
490,40,Travis, Yeah! I am on board!
491,40,Griffin," And you take it back to Leon, who flips through his book and very quickly locates this item, he says,"
492,40,Leon," Okay, that is the Featherweight Cuirass. And it’s… an interesting piece of—of armor that increases the wearer’s flexibility and mobility."
