,episode,speaker,lines
620,44,Travis," Yeah, we did it. I think we solved the weird smoke puzzle. I have a— okay, this is an interesting D&D conundrum. I, Travis McElroy, have a suspicion and something I would test out, but I don’t think Magnus would. So, like, I’m just gonna move forward and not do it."
621,44,Griffin," Yes. ‘Spect the fiction, bro."
622,44,Travis, Yeah. So let’s get in the cart and let’s go.
623,44,Clint, Yeah.
624,44,Justin, Let’s do it!
625,44,Griffin," Merle, you down?"
626,44,Clint," Yeah, do we know how to operate the cart?"
627,44,Griffin," There’s a lever that seems to have three settings, right now it’s in the middle. But there’s one to like go back and one to go forward."
628,44,Clint," Okay, I’ll come catch up to you guys, aren’t you a little bit ahead of me?"
629,44,Griffin," Okay, yeah. Yeah, Merle— "
630,44,Clint," I get in, I pull that lever."
631,44,Griffin," Yeah, sure!"
632,44,Clint, Toot-toot! Ting-ting! Chugga-chugga-chugga— [repeated]
633,44,Griffin, Okay.
634,44,Clint, I stop.
635,44,Travis," I will say that when Magnus gets in he holds his shield kind of over his head, kinda like a— like an umbrella a lil’ bit."
636,44,Griffin, Okay. And you’re just moving on down the cave?
637,44,Clint, I’m gonna call this my magic trolley.
638,44,Griffin, Okay.
639,44,Justin, I wanna open the Umbra Staff and put it above my head too. Let Merle really wonder what’s going on.
640,44,Griffin," Okay, you move away from the entrance, away from that orange light above the elevator door, and this is going to be a fun Dragon’s Lair-style death where in a cartoon, like, just something happens to you and then all of a sudden it’s just skeletons standing there holding the umbrella and the shield and somebody, like, whistling while they move a lever, because all three of you are almost instantly devoured by something as soon as you leave the light."
641,44,Travis, Got it. By the Vashta Nerada.
642,44,Griffin," And you’re back in the white space and same deal, just kind of exhausted and you’re back in front of Roswell."
643,44,Justin," Hole Thrower, done. We get in."
644,44,Travis, We know the code.
645,44,Justin, We know the code.
646,44,Griffin," You do the puzzle, and let’s actually— to further ‘spect that fiction, you pop that code in pretty quickly this time, right? And you go down, you have your little interaction with the dark bugs, and then you go down the elevator."
647,44,Justin," Well, not necessarily, because I don’t know that we want to… I wonder if the meat would be more useful if, like, we didn’t offer it to them. Like, do we need to do that?"
648,44,Griffin, I guess not.
649,44,Travis," But Dad got inspiration out of it, and it seemed to make them happy."
650,44,Griffin, That’s true.
651,44,Clint, I did get karma out of it.
652,44,Griffin," My point was, you did that so much faster that you probably made it down the elevator before this earthquake happened. Right, like, before 1130. And now when you get to the bottom the scene’s the same, the cart is broken, but you don’t hear buzzing, and there aren’t no cracks in the ceiling. You do just hear the— you hear like [fur bug chittering noise] so you can hear some stuff in there but it doesn’t sound like, whatever it is, there’s not billions of them."
653,44,Travis, Is there still smoke covering the tracks?
654,44,Griffin," Yeah, I mean, when you investigate you don’t see smoke, you just see a handful of those little bugs, and they run away from the light as soon as you shine it on them."
655,44,Clint, Griffin?
656,44,Griffin, Yo.
657,44,Clint, Do our spell slots reset every time?
658,44,Griffin, They do. Yeah.
659,44,Clint, Okay. [More strangled-sounding] Okay.
660,44,Griffin," What do you want to do? Let’s say, at this point, the fastest you can get down here is, like, 1115."
661,44,Travis, Okay.
662,44,Griffin," Oh, that’s actually 1120. Yeah, that’ll be good."
663,44,Travis," You guys got, like, spells that do light, right? That make things glow?"
664,44,Justin," That’s actually what I was looking for. I thought I did. I mean, my magic eyes can see in the dark."
665,44,[Griffin laughs],
666,44,Travis," Yeah, but what I’m saying is if light seems to drive these things away, why not make, like, the cart glow?"
667,44,Justin, That’s not a bad…
668,44,Clint, I have a spell called Light.
669,44,Griffin, [Crosstalk] That’s a fucking really efficiently named spell.
670,44,Clint, Yeah. And the object sheds bright light in a 20-foot radius.
671,44,Justin, Cast it on the cart.
672,44,Griffin, Okay.
673,44,Clint, I cast it on the cart. Skadoosh!
674,44,Griffin, And are you repairing it as well?
675,44,Clint," Yeah, it’s not gonna go anywhere until I fix it."
676,44,Griffin," Yeah. Okay, you repair this cart and you make it super-duper shiny. You have repaired the cart and it’s about 1125."
677,44,Travis, Let’s move.
678,44,Justin, Let’s go.
679,44,Griffin, All right.
680,44,Clint, Let’s bust ass.
681,44,Griffin," Yeah, you hop in the cart and begin moving down the track. [Clint makes chugga-chugga noises again] And sure enough, you can see these little bugs scattering as you move down the path. They are giving your cart a wide berth. You are curving around to the left a ways. There’s kind of— after you’ve been going for a few minutes, there’s a hairpin turn. Not exactly a hairpin turn but, like, you are turning almost 180 degrees to the left and then you’re going down and down and down this cart— down this path for a super long time."
682,44,Clint, So we passed the point where we got devoured?
683,44,Griffin," Well, it’s at 1130 just past that hairpin turn, there is that earthquake. And then sure enough cracks in the ceiling start opening up and some shapes— thousands and thousands of those little bugs start crawling out of it. I’m gonna say maybe a few of them land— let’s see, maybe like—"
684,44,Travis," I’ve got my shield over my head, thank you very much."
685,44,Griffin," Okay, so you’re protecting your dome. I guess you did establish that in the last…"
686,44,Clint," And you’re protecting yourself. Okay, go ahead."
687,44,Travis," What do you want me to do, grow my shield bigger?"
688,44,Clint, Protect us!
689,44,Travis, How?
690,44,Griffin, Let’s just say that some bugs are about to fall into your cart. How would you deal with that?
691,44,Travis, I can only speak for myself. I’m holding my shield over my head.
692,44,Griffin, Okay.
693,44,Clint," I say we try to, like, kill ‘em?"
694,44,Griffin, Okay.
695,44,Clint," We haven’t killed anything, like, for five episodes."
696,44,Griffin, That’s a good point.
697,44,Justin, The bugs? Kill the bugs? Are the bugs eating us?
698,44,Clint," Well, obviously my good karma isn’t working."
699,44,Justin," Yeah, that’s a good point. Yeah, I’m having a hard time thinking of any other way to defend us. I’m sure there’s some magic that I could…"
700,44,Travis," Well, you’ve got your umbrella. We could just like keep them off us, you know?"
701,44,Griffin, The bugs are— I don’t know if I described them accurately enough. They’re very cute. [Everyone “aww”s]
702,44,Justin, But they did eat us.
703,44,Griffin," They did, yeah, yeah."
704,44,Justin," Yeah, but they’re cute. Okay, hold on."
705,44,Griffin, You guys have spent five minutes trying to figure out how to kill some bugs.
706,44,Justin, They’re gonna eat us!
707,44,Griffin," I’m just saying, real life—"
708,44,Clint, And you said they’re cute!
709,44,Griffin," Real-life Griffin could’ve done this in like, ten seconds, man."
710,44,Travis," To be fair, Griffin, this is your fault because you put us in the mindset of solving puzzles and traps."
711,44,Griffin, That’s a good point. Fair enough.
712,44,Clint," How do we know they’ll bother us? I thought light chased them away, and aren’t we still surrounded by a nimbus of light in this trolley?"
713,44,Griffin," Yeah, but there’s a few that are, like, in the cart with you, and they don’t know how to get out, and they’re freaking out, and they’re starting to nip at your boots."
714,44,Travis," Oh, I thought they were falling."
715,44,Clint, I hit one with my war hammer.
716,44,Travis, Hold on. I thought they were falling from the ceiling. They’re already in the cart with us?
717,44,Griffin," Yeah, they fell from the ceiling into the cart."
718,44,Travis," Oh. Stomp, stomp, stomp, stomp, stomp."
719,44,Griffin," Okay. Yeah, you can just stomp them. That’s fair. It’s gross— it’s gross and it’s horrible."
720,44,Clint," [Laughs] Kinda anticlimactic, though, isn’t it?"
721,44,Griffin," Maybe a bit, but sometimes the easiest solution’s the best one. The stompiest."
722,44,Clint," Oh, that’s true."
723,44,Griffin," Okay, you go down this path and it’s— again, a long cart ride. This mine— They had dug a lot out, and as you go down the path the bugs are still giving you a pretty wide berth, and you can see some other passageways that don’t have tracks coming out them, sort of branching off to the left and right and then just like, deep, deep holes going down from those. "
724,44,"So this was the main vein of this mine. Not vein like motherlode, but where people would move down. It was a pretty long journey, took you about fifteen minutes to go down. So you don’t have a ton of time, but you’ve made it to the end of this tramway, and you’ve pulled in front of another door with another orange light on top of it that is keeping all these bugs at bay. And this door just has a button on it that says “Open,” and that’s pretty much it.",
725,44,Travis, Yeah?
726,44,Justin," Do you wanna— well, I mean…"
727,44,Travis," All this time, Magnus is slowly just pushing his finger towards it."
728,44,Taako," Merle, do you wanna try searching for traps?"
729,44,Clint, I cast Find Traps again.
730,44,Griffin," Um, okay, the door is not trapped, you can tell that."
731,44,Travis, [Immediately] I push it!
732,44,Griffin," Okay. [Travis Click!] Um, there is something behind the door that is trapped?"
733,44,Travis, Damn it.
734,44,Griffin," But you did not activate it. You press it and you hear the sound of machinery moving far beyond the door. Then you hear silence, like nothing happens for a while. And then after about a minute your door starts to slide open, and it takes it a real long time. It takes it, like, 30 seconds for it to completely open up. And then inside is a very, very, very small room. It’s kind of reminiscent, actually, of the airlocks from the Crystal Kingdom stuff, and you see another door inside with an “Open” button, and then on the backside of the door that you just came through is another “Open” button. So there’s a button on either side of this door you come through, and then there’s another door on the opposite side that has an “Open” button on it."
735,44,Travis," And is— are there windows or anything, any kind of porthole?"
736,44,Griffin," No. There’s no windows, there’s no way to see through it."
737,44,Justin, Let’s go ahead and do it.
738,44,Griffin, Okay. You punch the open button on the other door and the one that you came through begins its slow cycle again of shutting. And once it does—
739,44,Justin, This is a bug thing. This is to keep the bugs out.
740,44,Griffin," The door shuts, you hear a [hiss noise], and then there’s a wall to your right when you came in. A panel on this wall opens up and you see a clock, and this clock is a 60-second timer. And it’s counting down. Underneath the clock, immediately underneath the clock, is another small metal panel that has, like, a slot in it, almost looks like a keycard slot at a hotel. And that’s what you see. The clock is counting down from 60."
741,44,Clint," What’s it at right now? Oh, it just started, 60?"
742,44,Griffin," Yeah. We’re not gonna move it in real time, but. "
743,44,Clint," This is the trap from the elevator, isn’t it?"
744,44,Griffin," No, it’s a different one."
745,44,Clint, Oh okay.
746,44,Travis," There’s like a slot, you say?"
747,44,Griffin, Yeah. Slot like a keycard slot.
748,44,Travis, Is it something I could use my thieves’ tools on and pick and disarm? Are there wires?
749,44,Griffin," If you want t— no, there’s no exposed wires. If you want to use your thieves’ tools to see what you can do, you can do that."
750,44,Justin," Well, bye, everybody. Yeah. It’s been a— it’s been a good life."
751,44,[Laughter],
752,44,Travis, I do that.
753,44,Griffin, Okay.
754,44,Justin, Whee!
755,44,Travis," [Dice roll] I mean, that’s a 12 +10, so 22."
756,44,Justin, I put my hands up in the air like Superman because we’re getting ready to go to heaven. [Clint and Griffin laugh]
757,44,Travis," I mean, I rolled a 22."
758,44,Griffin," Okay, with a 22 you realize that there are some very, very, very small screws on the corners of this keycard panel. You screw them off and you have exposed, after removing this panel, you can still see this keycard slot right in the center of things but the center is surrounded by five wires. There’s a red, a yellow, [faint die roll] a blue, a green, and a black wire."
759,44,Travis, I cut the green wire.
760,44,Clint, Wait a minute!
761,44,Justin, Whee!
762,44,Travis," What do you know? Hold on, real quick, Dad, if you want to [laughing] share with me how you know—"
763,44,Justin," Red, yellow, blue, green, what’s the other— red, yellow, blue, green, [at the same time as Griffin] black."
764,44,Griffin," Black. I’m gonna just take— canonically, Magnus did say it, so you do have a trip to heaven— [Someone makes a noise of disapproval]"
765,44,Justin, Whee!
766,44,Griffin," And we can just hop right back into the room. 60 seconds on the clock, what do you do?"
767,44,Travis, I’ve eliminated one option.
768,44,Justin, I’m not gonna do it like this. Let’s think about what we know for 60 seconds.
769,44,[Short pause],
770,44,Clint," Hmm. Red, yellow, blue, green…"
771,44,Travis, Black.
772,44,Clint," Well, they always say cut the red wire. Isn’t that what it was in Speed? Wasn’t Speed the red wire?"
773,44,Justin, The…
774,44,Clint, What is it in the M&Ms movie trailer?
775,44,Travis, I cut the black wire.
776,44,Griffin," [Singing] To heaven we’re going on a trip together, me and my f—"
777,44,Clint, Wait a minute — you just cut the same wire!
778,44,Travis, No.
779,44,Justin, You cut the same fucking wire!
780,44,Travis," No, I cut the green!"
781,44,Griffin, He did green last time. But both have killed you.
782,44,Justin, Okay.
783,44,Clint, So are we back there with this timer at 60? There’s gotta be a better way to figure this out.
784,44,Griffin," So it can be. So there’s a couple ways to solve this one, that’s all I’ll tell you."
785,44,Justin, Okay.
786,44,Griffin," But if you don’t want to be in this room and you want to be in an earlier place, you let me know."
787,44,Clint," Ah, ah!"
788,44,Justin, What?
789,44,Clint, The timecards.
790,44,Justin," You really are into those, huh?"
791,44,Clint," Well, he said there’s a slot, a small metal slot. He didn’t say what you’d insert was metal."
792,44,Justin," Ohhh, okay. So get… I don’t know, get Cassidy’s?"
793,44,Travis," Well, if we’re already there, hold on. I’ll get us out of here. I use Railsplitter to cut all five wires at once. [Clint laughs]"
794,44,Griffin," [Giggling] You’re in heaven. Okay, no, you’re back in that entry room. I forget the exact names that I laid out for you that there are cards for. Cassidy’s was among them, the four people that died in the accident are among them. Niall [pronounced “n’yall”], I think, is one of them. Terrence is one of them. Isaak is one of them. Quincy is one of them."
795,44,Justin," Hey, you know what? We should get Isaak’s. He’s the sheriff now, and it seems like maybe he would be a high-ranking person that would have access, right? Does that make sense?"
796,44,Clint, Does indeed.
797,44,Justin," Okay, let’s grab all of them."
798,44,Clint, There we go. And we’ll think about them on our long trip down.
799,44,Griffin, Okay.
800,44,Travis, If this is the case this time I want to use my shield to keep bugs from getting in our cart so I don’t have to squish any adorable bugs.
801,44,Griffin," Okay, you don’t— you don’t kill any bugs this loop, and you make it to the end and you make it in the room. 60 seconds on the clock."
802,44,Clint, And how much time all together? What time is it right now?
803,44,Griffin," I mean, the fastest you could probably get here is, uh, the fastest you could get here is 1150."
804,44,Travis," So someone’s been building traps and the only one who survived the cave-in— if the only one to survive the cave-in was Cassidy, maybe Cassidy put in the traps and we should use her card."
805,44,Justin, Does that stand to reason?
806,44,Clint," Well, but Isaak survived."
807,44,Travis," Well, that’s assuming that it’s the same Isaak. There could be more than one Isaak in the world."
808,44,Griffin, Chris Isaak.
809,44,Clint, Griffin wouldn’t do that.
810,44,Justin," Let’s, uh… why don’t you… "
811,44,Clint, I like—
812,44,Justin," You agree with Travis or me? Isaak or Cassidy, Dad? I’ll let Dad pick."
813,44,Clint," [Sighs, then scream-groans] Isaak."
814,44,Griffin," Okay. You put Isaak’s punch card in… and the clock stops. And you hear that [hissing noise] sound again, and the door in front of you slowly starts to open."
815,44,Justin, Nice.
816,44,Clint," You’re not mad at me, are you, Trav, that I picked Isaak over Cassidy?"
817,44,Travis," Nope! Dad, I don’t give two shits."
818,44,Griffin," Well, you were right. The panel snaps shut as the door on the far end starts to open up, and after completing its long cycle of opening, you reach the largest room you’ve encountered in this mine so far. It’s a big, circular room, about 300 feet in diameter. The first thing that catches your eye is the hole in the floor. There is a guardrail around this hole. But beyond that rail is this gargantuan chasm that runs nearly the whole span of the room."
819,44,"There’s only about ten feet of walkway lined with cart tracks going around the room, and the rest of the room’s just all hole, baby. There is a thick metal ring running along the exterior of the hole, and you can see some, like, thick— really, really, really thick ridged metal poking out of either end of that ring, so it kind of looks like a really sturdy metal hatch that is currently open. There’s a sign hanging on the railing directly in front of you, and it’s labeled “Shaft A”. Next to that sign is some sort of control—",
820,44,Travis, Are you sure it’s not “shafta”?
821,44,Griffin," It could be shafta. No, it’s Shaft A, and next to that sign is a control box with a long lever coming out of it. There’s another really important thing that you noticed about this hole, and that is that there is some kind of force field in it. And it’s just below that heavy metal hatch and it looks kind of similar to the bubble that is surrounding Refuge. It’s more translucent, you can see through it. It’s not refracting light. But there’s this force field inside of the hole, it’s kind of wavy. "
822,44,"And it pitches outward a bit, giving it a similar shape to the bubble around town, but you notice that there are actually a total of three of these bubbles in this room. There’s this one inside the pit. There’s a much, much smaller bubble on the ceiling that a faint light is actually shining down from through a hole that is maybe only just like three feet wide, it’s a much, much, much smaller hole immediately on the ceiling. The ceiling is way high up, probably about 20 feet, 20, 30 feet up. And there’s a small hole with another bubble around it, and there’s light coming down through this hole. ",
823,44,"There’s a bubble around that hole that’s just a bit wider than the diameter of the hole. And then there’s a third bubble, and it’s surrounding the only other door in this room on the opposite end of the pit that you’re currently standing over. That door looks identical to the one that you just came through except that it has this big bubble force field around it. And actually, from far above you, you can faintly hear the sounds of commotion and of distant screams.",
824,44,Clint, Bye-bye. See you!
825,44,Griffin," Nope. It’s only about 1155 right now. Well, it’s late, but the world hasn’t exploded. You just hear some commotion and actually, because you’ve done this so many times now, it sounds like the commotion of people rushing to try to put out the bank."
826,44,Travis, Does it sound like we’re directly below it?
827,44,Griffin," Not directly below it, but you can hear it, and you’re below it."
828,44,Justin," Listen, I know that there’s an— I know our impulse is usually to act, but I think we would be best served to just chill and see what happens."
829,44,Travis," Yeah, let’s watch."
830,44,Griffin, Okay.
831,44,Clint, Can we see through the force field bubble?
832,44,Griffin," You can, yeah."
833,44,Clint, That heads down.
834,44,Griffin, Yes.
835,44,Travis," I suspect that this is a case of, like, they dug too deep and hit something they weren’t supposed to, and that kind of thing."
836,44,Clint, Or somebody.
837,44,Justin, Let’s find out. [Someone (probably Clint) whistles]
838,44,Griffin," Okay, you wait around a couple minutes."
839,44,Clint, You guys want any of this ice?
840,44,Griffin, You’re just chewing on ice?
841,44,Travis, That ice is too good to waste.
842,44,Clint, I gave the meat to those bugs.
843,44,Griffin," Through that hole in the floor, I forget who asked if you could see through it and see down it."
844,44,Clint," Yes, it was me."
845,44,Griffin," Okay. Through that hole in the floor, you can see, shining through the darkness, teeth. You can see thousands of them arranged in countless rows that are pouring down a mouth that is easily 200 feet wide. [Travis Huh.] And emerging from that mouth are two big rectangular flaps that are also lined with teeth that are curling and dripping with malice. And that mouth is lit ever so slightly from within with dozens of small flames that look kind of like pilot lights for a furnace that looks like it’s about to explode."
846,44,"And with the help of the light shining directly downward, you can see what owns that mouth. It is a gigantic body that has a thick skin, thick ridged purple skin. And this is a body that is halted mid-attack that is moving now, almost imperceptibly but it is moving a bit, and the fires inside of its mouth are starting to grow and become alive. It is pushing with enough force to give this force field apparently, like, a work-out, because waves are starting to ripple across the surface of it almost in a panic. And from above you, you hear the chime of a clock.",
847,44,Travis, I throw the cluster bomb down.
848,44,Griffin," Okay, you throw the cluster bomb, I like that play. [Dice roll] All three of you, because you got a good chuck in, you’re not right next to the blast, but all of you take, like, 24 damage and are knocked backwards. It doesn’t seem to have any effect on this thing."
849,44,Clint," Wait, did it go through the force field?"
850,44,Griffin," It didn’t, no, it just kind of bounced off the top of it. Actually, some— this thing was just about to breach it, so like it maybe hit it, but even if it did it didn’t seem to stop it at all because this thing is 200 feet wide and is essentially a weapon of mass destruction. And now that you work your way back towards the hole after being blown away back from it, and the movement that this thing has is now, like, no longer imperceptible. You can see it moving. It’s coming up through the hole. It’s moving upward a few inches and then a few feet, and the flames in its mouth are expanding and intensifying."
851,44,Clint," Can we hold hands, guys? Can we all hold hands?"
852,44,Justin," Yeah, that’s fine."
853,44,Griffin," All of you hold hands as both the flame and the purple worm burst through the bubble, the force field ultimately giving up the ghost. The room is flooded with fire, and you are [laughing] destroyed by a blast of nearly supersonic force and the last thing you hear is a scream of unbridled fury. And you do not live long enough to hear the twelfth chime of the clock above you."
854,44,Clint, Well.
855,44,Travis," Okay, so just— I just want to throw this out because— Griffin’s probably already cut this, but just for Dad and Justin. Remember we fought some purple worms at the very beginning of the thing?"
856,44,Clint, Yeah.
857,44,Travis," Before we entered the thing? This is probably connected, right?"
858,44,Griffin, This one is much much much much much much much much much larger than those.
859,44,[End music fades in],
860,44,Justin," Yeah, but we beat them, so I like our odds."
861,44,Travis, Got it.
862,44,Clint," Actually, we just chased them off."
863,44,Justin," We chased them off. That’s right, Dad, thank you for the reminder. Okay, I feel less good about the odds. [Griffin laughing]"
864,44,"[Theme music plays, episode ends]",
865,44,[Next episode],
