,episode,speaker,lines
296,44,Travis, You clever bastard. All of these names— there’s 26 of them. They all start with a letter of the alphabet.
297,44,Clint, Right.
298,44,Travis," So there’s something about the puzzle. I don’t know if it’s that we need to trip the vowels in order or we need to spell out a word, but if 16 of them are trapped that means there’s ten that need opened in a certain order."
299,44,Clint," Well, what are the four names on the cards that were the most recent ones?"
300,44,Griffin," Let’s say Vanessa, let’s say Williams, let’s say Jerry, and Quincy. I’m picking those completely at random now."
301,44,Clint, And also Cassidy?
302,44,Griffin," And Cassidy, yeah."
303,44,Clint, Those are the highest-scoring tiles in Scrabble.
304,44,Justin, Can we spell “kwyjibo”?
305,44,Griffin," I literally just picked those names at random, that has nothing to do with the solution."
306,44,Clint, Or you’re telling us you just picked those names.
307,44,Griffin," No, I promise. I’m also just sort of putting that fact into the universe so that if I forget who the specific people were that died in the future it’s because I don’t— it doesn’t matter."
308,44,Clint," I like Travis’s theory, I think we have to enter the cards in a certain order."
309,44,Travis," No, I think it’s that we need to open the lockers in a certain order."
310,44,Justin, Open the lockers?
311,44,Griffin, Yeah.
312,44,Clint," I was thinking in the timeclock, but we’ll go lockers."
313,44,Travis," Does it— okay, in Dad’s spell, does there seem to be any connection to the trap, to the timecards?"
314,44,Griffin," No, the timecards are not trapped at all. There’s nothing there."
315,44,Travis, Okay.
316,44,Clint, [Low growl]
317,44,Justin, [Sighs] You know what we need are diamonds.
318,44,Travis, What?
319,44,Justin," If we had some diamonds then we might be able to buy some information from the witch in the forest because it seems like, barring other clues, that would be a fine— I mean, we can’t have repeating letters, I guess? That wouldn’t really make much sense."
320,44,Travis, What— what timecard begins with the letter S?
321,44,Griffin," Yeah, there is one that starts with the letter S in the machine, and it’s Susanna."
322,44,Travis, Okay. That’s the name that’s scratched out.
323,44,Clint, Oh! Susanna. [Justin laughs]
324,44,Travis, That is the name that’s scratched out. That’s the S name that we’re missing. Is there anything written on that card other than her name?
325,44,Griffin," Nope, it’s just one of the miners that quit working here a few months ago."
326,44,Justin, And everybody hated her.
327,44,Griffin," That’s why they scratched her name out, yeah. The only hint I’ll give you is think about what you want to do in this situation."
328,44,Travis, Open door. No. Enter. [Crosstalk] You know what? What if we just blow up the whole room?
329,44,Justin, I don’t think—
330,44,Clint," Well, we tried that once."
331,44,Justin," Yeah, and it killed us."
332,44,Travis," No no no, we go back through, we close your hole, we set it off."
333,44,Justin, Uh…
334,44,Travis," We reopen said hole. No? Okay, that’s fine."
335,44,Justin, Gotta be a way to cheat with magic. [Clint laughs] If there’s something that makes better podcast audio than us trying to solve the puzzle—
336,44,Griffin," I would recommend that you guys just try shit. [Crosstalk] And if you die, then you die. You’ll just start right back here."
337,44,Justin," Yeah, but it seemed to kind of, like, bum that lady out pretty bad that we died again."
338,44,Clint, So fast.
339,44,Justin," Yeah, so fast."
340,44,Clint," By the way, what time is it?"
341,44,Griffin, Right now it’s probably about 1115.
342,44,Travis," Okay, I’m gonna put on the Lens of Straight Creeping and see if I can see any patterns of steps from locker to locker."
343,44,Griffin," Oh, interesting. Okay, yeah, here— how about this? The steps are, like, all over this room, like this was a highly trafficked room, but there is one pair that is slightly fresher than the rest."
344,44,Travis, Uh-huh.
345,44,Griffin," And even this pair kinda, like, walks back and forth around these lockers so much so that you can’t tell the exact path that they walked, but you can see that they started at the name Dana. That is where the footprints, this was the first name that these fresh prints of Bel-Airs walked to."
346,44,Travis, Dana. Dana. And I can’t see where it ended?
347,44,Griffin," Yeah, how about that? You can also see that it ends at Niall and then it walks to the door."
348,44,Justin," Okay, you know what? I’m gonna go open D."
349,44,Griffin," Yeah, you pull the lever for Dana and you open it up and it’s empty, and you hear a click."
350,44,Justin, That’s great. That’s a great start. Very good.
351,44,Griffin, One down.
352,44,Justin, One down.
353,44,Travis," I mean, demolition has ten letters, but it has I and O in it twice."
354,44,Justin, Are there any other Jake Gyllenhaal movies?
355,44,Travis," Detonation, no."
356,44,Justin, So it’s D — [eight repeated noises] — N.
357,44,Clint, We’re good so far.
358,44,Travis, You know what? I’m gonna open E next.
359,44,Griffin, Boom! The room explodes.
360,44,Travis, Okay.
361,44,Griffin, And you wake up in the white space. And the woman—
362,44,Clint, What does she look like?
363,44,Griffin," I mean, the same as the last time you were here. It has not been that long since your last visit."
364,44,Magnus," We’re working on it, sorry."
365,44,Griffin, Okay. And you’re back in the room. [Crosstalk]
366,44,Clint, What if you’re trying to— don’t blow up. [Griffin laughs]
367,44,Justin, So the last letter is N.
368,44,Clint," Don’t blow up, that’s ten letters!"
369,44,Justin," That’s D-O-N, so you use the N in the third place. You can’t— the set. Do blow up would work, I guess."
370,44,Travis, Disarm… disarm…
371,44,Justin, Disarm…
372,44,Clint, Entrance.
373,44,Justin," Okay, it has to end with an N. You’ve gotta hang with me here, Clint."
374,44,Travis," And it’s only got ten letters, Clinton."
375,44,Griffin, Yep.
376,44,Justin," Hey, look, this is what we’re working with. And some— there’s…"
377,44,Clint, Destruction…
378,44,Travis, I open I.
379,44,Griffin, Okay.
380,44,Clint," I’m really good at this in Fallout 4, really."
381,44,Griffin," I’m assuming you popped open D first. Please, God."
382,44,Travis, Yes.
383,44,Griffin," Yeah, you pop open D, it is empty, you hear a click. You pop open I, it’s empty, you hear a click."
384,44,Justin," Whoa, okay. D-I… diamond?"
385,44,Griffin," By the way, you didn’t pop open— these lockers don’t just have letters on them. You popped open Isaak’s locker."
386,44,Travis, I don’t care about Isaak.
387,44,Justin, Should we go S? Dis…
388,44,Travis, Disarm… distract.
389,44,Justin," Dad, why don’t you try S and I’m gonna stand back a little bit."
390,44,Travis," Yeah, I lean away."
391,44,Griffin, So this is the unreadable scratched-off label that you figured out was Susanna.
392,44,Clint, Susanna.
393,44,Griffin, Yeah. You pop that one open and there’s a click and it’s empty.
394,44,Travis, Whoo!
395,44,Justin, Do you wanna go A?
396,44,Travis," You know what, let’s keep these bones a-rolling, let’s go for it."
397,44,Clint, Yeah!
398,44,Justin, A — I’ll pull A.
399,44,Griffin," Okay, you pull open Abernathy’s locker, and it clicks and it’s empty."
400,44,Justin, Okay.
401,44,Clint, [Cut off noise]
402,44,Justin," Go ahead, Dad."
403,44,Clint," R, I’ll pull R."
404,44,Griffin," Oh, I love that. You guys are adorable right now. Yeah, you open it up and it clicks and it’s empty."
405,44,Travis, Okay. M?
406,44,Justin, N. Q. [Griffin laughs]
407,44,Travis," No, no, we pull Morrison."
408,44,Griffin," Okay, Morrison clicks and it’s empty."
409,44,Travis," Okay, that’s as far as I’ve got."
410,44,Griffin," And when that happens, you hear the vault door— you hear something click behind it, but it does not open up."
411,44,Travis, OSHA.
412,44,Justin, No.
413,44,Clint, I got it. “Open.”
414,44,Justin, Say it—
415,44,Travis," It’s two words. We think it’s a phrase. I think it’s “disarm” and “open,” are the two—"
416,44,Clint, That’s what I just said.
417,44,Justin," Dad said “open” before you did. Dad, you have to speak up. I’m doing my best here to try to highlight your brilliance."
418,44,Griffin," All right, do the thing."
419,44,Clint, O!
420,44,Griffin," Click, opens."
421,44,Clint, P!
422,44,Griffin," Click, it opens, it’s empty."
423,44,Clint, E!
424,44,Griffin," Click, it opens."
425,44,Travis, We win the trip to the Bahamas!
426,44,Clint, N!
427,44,Griffin," It opens and is empty, and when it opens the vault door starts to swing open and 16 of the lockers all swing open to reveal cluster bombs wired to the insides of them."
428,44,Travis, We don’t touch them.
429,44,Clint, Don’t touch the bombs.
430,44,Justin, We don’t touch the bombs this time.
431,44,Griffin," But they very slowly swing open alongside the vault door, revealing an entry into the next room. And I just wanna say I’m very, very proud of all three of you."
432,44,Justin," Yeah, we did a good job. [Indecipherable]"
433,44,Clint," Yeah, but we got listeners right now that knew it 20 minutes ago."
434,44,Justin," Yeah, that’s fine, guys. Keep it to yourselves. [Clint laughs] So the door opens, can we just stroll on through?"
435,44,Griffin," Yeah, sure."
436,44,Justin, Okay.
437,44,Clint, [Gibberish]
438,44,Griffin," It explodes and you die. No, I’m just kidding."
439,44,Clint, Can we look first?
440,44,Justin," [Hemming and hawing] Okay, you can look."
441,44,Travis," That’s a good question, are the cluster bombs the only things in the lockers?"
442,44,Griffin," Yep, that’s it."
443,44,Travis, Okay.
444,44,Justin," Hey, guys, bad lockers."
445,44,Travis," Don’t you feel bad for the people who aren’t D-I-S-A — who are like, “Don’t keep anything in your lockers you like”?"
446,44,Justin," “Hey, boss, listen, I want to bring my lunch to the office mine. I’d really like to be able to—” [Boss voice] ““I told you once, I told you a thousand times. Only one thing goes in your locker and that’s cluster bombs.” "
447,44,Travis, Is there anything in the icebox?
448,44,Griffin," Two things of note. First of all, this trap seems like it was rigged together…"
449,44,Justin," Don’t say hastily, because that would be madness! [Crosstalk]"
450,44,Griffin," Not hastily, this obviously took a while, but this is not standard mine procedure. This was a trap that was laid here…"
451,44,Justin," Right, I’m with you."
452,44,Griffin," …for people coming in here. Travis, to answer your question, yeah, there’s some meat in the icebox. The icebox is perplexingly still kind of cold, it’s not a refrigerator, there’s actual ice in it keeping things cool and that ice is still going strong. It’s kind of chilly in here, so maybe that has something to do with it, but there’s meat. Just raw steaks in the icebox."
453,44,Magnus," Hey, Taako? Is this magic, this icebox? Is it magic in any way?"
454,44,Justin, Let me run an arcana check.
455,44,Griffin, Okay.
456,44,Justin, Arcana [pronounced “ar-CAN-uh”]… sorry. Arcana [pronounced “ar-CANE-uh”]. I’ve been listening to too much—
457,44,Clint, Arkham Asylum.
458,44,Justin, Too much Patrick Rothfuss. Okay. [Dice roll] Fifteen plus… 
459,44,Griffin, That’s enough. I’ll say that the ice—
460,44,Justin, Nineteen!
461,44,Griffin, The ice in this box—
462,44,Justin," Eighteen, 18, 18."
463,44,Griffin," The ice in this box, and I hadn’t planned on talking about the specific type of ice that was in this box, but let’s just say it is kind of a magic ice that stays colder for longer, and I’m gonna call it Good Ice. [Clint laughs]"
464,44,Justin," Hold on, I’m being swept away by this fantasy tapestry you’re weaving!"
465,44,Griffin," This is Good Ice, and it’s kept this Old Meat — which is how it would show up in your inventory — fresh for longer than you thought it would last."
466,44,Travis, Why would a mine keep raw meat?
467,44,Justin," Well, this is by all means the highest priority mystery we have to solve. [Griffin laughing] Let’s ruminate on this meat question."
468,44,Travis," Okay— I just wanna say that we’re gonna walk into a room with like a huge slathering beast in it and be like, “Oh! It was for— oh!”"
469,44,Justin," Take it or don’t, but we don’t have to run an Unsolved Mysteries episode about what kind of meat and why we have meat."
470,44,Clint, I take the meat and the ice.
471,44,Justin, Thank god.
472,44,Travis, It explodes!
473,44,[Everyone laughs],
474,44,Griffin," Yeah, it was on a weight— uh, a weighted trap. And a voice comes out of the box, “Not my meat and ice!” Boom!"
475,44,Justin, I make a bag of sand that looks like it weighs as much as the meat and the ice. And then I swap them out.
476,44,Griffin, Okay—
477,44,Clint, We’re gonna have to go running down this tunnel while a big-ass rock chases us!        
478,44,Griffin," The door that you opened up opens up into an elevator, which, of course it does."
479,44,Justin," Oh, fuck me."
480,44,Griffin," And it’s not Upsy Your Lifting Friend, it’s just, like, uh, it’s sort of an industrial elevator. It has sort of exposed walls. There’s no ceiling on it whatsoever, it’s like a freight elevator."
481,44,Justin," There’s gotta be a company logo on it though, right? They have to have made it."
482,44,Griffin," Yeah, I mean it is, I guess it’s part of the… Miller family of products. And yeah, there’s a minecart on the side of it with some boxes and then a panel that has an up-and-down button on it. As you open the elevator lattice you see two small shapes run out from under the minecart full of boxes, and they look like little furry bugs. And they have big, adorable ears and a couple little black furry wings with white spots— or no white spots, just all black fur. They scurry out from under the minecart and kind of run up to your party, kinda, to inspect."
483,44,Magnus," Well, hey there!"
484,44,Merle," Hi, little fur bugs!"
485,44,Griffin, They make a little—
486,44,Fur Bugs, [High-pitched “tzz-buzz”-like noise]
487,44,Griffin, —noise as they come up close to you.
488,44,Magnus, Oh yeah? Is there trouble down in the mines?
489,44,Fur Bugs, [Repeated noise]
490,44,[Clint fucking dies from laughter],
491,44,Magnus, There is?
492,44,Fur Bugs, [Repeated noise]
493,44,Travis," Now, Griffin, with my animal proficiency—"
494,44,Clint," Oh, god."
495,44,Travis, Can I understand what they’re saying?
496,44,Griffin," Um, no."
497,44,Justin, They can appreciate his folksy charm.
498,44,Griffin," No, but they offer you a—"
499,44,Clint, He carves something for them.
500,44,Griffin, They offer you a free night at the Furry Bug Inn.
501,44,Travis, I take it!
502,44,Griffin," No, you can’t understand what they’re saying, this is—"
503,44,Travis," If I’ve learned one thing in Los Angeles, it’s that when you’re offered something free, you take it."
504,44,Griffin," You take it, yeah. No, they’re just kind of… "
505,44,Fur Bugs, [Repeated noise]
506,44,Griffin, …at you.
507,44,Magnus, Do you guys wanna come with us? Is there anything we need to know? Can you show us anything important?
508,44,Griffin," Okay, you’re talking to bugs. You are talking to bugs. And they just—"
509,44,Justin, He’s talking to bugs.
510,44,Griffin, They just—
511,44,Fur Bugs, [Repeated noise]
512,44,Travis," Can I just, real quick, point of order because it just struck me, did we take Taako’s hole with us?"
513,44,Griffin," No, that’s not how any of this works. [Laughs]"
514,44,Travis," Okay, I wasn’t sure if it was a, y’know, Roger Rabbit, like, you peel the hole back off the wall."
515,44,Griffin, No. That’d be incredible though.
516,44,Magnus," Okay, well you boys scurry along, and we’re gonna adventure on. Have a great day!"
517,44,Merle, Good seeing you.
518,44,Magnus, Thanks for everything.
519,44,Griffin," Merle— Merle, one scurries up onto your boot."
520,44,Justin and Clint, Aww!
521,44,Griffin," And starts climbing up your boot a little bit towards your jortpurs [jodhpur-shorts, which Merle got from Fantasy Costco in Episode 41]."
522,44,Travis, What’s in your jortpurs?
523,44,Clint," Which has meat in it, which has the raw meat in it."
524,44,Griffin," Yeah, the other one follows suit, starts scurrying up the same leg."
525,44,Clint, I hold out the raw meat and let them have a little nibble.
526,44,Griffin," Okay, they almost completely devour it faster than you could ever imagine. They, like, jump up onto it and it kind of disappears, and they run off outside through the hole that Taako made. Just—"
527,44,Fur Bugs, [Repeated noise]
528,44,Griffin," —the whole time. But they seem very contented and very happy, and I would— if there was a thing like karma points in this game, you would get those. That may be the first selfless—"
529,44,Clint," Well, give them to me."
530,44,Griffin," Okay, you get karma points. I don’t know what they’re gonna be used for, but…"
531,44,Travis," No, there’s inspiration, inspiration."
532,44,Griffin," Okay, yeah, I’ll give you inspiration. Just for being kind to animals which is very Pan. Very Pan."
533,44,Travis, I talked to them! Ugh!
534,44,[“Into the Quarry” starts playing in the background],
535,44,Clint," They didn’t understand you, though."
536,44,Travis, Let’s go down.
537,44,Griffin," Okay. I had a puzzle here, but I think it’d probably take too long to get past it."
538,44,Travis, Cool.
539,44,Griffin, So you did it.
540,44,Travis," Thanks, thanks."
541,44,Justin, What was it? [Travis laughs]
542,44,Clint, Tell us so you can’t ever use it again.
543,44,Griffin," You had to hit the elevator button in a certain way or else it explodes. Stop me if you’ve heard this one before. [Clint laughs, others join in]"
544,44,[Interlude music continues],
545,44,{38,10 - 4439 commercial break}
546,44,[Interlude music returns],
547,44,Griffin," You make your way down, and actually, horrifyingly, on your way down, this is when the earthquake happens. Because this is the loop in which you solved the puzzle and it took you a very long time— well, not a very long time, but— yeah, so you hit that 1130 point. There’s an earthquake. And so, while you’re going down — and this descent takes quite a while, this descent takes probably about five minutes of going down — just everything starts shaking and this freight elevator kinda like bangs off the walls a little bit. At one point it actually drops a few feet but it doesn’t fall all the way, like there’s probably some sort of emergency brake on it that catches it, and after a few seconds of not moving it continues its descent after the earthquake stops."
548,44,Justin, Another fine Miller product.
549,44,Griffin," You open up and as the door opens you get a blast of cold air on your face — the exterior door, not the lattice door to the elevator. And you are in a humongous cavern. The only light being provided is— well, I guess Magnus has his headlamp on. There’s an orange light above the elevator door that’s also kind of illuminating things a little bit. You can see in front of you is another cart, like a tram that is on a track that is going down into the cavern."
550,44,"And this cavern is going pretty steadily, constantly down, and the cart actually has a broken wheel, so it’s not exactly on the track. But this is not a minecart for moving minerals, this is a personnel cart for getting people, like, deeper into the mine much faster, but it is currently broken. You can see, actually, some cracks in the ceiling that some dust is falling from, like these cracks were just hewn into the stone with the earthquake. And there is sort of a faint constant buzzing noise happening in this room, which, despite the fact that you have these two lights in it, is still very, very dark.",
551,44,Travis," How broken is it? Is it like a wooden wheel, something I could fix?"
552,44,Griffin," No, it is a metal wheel that is broken. That’s not to say you can’t fix it, but it’s like, the metal is broken."
553,44,Travis, Is the buzzing-like sound like insects?
554,44,Griffin, Maybe a nature check would reveal that to those who want to roll a nature check.
555,44,Travis, I’m going to do a nature check.
556,44,Griffin, You know who’d probably be very good at a nature check?
557,44,Travis," Not me, I got an eight."
558,44,Griffin, You can’t— you really can’t tell.
559,44,Clint, [Dice roll] Seven.
560,44,Travis, But you have pluses.
561,44,Justin, You’ve gotta have a plus! Dad is always looking at his cards.
562,44,Clint, I do have a plus. Planning ahead.
563,44,Justin, For what? You have no fucking clue what’s happening.
564,44,Clint, I have a great idea!
565,44,Griffin, Okay.
566,44,Clint," Nature check. Okay, so it’s 11."
567,44,Griffin," Okay, yeah, with an 11 you can tell that just by the fluctuations in the noise that whatever’s making it is alive."
568,44,Clint, I have a spell called Mending.
569,44,Griffin, Oh!
570,44,Clint," That allows you to fix things. Metal, stone, and I know you’re looking it up right now."
571,44,Griffin," No, I trust you. Here’s a fun fact, that spell is actually baked into the Arclight Spanner, your weapon that you got from Hurley during the battlewagon races. [This wrench was called the Adamant Spanner when Merle received it.]"
572,44,Merle," Why don’t you two go investigate, and I’ll fix the wheel on the cart?"
573,44,Justin," [Singing] Daddy, fix the wheel. [Speaking] Alright. That sounds pretty good, I think we’re in okay shape right now, and if we die, no big whoop."
574,44,Griffin," Okay, Merle, you get to—"
575,44,Justin, And what would happen if one of us died?
576,44,Griffin," Um, I don’t know."
577,44,Justin, I guess everybody would just…
578,44,Clint," [Loudly, yelling] That’s the key to the mystery!"
579,44,Justin," [Whispering] Dad, please."
580,44,Clint, [Stage-whispering] That’s the key to the mystery.
581,44,Justin," Already our microphones are broken, exploded into a million pieces like a fucking gizmo."
582,44,Clint, I mend it with my spanner!
583,44,Justin," Blather, blather, Dad. You exploded my mic."
584,44,Magnus," We’re gonna move forward, Merle. Keep your Stone of Far Speech on."
585,44,Griffin," Yeah, Merle’s working on the wheel, it’s gonna take him a couple minutes, but the pieces of the wheel shattered into four pieces start to float through the air and start to fuse together. It’s almost like some sort of invisible force is welding it as sparks come flying out of your wrench. Magnus and Taako, what are you guys doing? You’ve got about— the light from the elevator gives you about a 20-foot radius circle into this cavern and you’ve got the tracks going right in front of you and Merle’s behind you working on the cart."
586,44,Clint, What time is it?
587,44,Griffin," I mean, by now it’s probably about 1135."
588,44,Clint, Alright.
589,44,Travis," Okay. I’m going to go to look down the path, I guess? Look down the tracks, see if there’s been any damage, any cave-in, anything like that."
590,44,Griffin, Investigation?
591,44,Travis," Yeah, sure."
592,44,Justin," Sounds good, I’ll run one too. [Dice roll] Oh, I didn’t find shit."
593,44,Travis, I’ve got a 13… nothing. So 13.
594,44,Griffin," Okay. No, it seems like the tracks are pretty clear. Taako, what’d you roll?"
595,44,Justin," Uh, a three. I’ll be lucky to find my own asshole. [Clint laughs]"
596,44,Griffin," Yeah, you move around your cheeks for a bit and you’re like, “No— no, no, no!”"
597,44,Justin, “Not again!”
598,44,Griffin," You done transmuted it shut again, damn it. Merle— Magnus, with that check, actually, and because you have the headlamp, you can actually tell there’s no big rocks or anything blocking the path, but as you move your light around this tunnel and specifically around the floor checking to make sure that the tracks are okay, it almost looks like there’s, like, smoke on the ground and all around. And as you shine your headlamp into the smoke it kind of parts for you a little bit, revealing the track underneath."
599,44,Travis, Cool.
600,44,Magnus," Hey, Taako?"
601,44,Taako, Yes?
602,44,Magnus, [Not in character voice] Do you see this— I know you’re looking for your butthole.
603,44,Taako," I don’t understand your voice, why you sound like a person like Travis McElroy."
604,44,Magnus, [In character voice] Sorry. I know you’re looking— I know you’re looking for your butthole. What is this— uh— This smoke seems unnatural.
605,44,Taako, Yeah. For sure.
606,44,Magnus, Uh— touch it.
607,44,Taako, Uh… okay.
608,44,Justin," I’ll cast Detect Magic, see what we’ve got going on here."
609,44,Griffin, Okay.
610,44,Justin, [Fart noise]
611,44,Travis, And he does!
612,44,Griffin, There doesn’t seem to be any magic.
613,44,Justin," Dad just— Dad just handed me Detect Magic while I was searching for it, as if to reinforce that his card-sorting system is better than mine, which it most certainly is."
614,44,Clint," Yes, it is."
615,44,Griffin," I mean, I’ll simplify, there’s no, like, magic that you can— Except for the mending spell that’s happening right behind you, you don’t pick up on anything."
616,44,Merle," Sorry, didn’t mean to interrupt."
617,44,Justin, Okay. Sounds good.
618,44,Griffin, At this point the cart has been fixed.
619,44,Justin," Oh, great. Another great adventure, Magnus."
