,episode,speaker,lines
0,55,The Adventure Zone,
1,55,Dungeon Master & NPCs, Griffin McElroy
2,55,Magnus Burnsides, Travis McElroy
3,55,Merle Highchurch, Clint McElroy
4,55,Taako Taaco, Justin McElroy
5,55, Episode 55 - The Suffering Game - Chapter Five,
6,55,(part of TAZscripts on Tumblr),
7,55,Griffin," Previously, on The Adventure Zone"
8,55,Griffin, This doorway opens in the wall and three names appear above it
9,55,"Antonia, Rowan, and Lord Artemis Sterling. ",
10,55,Rowan," Welp guys, uh, guess I’ll see you on the other side— "
11,55,Cam," Hey guys, uh, my name’s Cam! Oh, I mean I’ve been here for a long time but I got screwed over. But that’s— that’s not important— "
12,55,Magnus, This goes against everything I believe.
13,55,Taako," Well, luckily it’s not your decision. Forsake!"
14,55,[Clint laughs],
15,55,Griffin, Alright… and they chose trust!
16,55,Taako, Hell yeah!
17,55,Edward," Live from the inescapable depths of Wonderland, it’s time for another round of Heart Attack! The heroic dating show."
18,55,Taako, I cast True Seeing on Magnus.
19,55,Griffin," You see that Red Robe, and you just see this Red Robe put a single skeletal finger to its nonexistent lips."
20,55,Announcer, Fret not dear listener! It’s always darkest before the dawn… unless of course you’re locked in some sort of pain dungeon… it’s The Adventure Zone!
21,55,[THEME MUSIC, “Déjà Vu” by Mort Garson (full song on YouTube)]
22,55,{1,30}
23,55,Edward," Madness, what does it mean to be a hero?"
24,55,Travis, He did just call me “Madness.”
25,55,Griffin, Did I?
26,55,Justin, It sounded like “madness” to me— 
27,55,Travis, You definitely said “madness.”
28,55,Griffin," Oh, no."
29,55,Clint," Was that a clue? That was a clue, wasn’t it! It was a clue! I bet it was a clue."
30,55,Griffin," Uh, start over, second take, put that one in the blooper reel."
31,55,Clint," Madness, got it."
32,55,Edward," Magnus, what does it mean to be a hero?"
33,55,Griffin," The two liches in front of you — who you can see in their true form — are still giving you the same prompt, Magnus, and— you don’t really know where this sight came from, right? ’Cause Taako didn’t give you a heads-up. But you— you blink a couple of times and the True Sight fades and— "
34,55,Justin," I don’t wanna be a rules guy, but he does have True Sight for an hour. So I do not know why that vision would be fading so quickly when I cast correct!"
35,55,[Clint laughs],
36,55,Justin," Woo-Hah, Woo-Hah. I’ve got you all in check."
37,55,Clint, I’m gonna re— retweet that.
38,55,Griffin," Okay but this is just gonna be a lot of kinda— yeah, sure, fuck it, why not. Yeah, alright, you still got the True Sight and it’s still on ya, and you have it for a whole hour. And you— you just see this Red Robe and now he’s just kinda floating uncomfortably in front of you— "
39,55,[Travis laughs],
40,55,Griffin," He’s uh, his main planned interaction— "
41,55,Justin," We don’t know what dope shit we’re gonna be doing in the next hour, I’m not gonna burn a Level 6 spell for your narrative! I’m sorry!"
42,55,Griffin," That’s fair, that’s fair."
43,55,[Justin laughs],
44,55,Griffin," Okay, yeah! You can still see this Red Robe then and he’s just kind of floating expectantly in front of you. And the two elves who you still see as liches— thank you, Justin, for the clarification! "
45,55,Justin, Mmhm!
46,55,Griffin," — Uh, don’t seem to take notice of the Red Robe. Your answer, Magnus."
47,55,Magnus," Y’know, if you’d asked me in my younger days, back ten years ago— "
48,55,Clint, Or 15 seconds ago.
49,55,[Griffin laughs],
50,55,Travis," Yes, that was the joke, thank you Dad for filling in the punchline! "
51,55,Clint, You’re welcome!
52,55,Magnus," I would’ve told you that what makes a hero is— is someone who acts, someone who leaps into the fray without thinking. But, y’know, I’ve had some time to think now, and I would say that I’ve grown a little wiser, and, uhh, I would say that a hero is someone who acts when it counts. Acts at the right moment, acts when it’s needed. "
53,55,Griffin," With that, you hear a little bell ring, signalling the end of this game of Heart Attack! And the audience applauds your answer, Magnus, and there’s a little music stinger playing you out. And the two liches say"
54,55,Edward," Well, it sounds like our suitor has made their decision! Let’s see who they chose for their hot date."
55,55,Griffin, And that— 
56,55,Clint, This is exciting!
57,55,Griffin," And that screen beside all of you drops to the ground, and the— you can see the figure casting the silhouette. It is another one of those marionettes, and because of Taako’s spell, it’s still kind of shuddering and making kind of weird… pseudo-laughing noises? And really, it’s just kind of, like, collapsed onto the ground, and one of its legs is just like repeatedly lifting up and thumping down into the ground…"
58,55,Clint," Okay, lemme— I have a question, I’m serious. What do… Ma— I mean, what do Taako and I see? ’Cause he only cast True Sight on Magnus."
59,55,Griffin," You— yeah, you see the same thing. The True Sight just kinda made it so that Magnus could see through the blinding lights— "
60,55,Clint," Oh, okay."
61,55,Griffin," — and see like who was in the studio audience. But you see— You all see this kind of creepy display, and it’s just not stopping, its leg is just THUMP-THUMP-THUMP down into the ground, and Edward says"
62,55,Edward," Well… Hm. Well, we learned everything we need to know, so… I guess let’s… call it a draw? Let’s move on. This has gotten frankly a little too weird, even for us."
63,55,Griffin," And uh, they t—"
64,55,Merle," But I would’ve won, right?"
65,55,Edward," Oh, let’s not, it’s— it’s like Whose Line, baby. The points don’t matter."
66,55,Merle, [laughs] But I would’ve.
67,55,Griffin," And they turn to, like, go but before they do, they say"
68,55,Edward," Oh, wait, we need to find out how your opponents in the last round of Trust or Forsake fared!"
69,55,Taako," Probably pretty fuckin’ bad, huh?"
70,55,Griffin," And a screen appears behind the two of them, and it lights up and you see three figures standing on a glowing square labeled “Finish,” and you recognize that they are on that board game that loaded into this room previously. It’s all sprawled out behind them. And it takes you a second to recognize them because all of the sacrifices they’ve gone through here in Wonderland have changed them pretty dramatically."
71,55,"But it’s the three adventurers that you met in the Felicity Wilds. It’s Rowan and Antonia and Lord Artemis Sterling. And they look rough. Sterling is the worst off. First of all, he’s no longer, like, a young, like, boy-man? He’s aged probably it looks like into like his late 30s and his hair’s gone an early bright silver and he’s also like— ",
72,55,Travis," That’s a good look though, Griffin."
73,55,Griffin," It’s a good look, but— "
74,55,Travis," Like, I know that you were trying to make him sound haggard, but like— "
75,55,Griffin," No, he’s— he’s on some Malfoy shit, for sure— "
76,55,Travis," —that young, silver fox…"
77,55,Griffin, —but he’s also severely injured.
78,55,Travis," Oh. That’s a good look, y’know?"
79,55,Griffin," He’s laying in Antonia’s lap and she’s trying to comfort him but she— she’s not looking at him, like she’s not looking down at him while she’s— she’s doing so, and you realize she’s wearing a bandage wrapped around her head that’s just covering her eyes. And Rowan is standing and facing the screen and he looks just withered up. He looks so worn down. You can see big patches missing from his big, red beard."
80,55,Travis, [softly] No!
81,55,Griffin," And you can’t hear anyone on the other side, but you can tell that Sterling is just like wailing, and this column of black smoke is just pouring out of him. And as Rowan recognizes you guys on the other side of the screen, you see him mouth the word, clear as day, “Why?”"
82,55,Travis, I point at Taako.
83,55,Griffin," And then the screen shuts off. And, how are y’all doing? I haven’t asked you that this arc, and I feel like that was a good thing to know in the last one. Just like, a quick ch— a quick emoji check-in with the boys."
84,55,Justin," Uh, I don’t physically feel great. I’ve had better days, physically. Um, emotionally, I’m about over it."
85,55,Travis, [laughs] Yeah…
86,55,Justin," From like an emotional perspective, I think I’m pretty well… done with these people, with these creatures."
87,55,Travis," Yeah, I would say Magnus is kinda in a— like, physical, taking a lot of like, physical damage, is like Magnus; you know, he’s a tank, that’s his MO. But like, he’s just being worn down psychologically by this shit."
88,55,Clint," And Merle’s saying, “Ah, I’m okay. How are you?”"
89,55,Travis, You lost an eyeball!
90,55,Griffin," Yeah, that’s fair."
91,55,Clint," Yeah, I know, but—"
92,55,Justin," Except for continuing to run into door frames, Merle’s doing great."
93,55,[Clint laughs],
94,55,Griffin," The two elf liches, um, they seem to like notice that you guys aren’t, like, having a great time, and Lydia says"
95,55,Lydia, You all seem pretty down in the dumps. How would you like a bonus round?
96,55,Taako, I’m good actually.
97,55,Magnus," Sounds— Yeah, uh, sure."
98,55,Merle, I’d like that about as much as a poke in the eye.
99,55,[Clint laughs],
100,55,Griffin," Cam looks over at you, Taako, and he says"
101,55,Cam, The bonus round is how I ended getting trapped here in the first place. I wouldn’t recommend it.
102,55,Taako," Yeah, like, no shit… head!"
103,55,Magnus," Yeah, dog."
104,55,Taako, No kidding! I’m— so it’s the first part of this g—
105,55,Magnus," You’re not like, tellin’ us, “Oh, what? It might be bad?”"
106,55,Taako, So it’s the first part of this game to be unpleasant? Excellent.
107,55,[Clint laughs],
108,55,Griffin," Edward is kind of awkwardly, like, tapping his fingers together, he’s like— "
109,55,Edward," It’s kind of… not optional, though."
110,55,Magnus," Yeah, I also figured that! Okay!"
111,55,Taako, Obviously.
112,55,Griffin," And another pitch-black door opens up behind them as they disappear, and it leads you into the next chamber, which I’m assuming you’re— you’re popping into, unless you wanna hang out and— "
113,55,Travis, Sure.
114,55,Griffin," I mean you can— you can look around this room more if you— if you want. There’s— like I said, there’s just a bunch of these marionettes just now all inactive. Actually, they’re just sitting completely stationary in these risers facing the stage, just— just not moving. And they’re— they’re these intricately made with all these different points of articulation, these marionettes, but they have no face."
115,55,Travis, I take one of their arms.
116,55,Merle," Hey, Magnus… Yeah, I was gonna say, “Take an arm, baby!”"
117,55,Magnus, I need to rebuild my collection.
118,55,Griffin," Sure, you, uh, you pop off one of their arms and now you have a wooden arm. Cool."
119,55,Travis, And then I slap the laughing marionette with the arm and I say
120,55,Magnus, Pull yourself together!
121,55,Griffin," As you hit the laughing marionette, it stops— it finally stops moving."
122,55,Merle," Let’s go, guys!"
123,55,Justin, Yeah. We’re following.
124,55,Griffin," Okay. In the next chamber, you’re in another large circular room about the same dimensions as the one you just left, and in front of you are three large platforms, just not— not very high up, about a foot and a half off the ground. And each one has a huge multicolored neon sign hanging above it. And one says, “Escape Game,” one says, “Healing Game,” and one says, “Recovery Game.” And as you walk in you hear Lydia say"
125,55,Lydia, Oh! Wait a moment! One of you has already played the escape game!
126,55,Griffin," And that pedestal dissolves into black smoke and wafts up into the ceiling. And so, you’re just left with two platforms that say “Healing Game” and “Recovering Game.” And you hear Edward say"
127,55,Edward," For the bonus round, you get to decide what game you want to play! Both are terrific little diversions, but this time you only get to pick one!"
128,55,Clint," So we have to assume that “Heal” means we get healed, and “Recover” means we get to take something back that we gave up, I would assume."
129,55,Justin," Maybe our, but maybe just spell slots and stuff. Um, recover those, I don’t know."
130,55,Griffin," Cam— Cam still looks like, like, kind of uncomfortable just being in this bonus room decision chamber."
131,55,Taako," Cam, which one did you choose? What happened?"
132,55,Cam, I— I ended up— I ended up playing the Escape Game.
133,55,Taako, Oh good!
134,55,Cam," And I— well, I, I lost and that’s— that’s why I’m here, and a head."
135,55,Magnus," How do you lose a bonus round? Wait, hold on, hold on! I’m— I’m no games master, but a bonus round should just be winning."
136,55,Cam," Well, it was a bonus round for the person who won. It was kinda like the Decision Game. I came in here, I was hired to guide someone in here, and we were doing— well, we weren’t doing very well, we made it through a couple rounds, and then we played the Escape Game and they made us an offer where if one of us betrayed the other, we could escape, but we’d leave the other one to be stuck in Wonderland to suffer eternally."
137,55,"And I told her it was a trap, I told her anybody who left this place alone wouldn’t survive 10 minutes in the Felicity Wilds but she took the offer and, well, here I am.",
138,55,Magnus, This— this person you were guiding. Older lady?
139,55,Cam," Yeah, but I mean, she got older while we were here, yeah."
140,55,Magnus," Yeah, yeah, okay."
141,55,Taako, Right. Right. Okay.
142,55,Cam," Wait, do you know— "
143,55,Magnus, What?
144,55,Cam, Do you know Lucretia?
145,55,Magnus, Just a guess.
146,55,Taako," Yeah, we do. We’re kinda working for her, basically."
147,55,Cam, So she trapped you in here too?
148,55,Magnus, She… sent us in to save you?
149,55,Cam," Wait, she sent you in to save me?"
150,55,Taako," Yeah, we’re here to…"
151,55,Cam, She sent you in to save me?
152,55,Magnus, Sure!
153,55,Taako," Totally, man. Rescue mish."
154,55,Merle, Yeah!
155,55,Taako, Die-hard rescue mish. We’re here for you.
156,55,Griffin," You see, like, a tear start to well up in his eyes."
157,55,Magnus, You should probably stay hydrated because I don’t think you can drink water.
158,55,[Clint laughs],
159,55,Griffin, He’s kinda speechless. He says
160,55,Cam, Maybe I was wrong about her. I don’t know that I can escape anymore. I’m pretty sure— 
161,55,Magnus," Well, no, they took the pedestal away."
162,55,Cam," Well, no, it’s not just that. I mean, I’m just— I’m just a head. I’m pretty sure it’s this place that’s keeping me alive in the first place, but that means a lot. Thanks guys."
163,55,Griffin," You just hear Edward just go, like,"
164,55,Edward, [clears throat]
165,55,Travis, Yeah.
166,55,Merle," Lemme be a coach for a second. Look, we’re not gonna escape, but I say we go for heal, right? The stuff we’ve given up, we gave up of our own free will— "
167,55,Magnus," Well, okay— "
168,55,Merle, Let’s get healed up! We’re not gonna get healed any other way!
169,55,Magnus," But hold on, if I might counterpoint for a second. Cam makes it sound, and Cam, please correct me if I’m wrong, makes it sound like only one of us will get and the other will lose."
170,55,Edward, Maybe!
171,55,Griffin, You hear Edward say.
172,55,Magnus," So it sounds like in the heal chamber, maybe like one of us gets healed but the other two lose hit points."
173,55,Taako, That would be fine.
174,55,[Griffin laughs],
175,55,Clint, Taako’s down to like a decimal point something.
176,55,Taako, We could make that work.
177,55,Merle, I say we do it anyway.
178,55,Magnus," Yeah, now that you mention it, I’m still doing pretty good, so like, sure, let’s do it. Heal."
179,55,Taako," Yeah, let’s go to the healing room."
180,55,Griffin," Okay! You all step up onto the “Healing” platform, and as you do, a ripple of light emits from the platform and everything else in the room disappears."
181,55,Justin," As the light comes down, Taako is hit by the realization that there’s a possibility that this room could test the healing abilities of our party and he’s hit with a deep existential dread. Just like— "
182,55,[Clint laughs and claps],
183,55,Justin," — a mortal panic. He basically like, tries to get off the pedestal and just can’t in time."
184,55,Griffin, Um.
185,55,Clint," Talking about me, aren’t you?"
186,55,Travis," I guess I should also ask, Ditto— "
187,55,Griffin, Yeah.
188,55,Travis," Do I see anything bef— let’s retcon a second, before we step on this platform, does the True Sight reveal anything?"
189,55,Griffin," Huh. I’ll tell you what, that’s a really good question. Yeah, your True Sight showed you when you walked into this chamber, Magnus, and it’s something the other boys didn’t see, is that like, for a split second, everything in this chamber was just black smoke, like the same black smoke that you’ve seen that pours out of you when you have a bad time."
190,55,"It was just black smoke, and then it kind of like, firm— firms up. Almost like uh, you know how “pop-in” in video games works, where you’re too far away from a thing and then it just like “boop!” It was kinda like that. And you were the only one that kinda saw it. It was like the contents of this room, like, had to load in for a second.",
191,55,Travis, Gotcha.
192,55,Griffin," How’s that? So this light ripples throughout the room, and all of a sudden the three of you are all standing in front of a little pedestal with two buttons on it, and the buttons are labeled with the other names of the people in your party. So, Taako, you’re standing in front of one that says “Magnus” and “Merle,” and so on. And you hear Lydia explain— oh, and there’s like— there’s like bright like neon trim lights running all around the room and the words “Healing Game” are floating in a big sign between all of your pedestals. And Lydia says"
193,55,Lydia," We know some of you are fear— faring a little bit worse than others, so we thought we’d give you the chance to balance out some of your current states of physical well-being. So, in the Healing Game, we’ll allow you to transfer some of your vitality over to a friend. But, in doing so, you will experience a bit of energy degradation during the transfer, so they’ll only receive half the vitality that you send in their direction. "
194,55,Griffin," So, in the Healing Game, you can give another person on your team some hit points at the cost of 2 to 1."
195,55,Travis, And how many hit points does Cam have to give to Taako?
196,55,Griffin," This is a great point. Okay, Cam also has a little pedestal, and it has all your guys’ names on it, and you all have a pedestal that has Cam’s name on it, and he’s like"
197,55,Cam," I’m gonna be honest, I’m just a head, so, uh, I don’t really have a lot to give or receive? So if— I’m probably gonna abstain from this challenge. I’m actually good to go; I’m full of hit points, there’s just like, four of them."
198,55,Clint, [laughs] Alright!
199,55,Travis," What are you down to, Taako?"
200,55,Justin, Fourteen.
201,55,Travis," Oh, I’m at like, 75."
202,55,Clint," Okay, even though there’s some internet discrepancy, I maintain that I’m at 71, so I’m gonna give, do I hit the button of who I wanna give it to?"
203,55,Griffin, Uh-huh.
204,55,Clint," Alright. I hit “Taako,” and I give 40."
205,55,Griffin, That would kill you.
206,55,Clint," No, no— "
207,55,Griffin," Oh you’re giving, so he’s getting 20."
208,55,Clint, Right.
209,55,Griffin," Oh, okay. I thought you were saying you’re giving him 40 so you were subtracting 80. That would be a fun way for Merle to go, um, by— he’d just be pressing a button— "
210,55,Travis, [dramatically] The ultimate heal. He made the ultimate heal!
211,55,Griffin," Yeah. “Now who can’t heal,” dead. Uh, all right, Taako, heal 20, and Merle, take 40 points of damage."
212,55,Clint, Okay.
213,55,Travis, That was bold and brassy.
214,55,Griffin, Magnus? Do you do anything?
215,55,Travis," Uh, Taako, what’s your max?"
216,55,Griffin, It recently went down.
217,55,Justin," Uh, yeah, uh, I am currently at 34. My max is 49. I don’t see— "
218,55,Griffin, Holy shit.
219,55,Justin, What?
220,55,Griffin, That’s just real low.
221,55,Justin," Is it? Is it, Griffin? Is it?"
222,55,[laughter],
223,55,Justin," Is it “real low”? Is it almost like some fucking liches of your imagination sucked my hit points away from me, a wizard? Is that what hap— is that what may account for the lowness?"
224,55,Griffin," Yeah, it’s real weird. It’s like really, it’s like, real low."
225,55,Justin," It’s like so crazy low, huh? It’s just super wicked low, it’s all I can think about."
226,55,Griffin, Yeah.
227,55,Justin, Uh-huh.
228,55,Travis," I kinda feel like, so, I feel like I wanna do like that guy in The Office that when everyone like starts collecting for charity, you don’t really wanna give but you also don’t wanna be the only one who doesn’t. So I’ll give like 10 of my hit points to give Taako 5. That’s also like 10 percent of Taako’s health, though. So."
229,55,Griffin, [laughs] Alright. You just lightly tap the “Taako” button.
230,55,Travis," I mean, I nee— Okay, like on a— "
231,55,Taako, Guys! I don’t know what just happened but I had a skinned knee and it healed over!
232,55,Travis," But like, my job is to get hit! "
233,55,Taako, Not all the— not all the— not all the way!
234,55,Travis, Taako’s job is to stand in the back!
235,55,Taako," It’s still red. It’s not healed up completely, but like it’s definitely somewhat healed. A little bit."
236,55,Griffin, There’s still like a little raspberry there.
237,55,Taako, Thank you for whoever was so kind to donate that.
238,55,Travis," You know, it averages out that like we gave you 12 and a half points each."
239,55,Griffin," Uh, as— "
240,55,Clint," Nah, nah! No, it doesn’t really! As someone who has taken a lot of shit over being a bad healer, I don’t think it averages out at all."
241,55,Travis," I just healed and I’m the tank, so who’s the best healer, really? Y’know, you’re supposed to heal."
242,55,Clint, How much did you heal? You did a knee.
243,55,Griffin," Um, I’m gonna say that— "
244,55,Travis, Yeah! A very important knee!
245,55,Griffin," While all of this is taking place, just a little bit of that smoke is coming out of you guys as you have this argument."
246,55,[Clint laughs],
247,55,Justin," Yeah, alright, yeah. Alright."
248,55,Travis," Yeah, yeah, that’s fine."
249,55,Justin, That’s fair.
250,55,Travis, That’s fair.
251,55,Taako," Thank you to everyone who gave an average of 12 and a half hit points, I really appreciate it."
252,55,Griffin, And uh— 
253,55,Magnus," Hey, least we could do, buddy."
254,55,Griffin," And, uh, Taak— Magnus, you actually see that Red Robe, who has sorta been shadowing you from behind, he floats into the middle of the three of you and he sucks up a lil bit of that black smoke. [lip smacking] Tasty, tasty."
255,55,Travis, [laughs] What a dirty bird.
256,55,Griffin," And yeah, joking aside, like, Taako, you looked fucking pretty bad still from that washing machine that fell on you, but you’re— you’re actually looking a lot better, like your wounds really have closed up a bit. Merle, on the other hand, you actually have started to look a little bit bad now. And Magnus, you also have a skinned knee. And you feel it."
257,55,[Clint laughs],
258,55,Griffin, And can I say something? It stings. Doesn’t feel good.
259,55,Clint, He should have— shouldn’t he have two skinned knees?
260,55,Griffin," Yeah, that’s a great point. [laughing] You have two skinned knees because of the 2 to 1."
261,55,Travis," Well, wouldn’t it just be that one of the skinnings is twice as big?"
262,55,Griffin," Nope. You got two skinned knees. It’s a— It’s a really good look. And with that, the lights in this room kinda shut off and another door opens up in the back of the room, another pitch-black door."
263,55,Taako, Let’s do it.
264,55,Travis," Am— Am I— Griffin, am I safe to assume that I’m seeing a lot of like “And the black smoke starts to fade in this room and form a new room” kinda thing?"
265,55,Griffin," Yeah, actually, you see the inverse as you leave this room, you see it like start to unload a little bit and then as you— as soon as you walk into the next room you see it sorta fade in, just like a second too late. And it is another room with— I mean, it’s not another room, it’s the same room with that big ol’ Wheel of Sacrifice in the middle of it. The Wheel— I wanted to call it the Wheel of Misfortune but I think that was an old Animaniacs goof. "
266,55,Travis," No, that was Wheel of Morality."
267,55,Griffin," Wheel of Morality! Damn it, you’re right. But yeah! The three of you, with Cam, walk into the Wheel room and you see the same big stone door on the far side with four dots over it that are sort of a dim red and it’s the same old wheel and you hear Edward say"
