,episode,speaker,lines
0,63,The Adventure Zone,
1,63,Dungeon Master & NPCs, Griffin McElroy
2,63,Magnus Burnsides, Travis McElroy
3,63,Merle Highchurch/Janitor, Clint McElroy
4,63,Taako Taaco, Justin McElroy
5,63,Episode 63 - The Stolen Century - Chapter Four,
6,63,(part of TAZscripts on Tumblr) ,
7,63,Griffin," Previously, on the Adventure Zone "
8,63,"The tendrils retract, and they pull that entire plane and pulls it into the Hunger itself. And the diameter of the Hunger you see just, just ever so slightly, expands.",
9,63,Clint, I have a thing called Zone of Truth.
10,63,Griffin, Okay.
11,63,Clint, Merle casts Zone of Truth.
12,63,Angus, My--my brain feels like it’s tingling.
13,63,Clint, I cast Zone of Truth!
14,63,Justin," Hell yeah, dude."
15,63,Clint, Yeah!
16,63,Announcer," I know, I know. This flashback’s been going on forever. But you might find this one illuminating. It’s the Adventure Zone!"
17,63,[theme song],
18,63,{{1,26}}
19,63,Griffin," The seven of you are now on the 30th cycle of your journey, and the world that you find yourselves in this time is a rich one. It’s full of dozens of different civilizations and thriving cities and nations and what’s kind of unique about this world is you’ve been to a few planets that are, a few planes, I should say, where there’s like lots and lots of people, and it’s very vibrant, and alive, "
20,63,"but the thing that sort of makes this world stand out is that all of these, these different thriving nations and civilizations, they’re all living in harmony and, and peace. Um. And there’s actually, there’s so much stuff here, there’s so much life here, that you have a hard time sort of figuring out where to settle down in this world, and so you wait for the Light of Creation to fall, and you follow it to one of the sort of oldest civilizations on this planet, um, a nation called Tesseralia.",
21,63,"And you're greeted warmly in that nation’s capital city and are treated as revered guests. And everybody is very like, accomodating to you. There’s like a brief period where some investigative agencies like look into your plight as you come and sort of explain what’s going on. And after some time, the governor of this nation attends to you and confirms that yes, they do have the Light of Creation.",
22,63,"Specifically, it is in the possession of an institution called the First Monastery. And it is an institution that, as the governor explains it, is nearly solely responsible for the peace and prosperity that this world benefits from. So about a month into your stay in this world, the seven of you are brought to the First Monastery, where you are received by Abbess Oriana, who is sort of the, the leader of this, th-the spiritual leader of this monastery, and you are given tea and food served in this spicy, delicious broth. Um.",
23,63,"At this point you’ve been traveling together for over 30 years, spending each year in a new reality, but none of you have really tasted anything quite like this before. It’s really delicious. And Abbess--the Abbess explains that the monastery does indeed have the Light of Creation but that she will need one of you to prove that you are able to handle the tremendous responsibility of this power before the monastery will part with it. And she has a particular recruit in mind. Um, after sort of getting to know you all and sizing you up, she turns to you--",
24,63,Travis," So, so it’s power. It’s Magnus, right?"
25,63,Griffin, She turns to Merle. She says--
26,63,Merle, Hmm?
27,63,Abbess," Hi, Merle. Uh."
28,63,Merle, H-h-hi.
29,63,Griffin," She says that if you join their monastery for the year and serve them well and sort of show your, your true colors--well, maybe not your true colors. But put your best foot forward. Uh, she will relinquish the Light to your party."
30,63,Merle," Uh, um."
31,63,Magnus, Can we have a second to talk this over with him?
32,63,Griffin," Uh, Oriana--Oriana says,"
33,63,Oriana," Um, yes, but be quick. I have other matters to attend to."
34,63,Merle," Um, are there like vows of celibacy and shit like that?"
35,63,Magnus, M-Merle.
36,63,Griffin, Um. [laughs]
37,63,Merle," Huh? What? What? What, Magnus?"
38,63,Taako," I was about to caution him against this exact behavior, but I can see that we’re chasing-- yeah, we’re dog chasing its tail at this point."
39,63,Magnus, Yeah.
40,63,Taako," I think let’s what’s gon’ be is gon’ be, guys."
41,63,Merle," Oh, oh, I wasn’t saying it’s off the table. I’m just, I just want all the information!"
42,63,Taako, It’s off the table me hearing about it.
43,63,Griffin," Oriana-- Oriana says, Oriana says,"
44,63, Oriana," Um, no, there’s no vow of celibacy, and also, yuck."
45,63,[laughter],
46,63,Merle," How about a vow of silence, or do I have to starve, ‘cause--"
47,63,Magnus," Yes. Vow of silence, yes."
48,63,Merle," I have, I have a blood sugar thing. I don’t know if I could, like, you know, fast a lot."
49,63,Griffin," She says,"
50,63,Oriana," I see. We don’t, um, require our, um, recruits to, um, relieve themselves of the pleasures of life. Um, but we do demand, um, pretty, pretty strict training, um, so no, you can bone, as long as you show up for work the next day."
51,63,Merle," Yeah. I think it sounds really cool. I, I, yeah. Let’s do it."
52,63,Griffin, Okay.
53,63,Merle," As--as long as I get to eat all the chow I want, right?"
54,63,Oriana," Uh, yeah. Uh, we have a whole team of, of cooks here, and I think you’ll find yourself well-fed."
55,63,Merle," Bring it on, Abby."
56,63,Oriana," It’s Oriana, and don’t."
57,63,Merle," Oh, okay."
58,63,Griffin," We’ll get to Merle’s thing, because this is-- I sort of-- so I’ve envisioned, um. We’re close to like the halfway point now of the Stolen Century, and I think we’re gonna hit a point where things are just gonna kind of hit critical mass, and we’re just gonna have to go until we get to the end of it, but before we get there, each of you is gonna have sort of a featured cycle where you're gonna kind of carry some of, more of the narrative weight as we-- We’re at a point now where we’re gonna be major, in a major way, like filling in the narrative gaps of like, what does this mean and what’s this all about?"
59,63,"So this is Merle’s, um, and so we’re gonna get to him last. But Merle, or Magnus and Taako, um, you still get to like take a turn in this world. So, um, before we get to sort of the main thing, which is Merle’s training and what that means, um, and what’s going to come out of that, um, what do you all want to do in this--in this world?",
60,63,Clint," Well, can you give them a little more about the world? I mean, we know--"
61,63,Griffin," Yeah, sure. I’ve sort of envisioned-- there’s-- this world is just very diverse and very alive and there are, um. There’s not much military in this world, right? I was thinking would you maybe go and train in this new way of fighting you’ve never seen before, but like it’s a very peaceful world. It is a world that’s just completely at peace, so I don’t know that there would be much--"
62,63,Travis, What about--
63,63,Griffin, In the way of that.
64,63,Travis, Griffin?
65,63,Griffin, Mm-hmm?
66,63,Travis, What about sport?
67,63,Griffin," Um, yes. Okay, that’s great. Yeah. There’s definitely a lot of sport to like fill it. When soldiers became unnecessary, like the strong needed something to do. And so there is a, uh, there’s a game that these, these civilizations play in lieu of combat. Um. And what do you, what do you want it to be, Magnus? What’s this sport look like?"
68,63,Travis," I want it to be like a football-esque, basket-- like a combination of football and basketball. You know, the hoops that you have to dunk it into, but you can hold the ball and run around with tackling. Um, but very, very strict anti-violence rules."
69,63,Griffin," I mean, so no hitting?"
70,63,Travis," No, there’s tackling. But you gotta be like cool about it, you know what I mean? Like--"
71,63,Griffin, Okay.
72,63,Travis," I don’t want any-- there’s no concussions in this game, you know what I mean? They take good care of it. There’s no like spearing. There’s no- you know, face masks. Like, everyone is very civilized in this game."
73,63,Griffin," All right, so while you’re like killing time, I guess, in Tesseralia, while Merle trains in this monastery, which you are not like granted access to after this meeting with, with Oriana, because it’s like a monastery and they have a pretty like strict closed-door policy, so you're just like, you get an apartment here. And I think a lot of you are just kind of living here in the city."
74,63,Travis, I imagine there’s like a group of neighborhood kids--
75,63,Griffin, Okay.
76,63,Travis, Like are having a game. And like I kind of you know join in. And--
77,63,Griffin, And you tackle a-- you tackle a child.
78,63,Travis," No, I’m not going to hurt him. This person sees me, um, handle the ball well, maneuver well, but not be aggressive towards these children. And I get hired to coach a peewee league that has been-- it’s a lot of troubled kids."
79,63,Griffin, This is not the way I thought this was gonna go.
80,63,Travis," Their team, you know, everybody sees their team as a joke. No hope at making playoffs. Um, and so one of-- like you know their moms, one of their moms is like “hey, you seem like you have-- could you teach our kids? ‘Cause like the last coach quit because it was too frustrating.”"
81,63,{9,42}
82,63,"And I’m like, “well, I got nothing but time on my hands. Sure.” And so I work with the kids and train them up, and do we go to state? Hell yeah, we go to state.",
83,63,Griffin," All right, Coach Taylor, real quick. Coach Taylor, real quick. One, what’s the sport?"
84,63,Travis, Yeah?
85,63,Griffin, What’s the sport called?
86,63,Travis," Uhhh, Rebound."
87,63,Griffin," Okay, the sport is called Rebound. And what is this team, the Tesseralia whats?"
88,63,Travis, [laughs] The Tesseralia Losers.
89,63,Griffin," [chuckles] Okay, the Tesseralia Losers."
90,63,Clint, The Bad News Losers.
91,63,Justin, But the day like right before the big game instead {1013} he whips out new jerseys and they say Winners. [Clint laughs] Say we’re changing the name of the team.
92,63,Griffin," Travis, give me that speech right now to these children. These children are sitting in front of you and your star, um, slammer, um, the other team came and they-- in the middle of the night, they-- well, no, that’s a little dark. These are children. Hold on. Wait. Let me do--"
93,63,[Travis laughs],
94,63,Griffin," He gets, he just gets food poisoning. But did the other kids give it to him? The other-- you think maybe. And they took you out. And so the rest of the Losers are like,"
95,63,Timothy," Aw, man. How are we- We can’t win at Rebound without our star slammer whose name was Gerald."
96,63,Magnus," Not with that attitude, Timothy. Deborah. Deborah, come in close. Steven, scoot in. Derek, yes. Susan, you’re close enough. You’re good. But, no--"
97,63,[Clint laughs],
98,63,Magnus," You know what, Timothy, two feet to the left. Perfect. Right there."
99,63,Timothy," Oh, I get it."
100,63,Magnus," No, wait. Come back. Come back. Come back. I was just trying to put you in my line of sight. You were too far. Oh, I couldn’t see. I don’t wanna have to turn my head a bunch, because I’m about to do big dramatic speech. And I don't wanna have to move a bunch."
101,63,"Um, listen. When I came to this dimension-- that’s right. I said dimension. I’m not from here.",
102,63,[Griffin and Justin laugh],
103,63,Magnus," {1126} I wasn’t expecting… to teach one kid how to play a sport I didn’t know, let alone 18 of you. [someone giggles] But here I am, and you know what, I've done it, ‘cause I’m a winner. And now, because of me, you're all winners too. Because the magic wasn’t in you all along. It was in me. And I've made you the winners that you are here, today, now."
104,63,[Clint laughs],
105,63,Loser," But, but Coach, what’s gonna happen to us after you leave?"
106,63,Magnus," Hey, I’m not done! I’m not done with my speech. What were you saying? "
107,63,Loser," What’s gonna happen to us after you leave, Coach?"
108,63,Magnus," I don't know. You might be losers again. That’s gonna be up to you. I can’t help you after I'm gone, all right? But don’t make me look bad or I'm gonna come back."
109,63,Loser, But you said-- you said you’d pay for my college.
110,63,Magnus," And someday, I will, as far as you know. Now, as I was saying, when you get out there today, I don’t want you to worry about the crowd. I don't want you to worry about the other team. I want you to worry about disappointing me, because that’s what really matters. I worked really hard to get you all where you are. Don’t let me down, or I won’t save this plane when the Hunger comes."
111,63,Loser #2, What’s the Hunger?
112,63,Magnus, It’s-- well-- uh-- duh-- um.
113,63,Janitor Clint McElroy, Hunger for championships!
114,63,Magnus," Yeah, the Hunger, whatever that guy in the corner, the janitor said. It’s the hunger for championships."
115,63,[laughter],
116,63,Justin, The one that belligerently refuses to do character voices of any sort.
117,63,Magnus," Yeah, that guy."
118,63,Justin, Despite him making his living off of doing so for 40 years.
119,63,Griffin," That was the janitor in this world, Clint McElroy."
120,63,[laughter],
121,63,Justin, That’s right.
122,63,Magnus," He’s a loser. Do you wanna be like Clint McElroy, the loser janitor, kids? No."
123,63,Janitor McElroy, You can do it!
124,63,Magnus, Don’t listen to him. He’s a loser.
125,63,Justin, Don’t listen to him and his Rob Schneider from Waterboy impressions. That also don’t have a fucking character voice.
126,63,Griffin, [crosstalk] Don’t have a character voice.
127,63,Justin, Because how could you?
128,63,Griffin, Did you-- now--
129,63,Magnus," Here, listen. Be quiet just for one second, kids. I’m proud of you and I love you. Don’t tell anyone I said that. Now get out there and play real hard or whatever. We can win."
130,63,Griffin," Wait, are you giving them the winners jersey or is that not actually happening?"
131,63,Travis," Oh yeah, and then I open up a crate and it’s like,"
132,63,Magnus," I found these outside and I think they might fit you. Uh, try them on. See what you think."
133,63,Travis, And then that’s the big reveal.
134,63,Janitor McElroy, Are those jocks?
135,63,Magnus," Hey, get out of here, Clint McElroy. You were fired two weeks ago and you know it."
136,63,Janitor McElroy," [receding into distance] All I do. I clean up, I sweep, I mop, and this is the thanks I get!"
137,63,Magnus [crosstalk], And you also embezzle. Get out of here! You're an embezzling janitor.
138,63,Griffin, What--
139,63,Magnus," Now anyways, kids--"
140,63,Griffin, Okay.
141,63,Magnus," Here’s some jerseys for you. Put them on. Go out there, and make me proud."
142,63,Loser," Gee thanks, Coach."
143,63,Griffin," They, they put them on, and I have no-- I need help. I have no idea how to rectify this, because I think there needs to be a roll to determine whether or not they win the big game, because that feels important to me now in this moment, but I don't know if it’s you rolling plus Body to determine what kind of--"
144,63,Travis," Griffin, look in your heart. Look in your heart. Do they win the big game, Griffin?"
145,63,Griffin," Um, no. You're gonna have to roll for this, dog. It’s--"
146,63,Travis," Do you really wanna risk these 18 kids not winning the big game because of your stupid mechanic, Griffin?"
147,63,Griffin," Yeah, I think I do. Or I--"
148,63,Travis, Okay.
149,63,[Clint laughs],
150,63,Griffin," Here’s where I-- here’s where I'm at. I don't know if it should be plus Body, which represents like you actually physically training these kids and like how well they respond to it, or plus, plus, just like plus Heart, like how well you did at this--"
151,63,Travis," I think it should be plus Body, Griffin."
152,63,Griffin," I think this is-- I think, I think you could say plus Body. I think there’s a good case to be made here, because you're physically training these kids, so roll that."
153,63,Travis, Okay good. Then it’s a 10.
154,63,Griffin, Okay.
155,63,Travis," ‘Cause if you had made me do Heart, it wouldn’t have been a complete success."
156,63,Griffin," Um, with a 10, it is a decisive victory. Who are they playing?"
157,63,Travis," Uh, I don't know what other play-- the Huntington Locomotives."
158,63,Griffin, Okay.
159,63,Travis, The Huntington Blizzards.
160,63,[Clint laughs],
161,63,Griffin," Sure, they were fighting the Huntington Locomotives. Let’s go with that, and the--"
162,63,Clint, Aw.
163,63,Griffin," Short-lived arena football team for our hometown. And how about no, that’s a-- we’ve-- that’s stretching it a little bit too far. Um, Magictown is the name of the town that they were fighting."
164,63,Justin," Much, much better. Much better."
165,63,Travis, The Magictown Bullies.
166,63,Griffin," Okay, the Magictown Bullies just get creamed, even though they had the bigger budget, um--"
167,63,Clint, And a better dojo.
168,63,Griffin," The better dojo to like train in. Um, the, the, uh, Tesseralia Winners, now, crush them."
169,63,Travis," Now here’s the thing. You might, you might ask yourself, do the Tesseralia Winners win by playing a very straightforward by-the-book game? No. No, they didn’t."
170,63,Clint, I don’t think so.
171,63,Travis," There was whimsy and trick plays, oh, like you couldn’t even imagine. Picture it in your head. It’s even more whimsical than that. The b-- there were balls hidden in sleeves. There were, there was--"
172,63,Clint, [crosstalk] Oh.
173,63,Travis," Like, look over there’s, guy with a mustache in the stands. What? Turns out that that guy with the mustache was the player. It was crazy."
174,63,Griffin," Um, okay. For this nasty game, I mean, it’s a nasty--"
175,63,Travis," It’s not nasty, Griffin. It’s just not by the book. They’re playing like no one’s ever seen. They’re not cheating, per se."
176,63,Griffin," Okay. Uh, I'm gonna give you +2 Bond as you celebrate with the most wonderful pizza party afterwards, um, and these, these kids are just in love with you and you’ve just like, man, you just changed their lives. Um, and, I don't know. Goofs, goofs aside for one minute, is it kind of, is it kind of tough knowing like, oh, man, in a year, these kids, um, this town is gonna probably, I mean either it’ll be consumed by the Hunger or best case scenario, it might be a little rough for them when the Hunger arrives. Just to like put a bow on this."
177,63,Magnus," As a reward for winning, I’m gonna take you all on a campout far, far outside of the city limits."
178,63,Griffin," Uh, okay, we can say that you do that close to the, close to the end, and you get all the requisite permission slips, um, and--"
179,63,Magnus," Your parents are gonna go with us, and all of your pets, and your favorite belongings too."
180,63,Loser, This sounds--
181,63,Janitor McElroy," How about me, Coach? Your friend the janitor?"
182,63,Magnus," No, Janitor! Get back in your prison cell!"
183,63,Janitor McElroy, [crosstalk] Dang it! [wheezes]
184,63,Loser, This sounds like a whole big production. Are you-- we have to bring our pets?
185,63,Magnus," Hey, you earned it. You're winners now. And bring any important documents, like legal documents, um, anything you wanna make sure you have with you to establish new lives."
186,63,[Clint laughs],
187,63,Griffin," Um, okay. Uh, Taako."
188,63,Justin, I think this is the first world we’ve been to where Taako would… want to-- where the culture would be such that he would really wanna get down in the local cuisine.
189,63,Griffin, Yeah.
190,63,Justin," So I feel like I’m gonna spend this year like just sort of getting re-acquainted with cooking and sort of seeing what the local flavors are like and, uh, and sort of immersing myself in that."
191,63,Clint, All that broth.
192,63,Griffin, I was--
193,63,Clint, You wanna try that broth.
194,63,Griffin," Yeah, I was really hoping you would go in this, this direction, because like yeah. This is the most culturally rich world, um, that you have been to, and food is like a huge element of that? And it’s just like, um, you cooked a lot while you were in, in your, in your homeworld before you went on this journey."
195,63,"And Lup did too. I think Lup comes with you, like on most of this like eatin’ quest, because when she had that broth, I think your eyes met and you had this like unspoken moment of like, oh shit. Um.",
196,63,"And so you do go around and you eat all of this food that you’ve never really eaten before and learn about all these new like flavor profiles. And like you've, I don't know if you've ever had umami before, but that’s like real big here.",
197,63,Clint, Mm.
198,63,Travis," And the sequel, Twomami."
199,63,Griffin," [crosstalk] And there’s also like a lot-- there’s also a lot of like spicy flavors, and, um, it-- it, yeah. I think it gets you into cooking. What do you wanna, what do you wanna do? Do you have any sort of like, beyond like just going around and eating a bunch of food, are you wanting to like train up your cooking and work on getting better at cooking?"
200,63,Justin," Maybe-- I don’t, I mean it depends on what is available here. Um."
201,63,Griffin," I kind of want you to roll for this, but I think that roll is just like you learning like-- because there’s thousands and thousands and thousands of restaurants here, and I think a plus Mind roll would be like just you finding out what the best stuff is."
202,63,Justin, Mm.
203,63,Griffin," Like finding out where’s the best-- Obviously, there’s the places with the good Yelp review, but what’s the secret best shit to go get?"
204,63,Justin," Yeah, right. Uh, let’s see here. Got a 9."
205,63,Griffin, And I don’t-- do you wanna spend an asset to upgrade that to--
206,63,Clint, I will spend my one asset--
207,63,Griffin, Whoa.
208,63,Clint, --to make it a 10.
209,63,Justin," Whoa, you don’t have to do that. I got lots laying around here."
210,63,Clint," No, I want to! I want to."
211,63,Justin," Okay, fine."
212,63,Clint," Yeah, I use my asset to give him a 10."
213,63,Griffin," Uh, okay, you have to tell me what that asset is and how it like helps him find the good food here."
214,63,Travis, He gives him his copy of Zagat’s.
215,63,Justin, Ugh.
216,63,Clint," It is a, it is a mortar and pestle that I carved out of a very large piece of coral, uh, which allows-- the holes in the coral allow the air to get into whatever you're grinding mortar and pestle, and that will help him get the subtle flavors out of the different spices that he’s researching."
217,63,Griffin," Okay, um, I think you do that, but more importantly you-- I think the way that asset is sort of spent is you find this like street guide who is like really plugged into the culinary world who like talks to you about-- talks to you about some of this, like culture here and takes you to some of the best restaurants, but the chef community here is very insular, and doesn’t just wanna let in some rando from another dimension."
218,63,"But he eyes this mortar and pestle and says if you give it to him, he’ll take you to the best restaurant in this entire world that will change your life and it will plug you into this community in just a really complete way and you will learn things you could never even imagine about food.",
219,63,Taako," Yeah, now be careful with it. I really treasure it."
220,63,Griffin," Okay. You hand it over, and this guide is like, he says"
221,63,Guide," I’m gonna get those good spices out of this one, that sea salt flavor. Mm, mm, mm. You got no idea what a treasure you're giving up here. This thing was made by a friend with a lot of love, I can tell that much. Mm, mm, mm."
222,63,Taako," Oh yeah, it’s really paining me. Anyway."
223,63,Clint, Were you going for a Bourdain thing there?
224,63,Griffin," I don't know what I was going for there. You are taken-- you and Lup are taken to a restaurant that is in the basement of another restaurant, and sure enough, it’s just chefs here. And you guys are— you and Lup are both good at cooking, but this is like— they are on some next level shit."
225,63,"And I think the thing I wanna get out of this scene is you eat this… you eat this dish, Taako, and it’s not a taco, but it is— like— it’s spicy, and it is— it’s really spicy. And it is savory and it is delicious and you've never had anything like it before, and it is absolutely the best, the best thing you've ever eaten. It’s kind of like an open-faced sandwich situation, almost, with, um, ah, this spicy sauce and this really creamy puree on the side of it that has this, like, this sort of nutmeg-like substance grated over it. ",
226,63,Justin, [crosstalk] Mm.
227,63,Griffin," And it is this flavor profile that you have never quite tasted. And how much— obviously Taako and Lup do a lot of cooking, but how much invention of meals do you do?"
228,63,Justin, I feel like I’ve had to get relatively creative in the past 30 years because I’ve had to deal with whatever I’ve had access to. So I feel like ingenuity is kind of a strong suit.
229,63,Griffin," Yeah. I don't know how to describe this, but as you eat this dish, you feel this like— you feel a pulling [music begins] at something inside of you."
