,episode,speaker,lines
230,63,"And you don’t know what it is, because in a way it’s intangible, but at the same time, it’s real, because you can feel it. The moment you eat this meal, the moment your mind starts reeling with all of these new culinary possibilities, a bond is created. And imagine, like, a long thread with one end tied around you and another tied around a person, a moment.",
231,63,"When people talk about destiny, this is the kind of thing that they talk about. And you, you feel it now, because there’s so much power in it, Taako. And whatever’s on the other end, whoever, they feel it too. And, it, you feel it the entire time that you're eating this dish. And as you, like, you just kind of come to your senses and look down and your plate’s empty, because you just finished. And Lup’s like,",
232,63,Lup," Taako, did you hear me?"
233,63,Taako, What? What? What happened? Where am I?
234,63,Lup," Um, we’re in this restaurant. This is fucking unbelievable, right?"
235,63,Taako," Yeah, it’s—that’s the word for it. Unbelievable."
236,63,Griffin," And I think just like… at times when you're not doing something, and you're not running away from the apocalypse, and you're not fighting off the horde of darkness, in the quieter times, when you don’t have much else to do, you just think about this dish and you think about that feeling of something waiting to be unlocked."
237,63,Justin, [crosstalk] Mm-hmm.
238,63,Griffin," I don’t think—it’s not tormenting you. It’s just there, and it’s inside of you, and you reminisce about it. And I think maybe you try to recreate this dish from time to time, and you can do it fairly well. But it’s not the dish you wanna—it’s not the dish you wanna make."
239,63,Justin," Yeah, it’s like a dream that I just barely—I just woke up, and I could just barely sort of remember, but every time I grasp a fragment of it, it dissipates in my hands like sand."
240,63,Griffin, Um.
241,63,Clint, Wow. That was beautiful.
242,63,Justin, Mm-hmm.
243,63,Griffin," Let’s say this roll represents your like— no, you know what, you found this restaurant with that good mind roll. And I think just also in this one night, you learn more about cooking than the 30-odd years that you’ve been on this journey. So go ahead and take +2 experience."
244,63,Justin, Nice.
245,63,Griffin," And Merle, let’s get to your thing. {2554} So Merle, you have been training. You spend this year training here at the First Monastery, and you've been living at the monastery. And that has maybe been a little bit uncomfortable, right. You don’t really know anybody there except for the Abbess, who sort of pitched you this deal that you would get the Light if you trained under her. And it was a pretty slow start. A lot of just meditating in a room for like, days and—"
246,63,[Clint groans],
247,63,"-carrying buckets of water to prove that like, you are patient. And I guess I can leave that up to you. What kind of spiritual training do you think Merle kind of underwent in this, um, in this monastery?",
248,63,Clint, I think he did a lot of looking within.
249,63,Griffin, Mm.
250,63,Clint," I think he used his third eye to look deep, deep into the maelstrom that is his soul."
251,63,Griffin, Shit.
252,63,Justin, Mm.
253,63,Clint, And found himself [laughing] wanting.
254,63,[laughter],
255,63,Griffin," Yeah, all right."
256,63,Clint," Lot of introspection, and, um, and reading? … Would there be reading?"
257,63,Griffin," Yeah, sure. There’s lots of books and lots of reading. I mean, this is a world of just full-blown harmony, and so all of these cultures sort of— it’s not uncommon to just go in a library like the one in the First Monastery and find literature and, um, you know, textbooks and poetry and, like, all kinds of arcane tomes from all these different cultures who are kind of sharing with each other to create like a richer, uh, you know, civilization for all of them. And so yeah, there’s books in here that are just, they’re unbelievable. And you also, I think, eat some great food here too at the First Monastery. I think they take pretty good care of you here."
258,63,Clint," And martial arts too, I mean, I assume. I’m learning, you know, training my body."
259,63,Griffin," Um, Yeah, fuck it! Why don’t you, uh, why don’t you roll plus body real quick? I think there— because there is sort of a, I think a, like physical training component to what you do here."
260,63,Justin," [crosstalk] Hold on, time out. Dad’s making a jerk-off motion at me, so I assume he forgot his dice."
261,63,Clint," No, it’s a— I forgot to grab my dice. Can I—"
262,63,Justin, Go get your dice then.
263,63,Clint, Can I use your dice?
264,63,Griffin, He just needs—
265,63,Justin," No, because we’re gonna do this whole thing."
266,63,{28,23}
267,63,Griffin, He just needs two six-sided dice.
268,63,Travis, You don’t use another player’s dice. What are you talking about?
269,63,Justin, I know. He’ll get his old man funk all over them.
270,63,Griffin, It’s two six-sided die! Just go crack open a Monopoly box.
271,63,Travis, Would you drive another man’s hog?
272,63,Clint," Alright, wait a minute. So what am I rolling?"
273,63,Griffin, Plus body. 
274,63,Justin, [crosstalk] Dice.
275,63,Griffin, Plus body.
276,63,Clint," Plus body, okay. That’s a five and a two and a minus one."
277,63,Travis, Whoops. Whoops-a-diddle.
278,63,Griffin," All right, so you're not—yeah, you’re not so good. I was gonna give you an experience opportunity here, but I don’t think that you're—you’re, you just never really picked up—"
279,63,Justin," To be fair, he did have-- you did give him an experience opportunity. It’s just not one that he managed to capitalize on."
280,63,Griffin," Right, exactly."
281,63,Travis, We call that a stop-ortunity.
282,63,Griffin," You got a stop-ortunity. And so you prove that you're not so good at the physical stuff. And actually, the Abbess is a little bit concerned that maybe you don’t have what it takes to be a part of this monastery, but all of this introspection and quiet sort of reflection that you're capable of doing shows a profound sort of stillness that I think is what earns you the trust here at the monastery."
283,63,Travis," If I may—I don’t wanna fill in story for Merle, but I picture a scene where, like, there’s y’know a teacher sitting down to instruct him on the art of meditation and search of inner peace, and the instructor’s explaining to him that it can take a lifetime to find, and after like 45 seconds Merle’s like, okay, got it. Yup, I’m inner peaceful."
284,63,Griffin, Crushed. Super peaceful.
285,63,Travis, I’m done.
286,63,Griffin," Another thing is just to sort of play to your strengths, there’s a garden here. And you, like, help it grow maybe. Like that’s sort of your whole—that’s sort of your main strength. And seeing how this garden flourishes under your care, the Abbess Oriana, uh, calls you into her quarters and, um, explains to you what the First Monastery has done."
287,63,{30,10}
288,63,"And what she explains is that the monastery and the people who train there have created a, uh, technique that they have taught to the different rulers across this entire world for decades now. And it’s allowed all these different nations to find peace during times of potential turmoil. And this power, she explains, is called Parley. (pronounced par-lay)",
289,63,"And thanks to the training you've undergone, Merle, and the way you've sort of proven yourself, you are taught this ability also. And this takes like— this is the rest of your year, working one-on-one with the Abbess as she teaches you this ability of Parley.",
290,63,"And what you learn is that it allows you to summon any entity into an extra-dimensional space that you create. And in this room, you are able to communicate with your visitor and discuss terms of peace and sort of learn about your potential foe and in this place, sort of come to an understanding with them.",
291,63,"But in order to do so, it requires an act of absolute humility. Because at any time, the visitor, the person you call into this space to talk about peace can harm you. Or kill you. Which kills you both in this space, and in the real world— but you have no such option.",
292,63,"Um, you are there solely as a [sic] arbiter, as a peacemaker, you are humbly waging your life in an effort to cease conflict between yourself and a rival, um—",
293,63,"And so the different nations have been using this technique for years to, umn, meet with their enemies and discuss terms of peace with them in this place where they could be killed at any second. And in humbling themselves like that, uh, they are able to find sort of the peaceful accord that this world has come to. Um. And so you—",
294,63,Travis," [crosstalk] Griffin, is it possible that this might come up again sometime in the future?"
295,63,Griffin, It’s about to come up in the next ten seconds.
296,63,Travis," Oh, okay."
297,63,Clint," And we have to, we have to do it naked, right?"
298,63,Griffin," That’s up to you and your Lord? Yeah, it could be, maybe, if you want."
299,63,Justin, Sometimes people draw the things that we say with our mouths. I’d rather—
300,63,Griffin, That’s the other thing.
301,63,Justin, This not be something that we—
302,63,Clint," Okay, not naked. Not naked. Pants. Pants."
303,63,Griffin," Pants only. Alright, that’s fine. And so you make it to the end of this year, and you are called to the Abbess’ quarters once again. And when you get there, the rest of the crew is there also, waiting for you. And this is sort of your graduation, Merle. And in order to get the Light, you will need to use the power of Parley right now to make peace with your rival."
304,63,"And thinking about it, and sort of I think you get some pressure from Davenport and Lup and Barry. They see this as an opportunity to talk to the Hunger, to find something in there that you can converse with with Parley and try and find peace, because you haven’t been able to outrun it or escape it or kill it, and so maybe this is the option. And so that is the request that is put before you.",
305,63,Clint, This feels like Michael Jackson’s Bad video.
306,63,Griffin, In what way does it possibly feel like Bad.
307,63,Travis," [crosstalk] Does it? Wait, what?"
308,63,Justin, Is it-- do you mean Remember the Time?
309,63,Clint, Is that it? Is that [crosstalk]
310,63,{33,57}
311,63,Travis, Or Smooth Criminal?
312,63,Justin, It’s the worst video he’s ever made.
313,63,Clint," Oh, with the-- when they’re in the Egypt, and the Sphinx--"
314,63,Justin," Yeah, that’s his bad video."
315,63,Clint," Yeah, that’s what I was thinking of, the one where they’re dressed up like pharaohs."
316,63,Travis," No, that also doesn’t track. Hold on. None of this tracks."
317,63,Griffin," No, none of this really makes sense. This doesn’t--"
318,63,Travis, Maybe it’s like Thriller.
319,63,Clint," Hey, hey, whose adventure is this?"
320,63,Griffin," I mean, right now it’s Merle’s."
321,63,Clint," All right, I’ll [clears throat]. Let me prepare myself for Parley."
322,63,Griffin," Keep in mind, I wanna make sure the rules of this are clear. You do this and this power allows you to basically pull in somebody who you want to make peace with in this extradimensional space. And in this space, you can talk to them and make peace with them, but at any moment, they could kill you, and you can’t touch them. That act of humility is what is sort of the crux of that peacemaking process. So every time you use this, you are rollin’ the dice, so to speak, no pun intended."
323,63,Clint," Oh god. Wait, really. No, come on. There’s dice rollin’? Come on, Ditto."
324,63,Griffin, [amused] There doesn’t need to be. 
325,63,[Clint sighs in relief],
326,63,Griffin," So, um. Yeah, what do you say to this proposal?"
327,63,Merle," What do you guys-- who do you think I oughtta talk to? You know I had that beef with that guy, that guy--"
328,63,Travis, Greg Grimaldis.
329,63,Merle, You remember the guy that sold me those bad wheels? That’s-- I really hate that guy. I got beef with him.
330,63,Travis," Wow. Really. Did you study at UCB, Dad? You're amazing."
331,63,Justin," To be fair, to be fair you probably should have known that Bad Wheels were unlicensed Hot Wheels that were going to fall apart immediately."
332,63,Clint," Bad Wheels, get the track."
333,63,Justin, They say Bad Wheels right there on the package.
334,63,Clint," Yeah, that’s true. Alright, who do you-- "
335,63,Merle, Who do you guys think?
336,63,Griffin," Lup chimes in and says,"
337,63,Lup," I wouldn’t hate if you did Greg Grimaldis, but I feel like that might be a wasted opportunity."
338,63,Merle," Yeah, yeah."
339,63,Lup," I mean, it’s the Hunger, Merle. We have an opportunity to learn something about the Hunger that we could maybe use. If you pull them into this space and talk to them for a while, and just ask them questions about themselves, anything we learn about the Hunger is a potential tool we can use to stop it someday."
340,63,Magnus," Not only that, but even if you die, we just get on the ship and we fly away. I mean, we’ll be back, so like--"
341,63,Lup," Yeah, exactly."
342,63,Magnus," It’s win-- well, not really like win-win. More like win-neutral. "
343,63,Merle, You know it hurts. You remember that it hurts to die.
344,63,Magnus," No, yeah, I've done it a lot, but don’t be a--"
345,63,Merle," Yeah, I know."
346,63,Magnus," Don’t be a, you know, coward. Come on."
347,63,Taako, I left the room!
348,63,Magnus, Taako’s--
349,63,Merle, Where the hell did Taako-- Taako!
350,63,Magnus, Taako’s gone.
351,63,Taako, I left the room! Boring.
352,63,Clint, God.
353,63,Taako, It got boring.
354,63,Magnus," It got boring. Apparently it got boring. So you know what, here’s-- I say you do it, because if you don’t, we won’t get the Light, and also it would make for bad podcasting."
355,63,Merle, All right. Um. All right. I peel off my shirt.
356,63,Magnus," Whoa, uh--"
357,63,Merle, And my socks and my shoes.
358,63,Taako, I left the room again! I double left! I double left the room!
359,63,Griffin, Taako’s two rooms away.
360,63,Travis, [crosstalk] Taako’s two rooms away.
361,63,Clint, We’re livestreaming this so they can see it.
362,63,Griffin," As you're prepping, Barry walks over to you and he’s like, "
363,63,Barry," Merle, I-- this is really brave of you, and I'm really, I'm very, I'm proud of you, I guess. I just-- remember, any piece of information you get is something we can use. Find out what the Hunger-- find out what it is. Find out where it came from. Find out its weaknesses. Find out why it’s-- what’s its motivation? Why is it doing what it does? Find out the source. If you can find that stuff out, Merle, then we might be able to find out what we need to do to kill that thing once and for all."
364,63,Magnus," And this might be tough for you, but maybe try not insulting it?"
365,63,Merle, God...
366,63,Magnus, Maybe try not being incredibly irreverent.
367,63,Taako, Don’t be yourself.
368,63,Merle, You're taking away my strongest cards.
369,63,Magnus, Well.
370,63,Merle," Alright, what do you-- the only one I haven’t heard from. Lucinda, what do you think?"
371,63,Griffin, Nope.
372,63,Travis, That’s not her name.
373,63,Merle, Lu--
374,63,Travis, You know it. Come on.
375,63,Merle, Lucretia!
376,63,Travis, Yeah.
377,63,Justin, There it is.
378,63,Merle, Lucretia!
379,63,Griffin," She walks over and says, and she kind of kneels down and she says,"
380,63,Lucretia," Merle, I know that memory is a problem for you sometimes. I make you that gingko tea from time to time to help out, but it’s imperative that whatever you learn you bring back to me so I can write it down."
381,63,Griffin," She says,"
382,63,Lucretia, I’m-- Good luck.
383,63,Griffin," And stands up. What does this look like? What does it-- When you use this ability, when you use Parley, what does it look like to everybody else in the room? As you are sort of spirited away to this extra-dimensional place?"
384,63,Clint," I am… you can still see my outline, but it’s like there’s no color at all. It looks like an outline of a dwarf made of smoke."
385,63,Griffin, Interesting.
386,63,Justin," I was hoping he would just sort of go glassy and fall on his face, is what I was kind of praying for. Oh well."
387,63,Clint, There’s that. That could happen too.
388,63,Justin, Oh well. I like Dad’s.
389,63,Griffin," You see Merle I guess take his shirt off and sit down on a comfortable pillow, sort of in the center of the room, and you watch as in the blink of an eye, you just--you kind of see his outline. And you kind of see just this smoke, this fog that is just sort of floating there where Merle was. And it’s more or less like static, and it’s, it’s, it’s kind of weird. It’s not drifting away in any way. It’s just in the shape of Merle, a Merle-shaped cloud of fog."
390,63,"Merle, what you see is also-- [music begins] in the blink of an eye you are looking at this room, the Abbess’ quarters, and you blink, and you're in a completely different place. You are sitting in a very comfortable, very what we would think of as modern sort of office chair in front of a long table, and you are sitting in a boardroom. You're sitting in a boardroom, and it’s a really fancy boardroom.",
391,63,"You look out the-- one of the walls, the exterior wall of this room is just one huge window. And you can tell you're really high up. You're like 80 stories up in this boardroom of this massive skyscraper. And it’s pretty dim in this room, but the sunset outside is casting a calming orange light into this room, drawing long shadows across this conference table.",
392,63,And you're seated at one end of this table {40,"38} and when you projected this space, when you used Parley, you were just focusing on the Hunger. And what is sitting in this chair, at the other end of the room, with his back to that big window, is a man, a human man. And he’s got a fairly slim build. He looks to be in his early 50’s or so. His salt and pepper hair is extremely well-manicured and his face is smooth. He’s wearing a sharp gray suit with a really stylish narrow black tie and the most expensive pair of shoes you've probably ever seen. He looks really slick. And most of all, he looks surprised."
393,63,Travis, It’s Sterling Cooper.
394,63,Griffin," And he clears his throat, and he tries to speak, but no sound comes out. He just kind of croaks. And he tries that a few times, and kind of looks exasperated, and then all of a sudden, there’s a pitcher of water on the table, and he pours himself a glass, and he takes a drink, and he clears his throat again, and he says-- I gotta think of what this guy’s voice is gonna be, because I'm gonna be using it a bit."
395,63,Travis, I'm really embarrassed because I didn’t realize Sterling Cooper was the name of the agency. I was trying to think of--
396,63,Griffin," And not the, yeah."
397,63,Travis," Roger Sterling. Anyways, I’m going to stick with Sterling Cooper, though."
398,63,Griffin," This very well-put together guy says,"
399,63,The Man," Okay. Okay, this is-- this is new. Were you the one that brought me here? Where-- where are we right now?"
400,63,Merle, (as Clint) This is the Parley room.
401,63,The Man, The parlor room?
402,63,Merle," (as Clint) Yeah, let’s go with that. The Parley parlor. This is the Parley parlor."
403,63,Justin, I jump into the vision.
404,63,Taako," Merle, why do you sound so weird?"
405,63,Merle, It’s the Parley parlor.
406,63,Travis, There we go.
407,63,Merle, And this is my character voice. I would like to introduce myself.
408,63,The Man," Yeah, what’s your-- what’s your name?"
409,63,Merle, Highchurch. Merle Highchurch.
410,63,The Man," [interrupts] Your name’s Highchurch Merle-? Oh, you were doing-- okay."
411,63,Merle," And I have to ask. Do you mind telling me your name? We have labels, and I assign, you know, labels, just for people’s actions. It’s kind of a thing I do. So what actually is your name?"
412,63,The Man," Uh, I don't know that I feel comfortable telling you my name just yet. We’ve only met, and sorry, this is really weird. I haven’t actually, um, been any-- anywhere in a while, so--"
413,63,Merle, Sure.
414,63,The Man," How did you find me? How did you pull me out, I guess?"
415,63,Merle," I have been kind of following your career, following by leading [laughs], I guess. And I am, well, I don’t always agree with everything, but I’m kind of a fan. I’ve been kind of observing, and it’s just I really want to get to know you. I think in all walks of life it’s important to know the people that you're dealing with. {4358} And, so, I wanted to get to know you a little bit better. I wanted to get to know the guy behind the suit, behind the tie, and the really nice footwear."
416,63,Griffin," He kind of chuckles. And as he chuckles, he kind of catches himself. He’s like,"
417,63,The Man," Oh, sorry. I just realized I haven’t laughed in awhile, or… I guess I haven’t done anything for a while for that matter. You're not the first fan I've had or the first one to approach me, although it, again, it’s been a while. Just to check, can I go whenever I want? I think I'm gonna head out."
418,63,Merle, Oh.
419,63,The Man," This has been novel, but I can’t risk getting caught in some sort of weird pocket dimension."
420,63,Merle," Oh sh- well, listen. I'm not gonna hold you here against your will. I don't want anybody to hang around, but I am offering kind of a quid pro quo exchange of information. I mean, you must be extremely interested in me and my friends, since, well, you've been hunting us for years and years and years."
421,63,The Man, I’ve been hunting you?
422,63,Griffin," He says, and he--"
423,63,Merle," Mm-hmm, yeah. Yeah."
424,63,Griffin, I think he stands up from the office chair he’s sitting in when he says that.
425,63,The Man, What are you-- what are you talking about?
426,63,Merle," Well, the thing is, you've kind of been, well, chasing me and my friends, my family, my team as we’ve kind of hopped, skipped, and jumped around to different planes. And so yeah, I just thought maybe you’d like to get to know the guy you're tracking down and actually have killed [laughs] a buttload of times."
427,63,Griffin," He says,"
428,63,The Man," Doesn’t seem like it’s taken, if I've been killing you all these times, but--"
429,63,Merle," Well, I got better."
430,63,The Man," Well, if I've been hunting you, I don’t think I need information. It kind of seems like I've got you right here."
431,63,Griffin," And he extends his hand, palm first, and you see this sort of black fire surround his hand and you feel this incredible pain as black fire spreads throughout your body from your insides out, just killing you in a second."
432,63,[music begins],
433,63,"And that, Merle, is how your meeting ended. Your first conversation of many that you would have over the following dozens of cycles with the man who became the Hunger.",
434,63,{46,51} Money Zone begins
435,63,Griffin," Hey folks, it’s Griffin McElroy, your Dungeon Master, your best friend, and your oatmeal eater… which I-- it’s not my most creative, I just ate a big bowl of oatmeal.  Thanks for listening to episode 63 of The Adventure Zone, it’s Episode 4 in our Stolen Century Arc, I’d wager there’s only a coooouple episodes left in this arc that’s gonna answer all the questions you have about everything so far and get us all caught up and ready to go for the finale, but as always I’ll let you know when that finale’s comin’ up."
436,63,Naturebox (www.naturebox.com/adventure),
437,63,MVMT Watches (www.mvmtwatches.com/adventure),
438,63,{51,46}  Money Zone ends
439,63,[music playing],
440,63,{52,06}
441,63,Griffin," And you wake up in the next cycle and relay some of this information to everybody else. And Barry seems disappointed. He says,"
442,63,Barry," Merle, I'm sorry, but can you try again? I know that sounds horrible, but it seems like we got a direct line to this guy, whoever he is, and I think-- I think maybe there’s another tack you can take here and get some information. Can you please try again?"
443,63,Merle," Yeah, let me change my pants and then I'm off. Pants changed."
444,63,Griffin," What’s your-- when you do this, do you wait for the end of the year to-- the end of the cycle to have this meeting with the Hunger, or do you wanna just get it out of the way, knowing that, like--"
445,63,Clint," No, let’s get right back in it. Let’s get right back in it."
446,63,Griffin," The very next cycle, you are in that space. You are in that high-rise conference room, and this time when this man sees you at the other end of the table, he stands up right away, and he says,"
447,63,The Man," Okay, okay. Interesting. It seems like you were telling the truth. Sorry about killing you before, I just-- I needed to know that I could get out of here if I need to. Now I know the rules, and now we can talk, I guess."
448,63,Merle," And now, maybe, you have a little bit of an inkling into how serious I am. You’ve heard people say “on my life”? Well that’s just what I'm doing. This is on my life. So listen, you can kill me anytime you want to. But it’s obviously not lasting. And I would think that if you were working so hard to kill me, you would want it to last."
449,63,The Man," Yeah, that is a good point. Well, I think an exchange of information would be good. Merle, you said?"
450,63,Merle," Actually, I said Highchurch, Merle Highchurch, but yeah, yeah. Merle."
