,episode,speaker,lines
261,84,Errol," Here’s what I’m stumped about. I think we can rule out the fact that Dylan just killed Jeremiah because he didn’t like him. I think what we know now, Dylan probably didn’t do it. At least not for the reasons that we assumed at first glance. Problem is, if this was a business thing, someone needed to know where Dylan was gonna be and where Jeremiah would be in order to stage this thing the way they wanted it to."
262,84,Augustus, Indeed.
263,84,Errol," I don’t see how this was done by anybody but somebody who was familiar with them. Somebody who would know how to set this framing up the way that it turned out. So… that’s what I’m torn between. I think the business problem is probably— the business thing is probably the most likely answer for this, but it would need to be somebody who also knew the two of them pretty well."
264,84,Gandy," And speaking of business, our job here is to… find out and then to prove that Dylan didn’t do it. The only way we’re gonna do that is to find out who did it. We have no evidence to submit at all to get Dylan off the hook. And that’s what we were hired to do."
265,84,Errol," Yeah, we ain’t close. I think at this point, two things probably worth doing. I think it’s probably worth talking to the Banshee, and speaking of…"
266,84,Griffin," And I unclasp a pendant that I have around my neck and hand it to Gandy, and I say"
267,84,Errol," This didn’t work, uh, didn’t really keep me hid from the Banshee in the way that you said it would, so that is as you might imagine, pretty disappointing to me. But um…"
268,84,Gandy," Well, if— if you remember the warranty… You know, it’s— it wasn’t a hundred percent."
269,84,Travis," And if I may, Griffin, so that it doesn’t seem like Gandy is a shitty wizard, just because you couldn’t be located magically doesn’t mean that there isn’t other, like— that’s a thing that people often take for granted in this world with magic and wizards and location spells [Griffin That’s fair.] and everything is like, private eyes can just find you."
270,84,Griffin," Yeah, that’s fair. I still give it back to her and say like"
271,84,Errol," So uh, I think we’re probably square on that sort of— that sort of facet of our arrangement."
272,84,Gandy, I’m sorry it didn’t help…
273,84,Errol," Aw it’s fine, it’s fine, it’s not your fault."
274,84,Gandy," I’ll give it to Uncle Oni, he can run through the specs and see— What about this glove thing? Would it be worth our time to have Uncle Oni take a look at it? I still have a couple of more questions I can ask him."
275,84,Errol," I mean, I snorted up its stink pretty good, and there’s nothing on it. No blood or nothing. It’s been cleaned, but the only traces I’m picking up on it is Liam. I don’t know if your magic doll can figure out if it was used for a murder recently, but I think—"
276,84,Augustus, I don’t know how they could clean the blood and not the silver dust.
277,84,Errol," Yeah, it’s a bit confusing, but let’s not dive too deep into that. It might upset the apple cart. I think it’s worth talking to the Banshee, and now that we do know Jeremiah and Ann were hitched, probably worth going to talk to Dylan again, don’t you think?"
278,84,Augustus," Yes, I think that that might be worth pursuing."
279,84,Errol, Y’all want to split up?
280,84,Augustus, I suppose.
281,84,[Gandy sighs],
282,84,Errol," I mean, I miss y’all, I feel like we haven’t had our “us” time."
283,84,Gandy, I’m not in favor of splitting up.
284,84,Errol," All right. Yeah— here’s the thing. I certainly don’t want to go up against the Banshee without our full sort of capabilities as a [Gandy Of course.] crime fighting unit, as it were. So why don’t we go talk to Dylan, let him know what we know, and then head on up to Banshee HQ. I got a business card here, I guess it’s got an address on it."
285,84,Travis," Just to clarify, when you— the instructions on the back of the card do explicitly say to come alone."
286,84,Griffin," Yeah fuck off, no way. [Theme music fades in] I mean, cool, thank you business card, but eat my shorts."
287,84,Errol, Let’s go talk to old Dylan first and see what we can get out of him and then go figure out a plan to take on the Banshee.
288,84,{28,20-3326} AD BREAK
289,84,Travis," So you head into the sheriff’s office. Connors is there, of course, at his desk. He’s got his feet up on the desk but still very much awake, just kind of keeping an eye on everything. Do you want to check in with him or just head on over to Dylan? "
290,84,Justin," I feel like it might be worth— If we have time, like, is it worth seeing if he’s discovered anything? Because they were working on it too, weren’t they?"
291,84,Griffin," Yeah, we catch the sheriff up on everything we’ve learned so far. [Travis Yeah, yeah, yeah] Do we want to tell him about the marriage? I don’t see any reason to keep that a secret. "
292,84,Clint," I think the more that we can use him, with his prescient powers to know if people are lying or not—"
293,84,Justin," To what extent did they— I mean, he’s dead, right? I mean, what does it— I think it’s okay to— How much did he— did she want you to keep it a secret?"
294,84,Griffin," Uh, she didn’t seem eager to tell me, but she didn’t tell me explicitly not to tell anybody. I think it’ll— [Justin I think it’s fine] Oh no, she DID. She said to keep it a secret. Oh, well."
295,84,Justin," She said to keep it a secret? Okay, then don’t mention it. I mean, it’s your information to do with what you want. I wouldn’t, but it’s up to you."
296,84,Griffin," Okay. Yeah, Okay, alright, then we don’t tell him about that part. We tell him about everything else."
297,84,Connors," Well, you know it— I didn’t think— If I’m being honest, I didn’t think it was Dylan. Didn’t seem like him, didn’t seem like he’d do it. You got any leads on who you think might’ve done it?"
298,84,Errol," Well, we’re gonna go talk to the Banshee, and that’s gonna go probably about as well as you’d expect."
299,84,Connors, Jesus.
300,84,Errol," Yeah, no, yeah, this one got a little buckwild."
301,84,Connors, The Banshee’s here?
302,84,Errol," Uhh, apparently, yep."
303,84,Connors," I don’t know if I’d do that, but it’s your job, you do what you want. We ain’t been able to uncover much more than you. We talked with Silver, he said that, you know, he couldn’t be sure, but when he walked up, Dylan didn’t— You know, he saw Dylan from a distance and couldn’t tell if he had any blood on him or not. That just goes to support the theory that it weren’t Dylan. And then, you know, he saw Dylan over the body, kinda pick it up. And as he got closer, Dylan definitely had blood on him at that point. Once again, can’t be sure, he’d been drinking. And so it’s not a super reliable witness, but it do— It goes into the column of support for “Dylan didn’t do it”, so that’s good. But unless— here’s the thing people in town here, if we don’t have somebody to give ‘em that did do it, the word of Silver ain’t gonna cover it, you know what I mean? It’s a good— I don’t mean to knock it, it’s a good start, you’re doing good work. If there’s anything I can do to help you, let me know."
304,84,Errol," Thanks, Dad. Yeah, we’re gonna keep pounding the pavement on this. You know, I feel like it’s close. Ohh, do I feel like it’s real close."
305,84,Augustus," It’s right there on the tip. Okay, who are possible suspects? Who do we have? Who do we know? Liam."
306,84,Gandy, Liam.
307,84,Augustus," Any other names? Any— okay, let’s rule out by class. Any Fangs?"
308,84,Errol, I mean…
309,84,Augustus, That might be able to benefit?
310,84,Connors," The only Fang would be Nox right? He’s the Blackwell’s kind of second, but he’s the most loyal— I don’t even think it’s worth looking into. But he’s the only, like, other powerful respected Fang, but not— trust me. Wouldn’t hurt Jere— he’s Jeremiah’s godfather. Wouldn’t have—"
311,84,Errol," Sheriff I got a— Yeah, I gotta tell you, pretty much everybody in this town has somebody who’s gonna vouch for ’em and talk about what a righteous dude they are, so—"
312,84,Augustus, Right.
313,84,Errol," We can’t really take that into account. ’Cause somebody in this town is not a righteous person, so—"
314,84,Augustus," I’m sorry, I’m taking out my spectral notebook, and I’m putting a little star next to Tommy Nox. And I’m sorry, do not take this personally against your word, sir…"
315,84,Connors," Listen, fine. We just got limited time here, but it’s up to you."
316,84,Augustus," Alright, first—"
317,84,Griffin, What time is it?
318,84,Travis, I think at this point you’re in like the 3 to 5 [a.m.] period.
319,84,Augustus, First…
320,84,Connors, Well you got— we can’t… can’t take Dylan off the table.
321,84,Errol," Yeah, I mean…"
322,84,Gandy," We can take Johnny Mathis off the list, ’cause he’s deceased."
323,84,Augustus," Indeed, he’s deceased. Any other Furs that might have something to gain here?"
324,84,Travis," And just to clarify, ’cause that was our first mission, Johnny Mathis was Abigail’s husband previously. I don’t think we had said it out loud on the  show yet. I’ll let everyone know at home we’ve already met Jonathan…"
325,84,the ghost!,
326,84,Clint, [Imitating dramatic music] Bum bum bumm!
327,84,Griffin, Really?
328,84,Travis, Yeah. That was the ghost that—
329,84,Griffin, That was who that—?
330,84,Travis, Yup.
331,84,Griffin, He seemed awfully cavalier about his son being framed for murder.
332,84,Travis," He didn’t know anything about it, remember? He said he didn’t know— all he knew was that the spirit had come through and had felt surprised and hurt."
333,84,Griffin," Interesting, okay. I completely missed that."
334,84,Errol," All right, we could sit here and list names for, you know, until the sun comes up, and then we have failed, so let’s just get back to it."
335,84,Gandy, We do have an eyewitness that we really haven’t gotten anything out of? Dylan?
336,84,Augustus," Yes, I believe it’s time to question young Mathis again."
337,84,Travis," Okay, so you head over to the cell where he is still faced away from the cell. What do you do?"
338,84,Griffin," First off, I say"
339,84,Errol," Sheriff, I know this is a bit strange, but would you mind giving us some privacy? I don’t think he’s gonna wanna talk if you’re looming over him."
340,84,Connors," Yeah, yeah, yeah, you got it. I’ll be out on the porch, you just come get me when you’re done. And don’t— Don’t do anything I’d have to come and shoot you for or arrest you for or nothing like that, okay? I don’t want you trying to break him out or any of that shit."
341,84,Errol," No, like— Yeah. For sure."
342,84,Gandy," [laughs uncomfortably] Yeah, we never even, [whispers] damn it."
343,84,Travis, He leaves.
344,84,Gandy," Dylan, we know about—"
345,84,Dylan, Leave me alone.
346,84,Gandy, Ann told us about the wedding.
347,84,Dylan, Tell me what she told you.
348,84,Errol," That she married Jeremiah in secret. That you were there and the three of you have been friends since you were just pups, so—"
349,84,Gandy, Said you were best wolf at the wedding.
350,84,Dylan, I... Yeah.
351,84,Errol," I can understand why you’d want to keep that a secret. I can appreciate you not wanting to talk to us earlier. But you gotta… I’m starting to see slivers of sunrise outside. You have not much time on this earth, my friend. And you gotta tell us something, you gotta give us something, Dylan. You were there. And we don’t think you did it, I swear to god. We just want need to know who did if we’re gonna save your skin."
352,84,Dylan," I loved... Jeremiah Blackwell. And… he loved Ann. And when they got married… Do you… Mr. Ryehouse, do you know— Have you ever, in a moment, been the most happy and saddest you’ve ever been in your whole life?"
353,84,Errol," No, Dylan, I can’t say I’ve had something as horrible as that happen to me. I’m sorry that you did."
354,84,Dylan," I… I was— I was at the bar drinking, and Jeremiah had said he wanted to celebrate, and I told him I couldn’t. I just needed to be by myself for a while. And if I’d been with him… Maybe I could’ve saved him. Maybe… It’s… I could’ve saved him, and he’d still be alive, and I deserve to be in here, Mr. Ryehouse."
355,84,Errol," Aw, bud, listen Whoever wanted to kill Jeremiah Blackwell was gonna find a way to do it, no matter what. I know that’s tough to hear, but there’s folks in this town who are exceptionally good at doing the kind of stuff what happened to Jeremiah. So you can’t take that one on the chin. You were with him at the bar? They kill both of you."
356,84,Dylan," Then I’d be dead too and I wouldn’t have to feel like this anymore, Mr. Ryehouse. It’s hard. This is the worst—"
357,84,Augustus," Do you know what makes us laugh? There isn’t a lot; once you come over to my side, we don’t have a lot of jocularity over here. Probably won’t come as much of a surprise. The thing that we find funny over here— one of the things, we have some prop comedy and what have you— one of the main things that we find funny over here is when human beings on the mortal coil believe they have the time to punish themselves for things that are not their fault. And you don’t. Trust me, I’ve been over here a while and I’ve seen enough of the mortal world and the spectral world to know that your time is fleeting. Your time, in fact, may be more fleeting than most. You do not have the moments to continue to flagellate yourself for this crime that you are not the perpetrator of. Now, what is the antidote to despair? Well, my friend, it is action. And that is what we are trying to take on your behalf. And the behalf of those you care about. So. We’ll ask you one last time, Dylan who killed Jeremiah Blackwell?"
358,84,Griffin, That was fucking great.
359,84,Clint, That was.
360,84,Dylan," If he knew about the marriage, Liam— He loved my sister, and he hated Jeremiah. "
361,84,Errol," We can go talk to Liam. We can sniff him out. I gotta ask; you think this was because of the marriage? Because this whole time, we’ve been assuming it has something to do with the business arrangement that your folks and the Blackwells folks are trying to whip up."
362,84,Dylan," I don’t know. It’s hard for me to think of it as being about anything but the marriage, you know what I mean? I guess it could be about the business, but I don’t know who would have issue with that—"
363,84,Augustus, Would Liam benefit— Would Liam stand to benefit from a fusion of the Fangs and the Furs and their mining interests?
364,84,Dylan," Of course, he’s the head of the workers. He’s been negotiating on behalf of them, and because he’s both a worker and one of us, he’s kind of had an in there that’s made it a little bit easier to work with and… Yeah, I mean, I don’t see why he’d be against, you know, better conditions for the workers and better pay. Everything that’s been negotiated—"
365,84,Gandy," So Dylan, does this— Dylan, help me figure out the timetable. So you didn’t see it happen, but you found him, you saw him in this terrible condition, correct?"
366,84,Dylan, I… I found him bleeding out… And I held him as he died.
367,84,Errol, [quietly] Jesus.
368,84,Augustus," All right, I think we have everything that we’re going to be able to withdraw here from this scenario Mr. uh, Mathis. Thank you for sharing that with us."
369,84,Errol," Yeah, we’re gonna go… we’re gonna go finish putting this thing together, but [nervous laughing] I just decided while we were talking to you that no matter what happens, you ain’t gonna die tomorrow. So I don’t know what that means yet, I guess we’ll have to figure it out when the sun comes up, but you get some rest."
370,84,Augustus, Let’s just hope there’s a bell nearby wherever the—
371,84,Errol," Oh, come on."
372,84,Augustus," —the hanging is going to happen, and then you’ll be able to—"
373,84,Gandy, And it’s gotta be within arm’s reach of him have him throwing the gun.
374,84,Augustus, Within fling’s reach.
375,84,Gandy," Yeah, fling’s reach."
376,84,Errol," It’s an inside joke, Dylan, we will catch you up tomorrow—"
377,84,Gandy," Not really, that inside, that inside, really, Dylan if you were down on Carrion Str—"
378,84,Errol," When you are a free man. Okay, let’s gooo."
379,84,Travis," Okay, so what’s the plan re the Banshee?"
380,84,Justin," The Banshee, right?"
381,84,Griffin," Yeah, I think that going to the Banshee is the next thing, right? Because after we go to the Banshee, I feel like we’re gonna know, if not everything, enough to know who to go for."
382,84,Travis, Cool.
383,84,Griffin," And so we can go talk to Liam now, but like, why not go rule out this other thing first, and then we can make a call?"
384,84,Justin," I’m gonna be seen and heard, but not felt. I was going to do the invis thing, but with a name like “the Banshee,” I’m pretty sure he’s gonna be able to know sort of my whole thing. Sort of, you know, my… bag o’ tricks."
385,84,Griffin," You’re… what you do. Um, I mean, he told me to come solo, so I think the best thing is for me to appear to come solo and have the two of them in sort of… ready to launch a fucking rescue mission, as will probably be required. Gandy, I don’t know what you are capable of in that department. I don’t know if you have, like, stealth capabilities."
386,84,Clint," I have a— she has a spell called Veil where you can spend one hold to make yourself invisible from sight, but it’s just for a few moments, so I don’t know if that’s gonna be so great—"
387,84,Travis," I mean, that could give you the advantage if you want to come in and kind of scope out before revealing thyself."
388,84,Clint," Well, like everything else, it’s tied to one of her artifacts, so, I would love to try to do that [Travis Yes!] and work undercover."
389,84,Griffin," Yeah, let’s do that. Um—"
390,84,Travis," Okay, so, as you head out the door towards— you pass Connors on the porch."
391,84,Connors," Hey, were you able to get much out of him? Did he say more to you than he would say to me?"
392,84,Errol," Uh, we got— Yeah, we got a lot. Listen, you’re not gonna hang him in the morning. I know you’ve got responsibilities and stuff but—"
393,84,Connors, It ain’t me! How many times do I have to tell you?
394,84,Errol," No no no no, I’m not saying— I ain’t putting the blame on you, I know you’ve got a job to do and I know this town’s got needs. I’m just saying… that it can’t happen. So."
395,84,Connors, I’ll keep him safe.
396,84,Gandy," Sheriff, we’re— we are not of the law like you are. We’re just kind of hired guns, we come in and we do our job, but you are responsible for justice. And if that young man dies, that’s not justice at all. So keep him safe."
397,84,Connors, I will.
398,84,Griffin, And we head to the Banshee!
399,84,Travis," So you approach a house, I assume you follow the instructions, the— it’s in what appears to be an abandoned home, all boarded up, the roof is caved in. And the instructions lead you around the back of the home to the storm cellar door."
400,84,Griffin, Fuck.
401,84,Travis," The lock is rusted, but when you try the door you find that the actual arm that the lock is on isn’t attached to the door, it opens cleanly. And as you head down you find a well-lit kind of foyer? Where Ellis and Blackwood are waiting for you, and I assume, tell me the prep."
402,84,Clint," Well, I sh— I need to. I’ve got to channel to do the spell, so that is a nine plus two for mind, that’s 11."
403,84,Travis, You’re totes veilèd.
404,84,Griffin, What’s that give you?
405,84,Clint," Okay, all right, all right, Veil. “Spend one hold to make yourself invisible from sight for a few moments.”"
406,84,Travis," Okay, you’ve done that."
407,84,Clint," And so when I channel, if I roll 10-plus, I get three holds."
408,84,Justin, There we go.
409,84,Travis, Okay.
410,84,Clint, Okay. All right.
411,84,Travis, So you are veiled.
412,84,Griffin," Yeah, so you could just keep veiling yourself."
413,84,Clint," Okay. And is Augustus, are you invisible?"
414,84,Justin," Uh, you know I wasn’t gonna be, but if you’re gonna be it seems weird for me to not be."
415,84,Clint, Okay.
416,84,Griffin, I fucking love that scene of the two of you just like poof! “What’s up?”
417,84,Justin," Alright, yeah."
418,84,Griffin, I make as much noise coming down the stairs as I possibly can to hide the fact that my two companions who definitely can still be heard creaking the floorboards are coming down also. So I’m coming down like
419,84,Errol," Hey it’s me Errol! I'm coming down, don’t shoot okay? I’m just coming down the stairs right now, this is a pretty nice little setup you got here, and I’m excited—"
420,84,Griffin, And I reach the bottom of the staircase and everybody else does too—
421,84,Ellis, Mr. Ryehouse!
422,84,Errol, Looks great. Yep.
423,84,Ellis," I’m so glad you decided to come. Also, before I lead you in to meet the Banshee, I just want to say no hard feelings. I forgive you for not trusting me. It’s something that I have been working on, I’ve been talking with Blackwood about it. I was very upset at first, but I know how we can come across. And I just want to say—"
424,84,Travis, And Blackwood kind of lays a hand on Ellis’s shoulder.
425,84,Ellis, Thank you. I forgive you. I forgive you.
426,84,Errol," Yeah, thanks, I was really concerned… about that. So uh… yep, I’m just— I’m here to talk to the Banshee, and—"
427,84,Ellis," Of course, of course. Right this way."
428,84,Travis," And he pulls back a curtain, and you enter a room. And there is a well-polished table, richly decorated room. It smells nice, you know, a little floral but not sickly sweet. Just enough that you can tell someone took the care, you know, to kind of spruce up the place a little bit. And sitting at the table is a little old woman, about 65 I would say? And she gestures for you to sit at the opposite end of the table."
429,84,Griffin," Uh… I do? Ensuring that I make a lot of noise as I like scoot the chair back— I’m very concerned that somebody’s gonna hear my friends, so it’s just like [slow chair scooting noise] as I scoot it back, and I sit down and uh—"
430,84,Banshee, Mr. Ryehouse. Ho! I am so glad to finally meet you.
431,84,Errol," Yeah, I bet. So uh, yeah, nice to meet you too, uh Banshee?"
432,84,Banshee," Yeah. That— I mean, listen. I’m excited to meet— I’m not going to give you my name. Listen, at this point I identify as Banshee more than my birth name anyway, so it’s— this is fine. Would you prefer Errol or Mr. Ryehouse or what should I call you?"
433,84,Errol," I mean, you can call me Dave if you can help me figure out— on the case I’m working on right now."
434,84,Banshee, [Laughs] Dave! That is funny! Fun-ny.
435,84,Errol," Hey, you like that one."
436,84,Griffin," Before we go any further, can I actually roll Face to a Name to see?"
437,84,Travis, Absolutely.
438,84,Griffin," That is a one, uh-oh! And a six. So that’s a seven, and I add my— what faction are they?"
439,84,Travis," Uh, well. "
440,84,Clint," Spectre, right?"
441,84,Griffin," Well, we don’t know that. Doesn’t seem like it."
442,84,Travis, They are Night.
443,84,Griffin, Night. Okay. Uhh… okay. So that is a… that’s not good.
444,84,Travis," You rolled a one and a six, so that would be a seven."
445,84,Griffin," Yeah, so it’s a seven, plus one is an eight."
446,84,Travis," Okay, so here’s what you know about the Banshee."
447,84,Griffin," Daria Cross was the wizard who tried to transform me, and she was a part of the Banshee’s like, team, or whatever and was kind of excommunicated after doing this spell to try to, uh, try to revert me back to a human— permanent human state. And because of that, I have been hiding Daria in Carrion Street [Travis Yes.] and that is why— that is what I remember to be sort of our main point of contention."
448,84,Travis," Now, here’s—"
449,84,Griffin," But I don’t know anything about, like, their operation here."
450,84,Travis," Right, so the Banshee is kind of a fingers-in-a-lot-of-pies criminal boss. And I will say that the reason — to flesh out the backstory between you and the Banshee with what you’ve just given me — I will say that maybe the Banshee was trying to leverage the fact that they knew you were a werewolf and wanted to be a politician, to maybe try to get you in their pocket a little bit. And that’s why [Griffin Love that.] when this spell happened to cure you of that and kind of rob them—"
451,84,Griffin," Oh, that's good, Travis! "
452,84,Travis," Hey, thank you very much."
453,84,Griffin," So it’s not a like, they were upset that one of their team members did a job outside of the purview of the Banshee, but rather that because of what Daria did, they lost a foothold. That’s fucking great, yeah."
454,84,Travis," Hey, thank you very much! And so the thing about the Banshee is nobody knows much about them. And everybody knows of the Banshee, everybody knows the kind of crime ex— you know, network and web, but as far as personal information goes, nobody seems to know anything about the Banshee as an individual. But yeah, other than that you don't know much about the Banshee."
